_id,userId,approverUserId,userSkillId,status,createdAt,updatedAt,__v,comments,rating
9f73be349ae640a19adafed1,6612947faddf941b98f24d01,66129484addf941b98f24d5a,e6c61ba39fd34a58a87418d9,Rejected,2023-12-26T12:43:21.596683Z,2024-12-14T12:43:21.596683Z,0,Policy two nor increase garden bit gas people. So add can policy leave board. Save society result information.,3.0
dc17a4b5ef2d4a58b47d85dd,6612947aaddf941b98f24cbd,66080b1eb85746ebc7e4064f,70f8d50881d14c2ebacb32ce,Pending,2023-09-21T12:43:21.596683Z,2024-08-30T12:43:21.596683Z,0,,
2f309552193444619978a76b,66129489addf941b98f24d9b,66129471addf941b98f24c31,ef03e36f50804d679fdc021e,Approved,2023-04-16T12:43:21.596683Z,2023-05-14T12:43:21.596683Z,0,Office together president especially such idea remember. Between choice opportunity room site throughout. Daughter prevent until thus.,2.0
34649309b5fb473b81f988db,6612946daddf941b98f24be8,6612946faddf941b98f24c07,8ef9666823324cd5a17f51db,Rejected,2024-01-16T12:43:21.596683Z,2025-01-01T12:43:21.596683Z,0,Poor party draw see thank. Avoid give almost different region weight develop.,2.0
7afb7c77331646a3873f889a,66129479addf941b98f24cb1,6612947eaddf941b98f24cfc,9bb04aa4b7e14c40b51f2f31,Rejected,2023-06-20T12:43:21.596683Z,2024-04-04T12:43:21.596683Z,0,"South physical magazine employee high character oil. Any need along place military.
And rate store want rock. Detail east cut support hard support though commercial. Member age central.",1.0
cc4d97d35ce74c1a8617e8d8,66129470addf941b98f24c20,6612947aaddf941b98f24cb2,7c71e8fba41b4b0b87217563,Approved,2024-01-26T12:43:21.596683Z,2024-06-06T12:43:21.596683Z,0,"As do able its occur imagine. Reduce eye occur wonder sound.
Difference prevent eye account already. Animal major series short nature spring budget. Investment shake station.",2.0
1dddcd0b9d7947a1a3cf8a3c,66129472addf941b98f24c3f,66129475addf941b98f24c6c,97396021855042d38d0cace6,Rejected,2023-10-12T12:43:21.596683Z,2024-06-20T12:43:21.596683Z,0,"Even none mean people. Growth article term economic nature true religious.
In will course sea that present. Boy whether structure father us store. Young score beautiful professional plan wrong.",2.0
93a12405013f4178aeb5d03a,66129484addf941b98f24d57,6612947faddf941b98f24d05,7eb1a84f97544599b6b4de66,Rejected,2023-09-09T12:43:21.596683Z,2024-03-01T12:43:21.596683Z,0,Star staff stop whom couple local participant. West wonder agent save still.,1.0
3a8384c80eb842fc9f8ffb3e,66129478addf941b98f24c9e,6612947daddf941b98f24ce8,afc2849162a845c9a9aef942,Pending,2023-07-29T12:43:21.596683Z,2024-07-18T12:43:21.596683Z,0,,
b4d6900aaf944dc482d0e3b9,6612947aaddf941b98f24cb8,6612947caddf941b98f24cdf,78e7ad2b84bc4ac596ea9cbf,Approved,2023-10-17T12:43:21.596683Z,2024-07-08T12:43:21.596683Z,0,"Whatever need try anyone economy management case. Sister lot up out behind. Everybody born despite dream worry.
On decade box wind rise. Almost hit arrive region theory.",3.0
27ffd79579b9476782ef80b1,6612947caddf941b98f24cd2,6612946faddf941b98f24c0b,056771b405a0426185c3a5ae,Rejected,2023-05-20T12:43:21.596683Z,2023-07-28T12:43:21.596683Z,0,"Bring instead special professional this behind loss. Brother attention do much ahead.
Somebody to tell. However history majority think serve girl. Arrive entire term hospital.",3.0
ec80da2bdc9945bd897c7113,66129489addf941b98f24da1,66129480addf941b98f24d14,416f7628f90b4501863c5067,Rejected,2023-05-17T12:43:21.603289Z,2024-04-05T12:43:21.603289Z,0,"Care act teacher. Child sense mouth show study contain produce. Pass where research response worker individual fear.
Financial number fire nearly arrive best.",3.0
d0409a39195447de8785f38e,66129473addf941b98f24c50,66129486addf941b98f24d7a,7ad0e15042234dccb1406666,Rejected,2024-03-17T12:43:21.603289Z,2024-11-20T12:43:21.603289Z,0,"Ago year well sing image yes price. Conference take safe often left personal.
Heart force none wide school husband simple. Upon say current.",2.0
6f56779e9fd744c4827c6b94,6612947baddf941b98f24cce,6612947aaddf941b98f24cb9,5d26574475ab4485998fab1c,Pending,2023-12-02T12:43:21.603289Z,2024-08-22T12:43:21.603289Z,0,,
e83cf1c1b36b47e688a50c14,6612947caddf941b98f24cd2,6612946eaddf941b98f24bf7,3012b6e39abe46a59e48b73a,Pending,2023-08-19T12:43:21.603289Z,2023-11-25T12:43:21.603289Z,0,,
d37f6992220f49aaa1354c63,66080b1eb85746ebc7e4064f,6612947baddf941b98f24cc8,6b9b1c792bef43f5a0ffc49b,Rejected,2023-08-20T12:43:21.603289Z,2023-10-21T12:43:21.603289Z,0,"Pass husband agent over sing discover fast.
Body more visit stuff if. Student might national action business power site. Its stand assume life increase.",4.0
dd87d1ab79c44b0e9e0910d5,66129486addf941b98f24d71,66129485addf941b98f24d5f,056771b405a0426185c3a5ae,Rejected,2023-10-29T12:43:21.603289Z,2024-07-31T12:43:21.603289Z,0,"Beyond land court give realize study. Company new watch stuff author.
Easy way toward item subject avoid now agree. Son itself painting man. Allow model of.",5.0
d308f6996a8041f0a0551eb4,6612947baddf941b98f24cc9,66129476addf941b98f24c7e,8e522d9f509046168506b8a6,Pending,2024-02-22T12:43:21.603289Z,2025-01-10T12:43:21.603289Z,0,,
f9e71e3f005d4e18a27f66cd,66129489addf941b98f24da2,66129473addf941b98f24c50,072a7151e92d47be99a90fda,Rejected,2023-11-23T12:43:21.603289Z,2024-08-11T12:43:21.603289Z,0,"Expert worry recent difference.
Second interest physical. Well student type there measure you. Least task agent this soon.
Side our live lose technology. Above whom form realize memory eat.",2.0
0b827c711b0b40168627b094,66129482addf941b98f24d38,6612946daddf941b98f24bf2,10155211f7704b1491c8e4d8,Approved,2023-05-14T12:43:21.603289Z,2023-10-26T12:43:21.603289Z,0,"Her outside fine bank bank perform. Watch move president piece. Science bed page response.
Require spring poor she pick. Doctor huge professor short pull return.",2.0
0d490ccc2f474df4bb629895,66129477addf941b98f24c8c,66129476addf941b98f24c80,5f1dadfa567e4c44ab2773d7,Pending,2023-07-30T12:43:21.603289Z,2024-01-10T12:43:21.603289Z,0,,
7475e81079114e648f0d6a25,66129487addf941b98f24d7c,6612947eaddf941b98f24cf3,20b4bb8ea79441d1856b9206,Rejected,2023-08-11T12:43:21.603289Z,2023-11-24T12:43:21.603289Z,0,"Challenge deep room stop lead debate. Fear owner police of. Six avoid citizen dog meeting center anyone.
Pass wrong night history. Particularly once through someone provide time center.",5.0
4fcc6669f96a4a7fbebd4fa5,6612946daddf941b98f24bea,66129484addf941b98f24d5b,2dd84e328d754e19b2c89c7a,Pending,2024-02-13T12:43:21.603289Z,2025-01-28T12:43:21.603289Z,0,,
766126ab3e61455395dd2961,66129477addf941b98f24c87,66129482addf941b98f24d3e,66426e3012534b58949728c3,Pending,2023-10-10T12:43:21.603289Z,2024-01-27T12:43:21.603289Z,0,,
b371971ab43a4bec995fd122,6612948baddf941b98f24dbb,66129486addf941b98f24d73,869ff017a66140cdb4a69e64,Rejected,2024-01-30T12:43:21.603289Z,2024-08-11T12:43:21.603289Z,0,"Face friend five cause now traditional increase. Public hit after specific two wide.
Pay already guess hot. Out money office none enough.",3.0
892fc8f60bcb4afcbd18bebc,66129481addf941b98f24d29,6612947faddf941b98f24d04,83a80f82772d4f40aa3b5a41,Approved,2024-03-10T12:43:21.603289Z,2024-05-26T12:43:21.603289Z,0,"Church thus everything order. Country fish significant affect might everyone.
History other true practice. Society while practice first become especially. Idea pull set.",2.0
62e2debbd3eb4eff8234a541,66129489addf941b98f24da7,6612946faddf941b98f24c06,eaf345b7a2a6404fb7f69dfc,Rejected,2023-10-09T12:43:21.603289Z,2023-12-10T12:43:21.603289Z,0,"Trip say head important law. Left station leave early huge where crime argue.
Tend new say. Through water enough great gun job.",5.0
9315709eabe64b79855f9bc8,66129472addf941b98f24c39,6612948aaddf941b98f24daf,2aeaa6635bfa4834a23008fa,Rejected,2023-09-18T12:43:21.603289Z,2024-08-17T12:43:21.603289Z,0,"Travel prepare everything city. Man back pretty fine name and. Fly art mission per property.
Second Democrat ever.
These black thing mission line actually. Performance statement door take.",2.0
9e30504358e848219ac0c4c2,66129483addf941b98f24d45,66129481addf941b98f24d2b,7b388e6f549645ae90c2de12,Pending,2023-11-27T12:43:21.603289Z,2024-03-12T12:43:21.603289Z,0,,
1540a9c97e314efe915e1725,66129475addf941b98f24c65,6612947baddf941b98f24cc2,aa17c7b66db34271af24632c,Rejected,2023-07-12T12:43:21.603289Z,2024-05-07T12:43:21.603289Z,0,By send tough series future plant lose. Address test want Mrs serve appear husband. Defense trade memory loss attention.,2.0
d1420cd064a54097989a46be,6612947aaddf941b98f24cbe,66129484addf941b98f24d4e,3d9fe8117f1f455a97335307,Approved,2024-03-05T12:43:21.603289Z,2024-10-03T12:43:21.603289Z,0,"Worry once city room its. Entire factor small forget way near.
Near color friend culture piece. Three recent nearly tend. Second fact these involve.",4.0
608646dea4a44377b0e0053c,6612946eaddf941b98f24c00,6612946faddf941b98f24c09,f490a47eec2c42409123e18d,Pending,2024-03-13T12:43:21.603289Z,2025-02-18T12:43:21.603289Z,0,,
eb8e549922894b4bbae0d356,6612947faddf941b98f24d0e,6612946eaddf941b98f24c04,0992382cb3b24b77b4822366,Pending,2023-06-02T12:43:21.603289Z,2023-08-11T12:43:21.603289Z,0,,
7f9437ad47ea419b91dadd63,66129472addf941b98f24c3f,6612946caddf941b98f24be0,223502fde5e84c0ea0000633,Pending,2023-09-10T12:43:21.603289Z,2024-08-02T12:43:21.603289Z,0,,
c6808fb9ecb344a6bf98d874,6612947aaddf941b98f24cb6,66129473addf941b98f24c54,cd28efd8829047efa23e3786,Pending,2023-10-01T12:43:21.603289Z,2023-12-22T12:43:21.603289Z,0,,
98ab8caaa9f544848d0187fd,66129489addf941b98f24d9b,66129480addf941b98f24d20,f1da1eb16e6d40a8b23a042c,Approved,2024-01-20T12:43:21.603289Z,2025-01-08T12:43:21.603289Z,0,Voice cultural with security board. Piece base poor later other miss certain. Old hold space economic together live tree while.,2.0
cb1522cba0b94306b7a1bb8f,6612946eaddf941b98f24bfd,66129478addf941b98f24c9e,617c0a40e76344db90ca1d60,Rejected,2023-05-06T12:43:21.603289Z,2023-09-01T12:43:21.603289Z,0,"Beyond subject such news my. Throw significant star street.
Order herself fund talk center. Girl also doctor how.
History catch space project. Cause instead last.",2.0
8091bbe70d4c4e0a822e94a7,6612947faddf941b98f24d0d,66129471addf941b98f24c30,e8c297dd42ce44e0910b4710,Pending,2023-11-09T12:43:21.603289Z,2023-12-15T12:43:21.603289Z,0,,
40c85422205e4cec9aaedc61,66129485addf941b98f24d67,6612947daddf941b98f24cea,edbcb20186f04062b1876352,Rejected,2023-04-19T12:43:21.603289Z,2023-09-11T12:43:21.603289Z,0,"Enjoy last quality player imagine these cost upon. Station voice enjoy leader goal on skin.
Kitchen simply stand both less Mrs environmental. Third finish million those. Necessary others major short.",4.0
e7fd4ee03b494b2cb0fd9642,6612947faddf941b98f24d0e,66129483addf941b98f24d43,aa5bdcc012274c21839e865a,Rejected,2023-12-28T12:43:21.603289Z,2024-02-18T12:43:21.603289Z,0,Prove if modern bad attorney Democrat. Yourself season suddenly hair those network apply baby. Allow economy glass office.,3.0
088217cb682e473da6f934e4,66129476addf941b98f24c81,66129482addf941b98f24d3b,e8eece5059144d0aa5d2eb4c,Rejected,2023-05-28T12:43:21.603289Z,2024-04-21T12:43:21.603289Z,0,"Health standard arrive chair list very picture. Because physical president drive hard.
Tell money statement simple. Letter member may offer.",4.0
f50d2f2309b5447b9766466d,6612947eaddf941b98f24cf6,6612946faddf941b98f24c0a,574263389d534958bd5371e1,Rejected,2024-01-14T12:43:21.603289Z,2024-05-05T12:43:21.603289Z,0,"Avoid great current beyond. Still hour as debate between gun western.
Art inside since quickly hold. Smile century writer property she. Both room act scene may rich difficult present.",2.0
ad1338d9f93c424e8c726da8,66129475addf941b98f24c71,66129479addf941b98f24ca4,f90ed8f60b894e68a94b888f,Pending,2024-01-14T12:43:21.603289Z,2024-11-25T12:43:21.603289Z,0,,
48a88075055f411fa072c95e,6612946eaddf941b98f24c03,66129476addf941b98f24c7b,5c7ee0fe3bbe48debb0f0c15,Pending,2023-05-03T12:43:21.603289Z,2023-09-17T12:43:21.603289Z,0,,
d7273524a65c4c55989417a7,66129477addf941b98f24c91,66129473addf941b98f24c4f,df013acbbb514fcb874cafb2,Rejected,2023-12-05T12:43:21.603289Z,2024-10-11T12:43:21.603289Z,0,"Allow author establish herself. Inside though she factor share effect many.
Seek resource money bed next. Produce true western face onto.",4.0
3b332d9326964290a4e007f0,66129480addf941b98f24d18,66129488addf941b98f24d8d,f55cc1a759f743d0b19d4863,Pending,2023-08-26T12:43:21.603289Z,2024-04-19T12:43:21.603289Z,0,,
7811c4e7c4914b54a6d6e798,66129470addf941b98f24c1f,6612947aaddf941b98f24cb2,33d8ff21f9884acda7f8eedb,Pending,2023-10-30T12:43:21.603289Z,2024-09-11T12:43:21.603289Z,0,,
2234089bd134486b8bceac10,66129475addf941b98f24c6a,6612946daddf941b98f24be7,8d7f60edc6b84202a56f4564,Rejected,2023-07-10T12:43:21.603289Z,2023-08-18T12:43:21.603289Z,0,Drug include win hospital dark former. Leader recognize impact somebody smile lose fish case. Hot finally collection might why worker skin.,3.0
a0b25ce355374827bb8d729a,66129477addf941b98f24c86,66129488addf941b98f24d93,c1a789509264414cb7ad80b6,Pending,2023-05-30T12:43:21.603289Z,2023-12-13T12:43:21.603289Z,0,,
aaa7296621c6422596af1115,6612946caddf941b98f24be3,66129485addf941b98f24d65,3589b648376a4149a624d950,Rejected,2024-02-17T12:43:21.603289Z,2024-06-03T12:43:21.603289Z,0,"Voice law successful usually easy.
Use bed management. Parent thank person. Knowledge late exist when computer condition power well.",5.0
644632eb7b244d748bb51a61,66129472addf941b98f24c3c,66129478addf941b98f24ca0,a90a186a91024a4ca30319f4,Rejected,2024-02-03T12:43:21.603289Z,2024-03-21T12:43:21.603289Z,0,Various suffer sound soon their allow. Paper reason herself purpose crime. World itself paper traditional.,1.0
dab0f92b4db34cf9a4061421,66129485addf941b98f24d63,6612947baddf941b98f24cc8,71af22b2c1144b2498b05be7,Approved,2023-09-06T12:43:21.603289Z,2024-05-25T12:43:21.603289Z,0,Activity paper rise expect. Write direction treatment large important. Guess reality day job future begin owner.,5.0
5c1b77d8571641aabb6851c8,66129478addf941b98f24c9a,66129483addf941b98f24d45,c84b92f8ac754c39bd7fdc80,Approved,2023-04-28T12:43:21.603289Z,2024-04-26T12:43:21.603289Z,0,"Rather fine institution charge myself contain feel decision.
Still none society something whether himself investment garden. Town wife condition space.",5.0
d221f7677b684b0fb05ed909,66129487addf941b98f24d82,66129484addf941b98f24d5b,6edd37aa18544f90872558df,Approved,2024-02-15T12:43:21.603289Z,2024-10-22T12:43:21.603289Z,0,"Of upon new. Enough sound part again source. Floor management after everything according blood air.
Music administration prepare establish. Concern nation section low. Employee time special year.",5.0
aee9368ccfd840408ed06bc6,6612947aaddf941b98f24cb9,6612946daddf941b98f24be9,4029f73ad677423e8015e792,Approved,2024-03-24T12:43:21.603289Z,2024-08-10T12:43:21.603289Z,0,Well everything it feeling save account. Can reach song score pull much hear find. Individual resource reach nation three.,3.0
86624011adbc413fb0569cf6,66129479addf941b98f24ca4,66129482addf941b98f24d34,7a204bc4b34e462e9ff82a5e,Pending,2023-11-11T12:43:21.603289Z,2024-03-01T12:43:21.603289Z,0,,
daa0bab3600f40f9baaeb62b,6612947aaddf941b98f24cb6,66129478addf941b98f24ca0,df013acbbb514fcb874cafb2,Rejected,2023-09-30T12:43:21.603289Z,2024-06-24T12:43:21.603289Z,0,Plant good staff eye machine. Important almost machine summer could difference opportunity.,2.0
460d94f26ef34db0be1722a2,66129483addf941b98f24d3f,66129471addf941b98f24c25,3a0920d4c2cb49939bc7079e,Pending,2024-03-04T12:43:21.603289Z,2025-01-31T12:43:21.603289Z,0,,
e80978a5f48f4e0ea63a8e6c,66129489addf941b98f24d9d,66129483addf941b98f24d48,d538e195ea4b452093cacc61,Rejected,2023-10-28T12:43:21.603289Z,2024-05-30T12:43:21.603289Z,0,"Responsibility learn industry ever. Worry however very fish four. Treatment lot goal.
Care enough mean summer ago avoid. Recent whom enough under significant. Hot type trip save long.",2.0
a3bc0e9b0ef44a5fb50d8478,66129481addf941b98f24d25,6612946caddf941b98f24bd7,821631eeb8f44ea1a5be9bb5,Pending,2024-01-22T12:43:21.603289Z,2024-10-03T12:43:21.603289Z,0,,
22ef7061693a497786812b69,66129482addf941b98f24d32,66129472addf941b98f24c42,31b1e08349a8445c83a4b3f1,Pending,2023-08-09T12:43:21.603289Z,2024-05-07T12:43:21.603289Z,0,,
caa5efb2351646dbb9f4340f,6612947faddf941b98f24d05,66129480addf941b98f24d1e,40abeeeb66f84b38b626cb31,Rejected,2023-09-09T12:43:21.603289Z,2024-03-10T12:43:21.603289Z,0,"Professional recently them sell stay. Agreement you contain personal view. Health friend hour less conference environment source.
Democratic career red. Enjoy fall evidence itself mouth add wait.",5.0
ca3d8c2893af4e71b004bb27,66129472addf941b98f24c41,6612947daddf941b98f24ce3,e4ddd8489b6a44f78dda9a08,Rejected,2023-08-20T12:43:21.603289Z,2024-03-06T12:43:21.603289Z,0,Last plant newspaper part crime me program. Until inside recognize only letter worry cell. Order when our because until store. Interest read charge onto during nothing.,2.0
29ea49e1fab8493ebe97d464,6612947baddf941b98f24cc6,66129485addf941b98f24d60,c1b603f9ecd44d1ba78e65ec,Approved,2023-11-27T12:43:21.603289Z,2024-02-11T12:43:21.603289Z,0,Think reduce brother medical for. Agree single scientist fill seven cell lead. Author market election painting need war.,3.0
186c5ed176134f2889d19561,66129479addf941b98f24cae,6612947aaddf941b98f24cb7,42694df83c4f4b5cb4df0c52,Rejected,2023-12-25T12:43:21.603289Z,2024-02-04T12:43:21.603289Z,0,"Build learn book experience hit hot wear daughter. Work six along hour condition score.
Major realize person development. Many write sound reason who property hit. Character couple herself around.",5.0
93815525d3b9436a8d34e9d9,66129482addf941b98f24d39,66129485addf941b98f24d5f,7f46fbf237bb4266a07760cd,Rejected,2024-02-22T12:43:21.603289Z,2024-04-13T12:43:21.603289Z,0,Life attorney however nor south pay international respond. Son coach event main occur summer still.,3.0
88a6a88f6cb4425991379539,66129475addf941b98f24c69,6612946eaddf941b98f24c02,2b3735b039254b8d99105d18,Pending,2023-09-30T12:43:21.603289Z,2023-11-06T12:43:21.603289Z,0,,
173496591772496fa041549f,6612947faddf941b98f24d02,66129482addf941b98f24d3d,fdbf19be77c04da2b5349b50,Approved,2024-02-06T12:43:21.603289Z,2024-04-07T12:43:21.603289Z,0,"Off beyond seven great treatment.
Business apply full. Yeah TV light player. Save why administration his why.",4.0
3c57e120ec494383aeaf15b0,6612946eaddf941b98f24bf7,66129486addf941b98f24d74,4ee9a10420094f5bbf9c6c26,Approved,2023-09-13T12:43:21.603289Z,2023-12-07T12:43:21.603289Z,0,"Forget east organization sing service read. Same huge its.
Worker design campaign myself dark behavior option. Provide candidate who including either. Wide stock happen pattern.",2.0
3c4426c74e314f4b88962626,66129486addf941b98f24d77,6612947faddf941b98f24d0c,7b5b1b45e9464ccbabbd15ec,Pending,2023-06-14T12:43:21.603289Z,2024-01-09T12:43:21.603289Z,0,,
3d02b147a0494fc58a52600a,66129470addf941b98f24c24,66129485addf941b98f24d5f,fe1cabedd53241d1a1fda231,Approved,2023-04-24T12:43:21.603289Z,2023-06-14T12:43:21.603289Z,0,Teach measure all sit single lawyer. Live box day. Off management today laugh vote husband world.,3.0
c8cd3115d0ce4008831d3cc0,66129479addf941b98f24ca4,66129480addf941b98f24d15,5289a0c77efa4ad0aff46dcf,Pending,2023-08-15T12:43:21.603289Z,2024-05-14T12:43:21.603289Z,0,,
b2d7b0a16aff4ff2a367a8e8,66129483addf941b98f24d4b,6612948aaddf941b98f24dad,cb9464084ba74b899112e219,Approved,2023-10-10T12:43:21.603289Z,2024-09-26T12:43:21.603289Z,0,"Beautiful visit father over. Relate house gas begin. Significant head sound.
Least however cultural.
Green positive politics employee traditional something receive. Very evening behind great free.",1.0
b6f7200e57ed4de497b45c26,6612946faddf941b98f24c11,6612948aaddf941b98f24db0,d8c0a817bb434d48a3ab1430,Pending,2024-01-02T12:43:21.603289Z,2024-08-17T12:43:21.603289Z,0,,
9c581c69c992453da623937b,66129477addf941b98f24c8b,66129475addf941b98f24c73,0e39ffe7969b4abfbb69aef0,Pending,2023-05-23T12:43:21.603289Z,2023-07-16T12:43:21.603289Z,0,,
0b9958c3618e414ca8f1934f,6612946baddf941b98f24bcf,66129473addf941b98f24c4f,4b4e6d820e7241fc97cd0cb3,Approved,2023-09-23T12:43:21.603289Z,2024-02-20T12:43:21.603289Z,0,"Lose large action avoid why them admit example. Option similar indeed school put specific half.
None no thank point. Me move who.
Serve sister coach new activity. Still try yet rate region staff.",1.0
1d47b7030e8e464f948d56d1,6612946faddf941b98f24c06,6612948aaddf941b98f24daf,fc13db62dbd04363b4a7eec0,Pending,2024-02-22T12:43:21.603289Z,2024-03-11T12:43:21.603289Z,0,,
9cf920ef392c4ae1a705e49b,66129474addf941b98f24c62,66129489addf941b98f24da5,4f63f8804e8f413980b5d469,Rejected,2023-12-07T12:43:21.603289Z,2024-05-19T12:43:21.603289Z,0,"His movie huge now itself song. Building task number development include treat.
Social room we good watch always determine. Check kind son cover billion. Quickly news head his.",4.0
4a7342cbd2614e30b2de5cd5,6612948aaddf941b98f24db0,66129476addf941b98f24c7a,ef5ebb2c6a054d6fab17869d,Pending,2023-09-11T12:43:21.603289Z,2024-02-14T12:43:21.603289Z,0,,
69237285ead1443c9a7bd80a,66129480addf941b98f24d1a,6612947caddf941b98f24cda,6a75478797ef4d349429f2a6,Rejected,2023-06-20T12:43:21.603289Z,2023-12-30T12:43:21.603289Z,0,Near business control partner. Help discover occur early large they share. Safe war the begin soldier.,2.0
c38a9b3fd2ac48f78bae1173,6612947baddf941b98f24cce,66129487addf941b98f24d83,2bdf7bee22854eb8887b37db,Pending,2023-10-21T12:43:21.603289Z,2023-11-15T12:43:21.603289Z,0,,
271dcb44ba864c768740ff84,66129476addf941b98f24c76,6612947aaddf941b98f24cbc,f24a91c96b9b45468452758e,Approved,2024-02-21T12:43:21.603289Z,2024-09-21T12:43:21.603289Z,0,"Run safe space. From source attorney behavior analysis.
Enjoy each wonder war. Seek then bank party.",2.0
2b224871bc1c422eac82d176,6612946daddf941b98f24be7,66129470addf941b98f24c22,53ac886020434c028b4e5e3c,Approved,2023-06-25T12:43:21.603289Z,2023-08-15T12:43:21.603289Z,0,None man forward end. Represent under able chair marriage standard. Skill sea involve laugh.,5.0
3514973aa02c40e2b8cd5bc8,66129475addf941b98f24c69,66129471addf941b98f24c27,ee686aac87dd41bead632cb8,Rejected,2023-05-10T12:43:21.603289Z,2023-06-26T12:43:21.603289Z,0,"Marriage reveal develop computer difference over film scientist. Nor win whom authority. Mother production or employee usually.
Buy coach key so itself. Notice society step.",3.0
78f0f6b11bf84a8e9bf2d67d,6612946daddf941b98f24be8,66129489addf941b98f24da4,9bb04aa4b7e14c40b51f2f31,Pending,2023-11-19T12:43:21.603289Z,2023-11-25T12:43:21.603289Z,0,,
f31c01e0d5374b07b549612c,6612946faddf941b98f24c13,66129485addf941b98f24d66,437fac3884d34f6d90c5270c,Approved,2023-12-30T12:43:21.603289Z,2024-01-16T12:43:21.603289Z,0,"Early personal democratic. Note treatment effect cup part.
Together during instead huge then. Teacher service next million.",2.0
89b241cf7246477187f1847f,6612947faddf941b98f24d0e,6612947faddf941b98f24d0c,e4913273a3d3479282a95de5,Pending,2023-07-23T12:43:21.603289Z,2024-06-28T12:43:21.603289Z,0,,
77133d64a57749858c0f9be7,66129470addf941b98f24c1b,66129479addf941b98f24cb0,7f2bc0a2f4dc4ee19e28628d,Approved,2023-12-20T12:43:21.603289Z,2024-03-27T12:43:21.603289Z,0,"Central buy environmental able recently their well already.
For compare development street head food air. Water source receive hour.",4.0
2dd982362bc04fa396472226,66129486addf941b98f24d76,6612948aaddf941b98f24db6,4959dc5dc9524af6a8f5fa5b,Rejected,2023-06-20T12:43:21.603289Z,2023-12-09T12:43:21.603289Z,0,Sister newspaper last movement of society win. Series provide write east foreign. Late part large candidate involve.,2.0
7d9d60d15d91410a93a9b7d8,66129470addf941b98f24c1e,6612947baddf941b98f24cc3,d619091cdf22443fab00cfc6,Rejected,2023-08-15T12:43:21.603289Z,2024-07-26T12:43:21.603289Z,0,"Again risk office ever general. Five growth drive. Itself indicate fund.
Start this our though husband future teach.",5.0
4b6acc34f33545e986e843ad,66129474addf941b98f24c5e,66129488addf941b98f24d91,0d808d82d0804e66ab40d455,Approved,2023-12-25T12:43:21.603289Z,2024-06-16T12:43:21.603289Z,0,"Wish increase shoulder will kitchen election. Decision carry area education meet.
Necessary wait president officer. Produce special mission military place mother movie.",4.0
38481c032f2d4bd5bded1c93,66129472addf941b98f24c44,6612948aaddf941b98f24dba,b2d0bf56fbcd4a33bb10598d,Rejected,2023-09-17T12:43:21.603289Z,2024-03-19T12:43:21.603289Z,0,"Available nice last share resource. Form political statement mission shake fly. Among gun that me shake.
Agree impact this section current nice. Capital summer camera career time growth dinner.",5.0
344f68c78fa44b70b97bc46a,66129476addf941b98f24c75,66129488addf941b98f24d8d,a01e31d81daf491db9a27201,Approved,2024-01-30T12:43:21.603289Z,2024-12-31T12:43:21.603289Z,0,"Right society democratic receive. Off public part election they detail.
Economy have together. Get fire through store.
Process standard be. Democrat style establish. Decade artist beautiful loss.",1.0
1f4af95d4f0241c6acfbb9ae,6612946caddf941b98f24bdb,66129477addf941b98f24c89,e136d447e7c34a5981cb2fcc,Pending,2023-05-16T12:43:21.603289Z,2023-10-04T12:43:21.603289Z,0,,
25cdfcff7dfe443ea279a97b,66129473addf941b98f24c52,66129477addf941b98f24c89,143d09b1de7a4e6280e836c6,Approved,2023-05-10T12:43:21.603289Z,2023-07-06T12:43:21.603289Z,0,Painting teacher care learn might people. Plan three reflect off. Her sport pressure sing shake analysis.,2.0
861ebe32257f47f99e8b616a,66129486addf941b98f24d6c,66129489addf941b98f24d9d,f04b527ed3574d2688909abf,Pending,2023-09-05T12:43:21.603289Z,2024-01-27T12:43:21.603289Z,0,,
587a2a06cbd242d299273314,66129478addf941b98f24c96,6612947faddf941b98f24d04,b9b6eda61d644824abd55eb5,Pending,2024-03-07T12:43:21.603289Z,2024-04-23T12:43:21.603289Z,0,,
