_id,userId,approverUserId,userSkillId,status,createdAt,updatedAt,__v,comments,rating
3f64176ebf8c48608f46f8dc,6612947faddf941b98f24d0b,6612946baddf941b98f24bd0,14df58d838a14e608e8b3a37,Approved,2023-12-24T12:43:21.565536Z,2023-12-31T12:43:21.565536Z,0,"Summer collection arrive deal raise. East ok garden. Positive will space lot teacher culture.
Explain color page speak human.",4.0
9cc44fee7c5b4b9cb053ebff,66129473addf941b98f24c47,66129481addf941b98f24d26,6dc4457b836c40c4bed0b4ae,Approved,2023-05-31T12:43:21.565536Z,2024-01-14T12:43:21.565536Z,0,"Available next six detail tree six. Reveal letter action after character.
Stock believe no present if walk experience maybe. Improve realize true perform.",5.0
b770ea278e8f42409bb64855,66129487addf941b98f24d84,66129486addf941b98f24d7b,1ea63b28d0bb457c898a9cc2,Approved,2024-02-18T12:43:21.565536Z,2024-03-25T12:43:21.565536Z,0,"President hundred I goal serious skin get. Character black price month can throw inside door.
Expert everything pay total organization wait civil. Partner forget open remember book mouth.",1.0
719c480dcfaf407eb963943c,66129471addf941b98f24c2f,66129489addf941b98f24da2,84936964ce974d9382f65fbb,Rejected,2024-02-25T12:43:21.565536Z,2024-03-05T12:43:21.565536Z,0,"Still often current page free. Whose PM million expect interest national talk. Edge time reality special none enough.
Effort buy expect. Bag enough second year report lot trouble student.",4.0
05978b6bf15c4673a658f9a4,66129485addf941b98f24d63,66129483addf941b98f24d3f,cad17bd54d304c389f4c0cff,Rejected,2023-10-01T12:43:21.565536Z,2024-07-12T12:43:21.565536Z,0,Stage at sport visit stock west contain world. Too despite buy suddenly walk create. Court else brother pattern newspaper church a.,2.0
9907b290979b43eea9d13e36,66129471addf941b98f24c29,6612947baddf941b98f24ccc,9ae98ad198f04b5e8dd00ecf,Pending,2024-02-23T12:43:21.565536Z,2025-02-18T12:43:21.565536Z,0,,
ac628a856db94fe08bb11e4a,66129474addf941b98f24c5c,66129476addf941b98f24c75,a01e31d81daf491db9a27201,Pending,2023-12-01T12:43:21.565536Z,2024-04-25T12:43:21.565536Z,0,,
4e68939531834df5a679da7a,6612948aaddf941b98f24db5,66129471addf941b98f24c2b,1911c33e2e0f4c7ab09a06e1,Approved,2024-01-14T12:43:21.565536Z,2024-05-18T12:43:21.565536Z,0,"System finish source many there within page. Manager many open blue raise sound staff challenge. Move much fight.
Range but risk require better candidate. Some whether protect.",2.0
4f26a41b80d54e1db3749131,66129483addf941b98f24d45,66129472addf941b98f24c3b,c0a0312d72184634b9d40b61,Pending,2023-07-31T12:43:21.565536Z,2024-06-08T12:43:21.565536Z,0,,
5ed51f21798740969ffe6cff,6612946faddf941b98f24c13,6612947faddf941b98f24d0a,e5c7b8e92a6140b9bcd9ce7b,Pending,2023-08-26T12:43:21.565536Z,2023-09-14T12:43:21.565536Z,0,,
bb3362ad218e4898852a35bd,6612946daddf941b98f24bea,66129489addf941b98f24da2,f4e6e094760c4cffb687f609,Rejected,2023-12-24T12:43:21.565536Z,2024-01-09T12:43:21.565536Z,0,About sing affect group behavior probably. Better through movie authority perhaps among boy. Music rise her left daughter visit kitchen lawyer.,2.0
96af41405c70423893053551,66129481addf941b98f24d25,6612947caddf941b98f24cd9,1c66f13f2def4fbd9e4ab0f4,Approved,2023-05-20T12:43:21.565536Z,2023-07-08T12:43:21.565536Z,0,"Wide very live nation. Town hour however whether.
Interesting party day enough can green. Interesting candidate return charge answer.",2.0
18e14f449d674c228e548e43,66129472addf941b98f24c35,66129480addf941b98f24d1e,f0c83b93e1024026880728b2,Pending,2024-03-06T12:43:21.565536Z,2024-04-26T12:43:21.565536Z,0,,
f24afb143d324a6ebb4a4c8d,6612946baddf941b98f24bd2,66129489addf941b98f24da0,24c0975c54c64aec99caf29a,Rejected,2023-11-16T12:43:21.565536Z,2024-01-26T12:43:21.565536Z,0,"If up single statement five continue your range. Job class reach answer series wife.
Finish worker discover why give. Nearly affect each carry away statement car.",5.0
c765aadeba2a458aa1f88762,66129472addf941b98f24c3e,6612947baddf941b98f24cc4,918b148bbe8a4872a30ad9c0,Pending,2023-04-26T12:43:21.565536Z,2024-03-24T12:43:21.565536Z,0,,
15001bf9d3b14e6c8f0f8eff,6612947aaddf941b98f24cbf,66129477addf941b98f24c91,1fdcfe975a4c466b9ed0000c,Approved,2023-10-30T12:43:21.565536Z,2024-03-31T12:43:21.565536Z,0,"Not age phone father article need control end. White good right right seem.
Size group job free know its foot. Some dark opportunity new bar water particularly.",3.0
1e8cd49a93d74b62bff9f10c,6612946faddf941b98f24c0f,66129473addf941b98f24c53,bfc7bf58e2814404ad9f80fd,Rejected,2024-03-03T12:43:21.565536Z,2024-04-30T12:43:21.565536Z,0,"What become great former without.
End fire fine. Get myself amount nothing positive.",1.0
6bc1f4e61ed74610bc15f7d7,66129475addf941b98f24c6f,66129486addf941b98f24d72,48e2432faf2841968b6c370f,Rejected,2024-02-04T12:43:21.565536Z,2024-07-15T12:43:21.565536Z,0,"Pull control produce show available between. Bed system world forward western. Lot herself approach.
Fish treatment choice discover kind.",3.0
13d4544c9d0e46c49d338861,66129485addf941b98f24d65,66129477addf941b98f24c89,4c9ced3b93954b0badf7db78,Approved,2023-09-13T12:43:21.565536Z,2024-02-27T12:43:21.565536Z,0,"Commercial special us stuff. Main they owner same. Person during will again.
Situation tough but animal feel at trouble. Language red issue dinner allow half focus.",1.0
93c23340b00e423394d3debc,66129481addf941b98f24d2b,66129479addf941b98f24caa,9ff6f426f919406a89dcc93a,Rejected,2023-12-22T12:43:21.565536Z,2024-05-26T12:43:21.565536Z,0,"Member issue throughout make various. Dinner today kind give tree daughter fund.
Eat at simply soldier scientist imagine. Development family more factor various.",4.0
b09943406a00419d8a0939fd,6612947daddf941b98f24ce9,66129487addf941b98f24d89,8bd2798279264630b0b85576,Approved,2023-07-17T12:43:21.565536Z,2024-01-27T12:43:21.565536Z,0,Mean charge blue she town create. Now produce modern fear without hold certainly. Capital myself send manage amount important.,3.0
37241835466849a29ab74b93,6612947daddf941b98f24cef,6612947baddf941b98f24cce,95520ccbbdfa4229b05f193e,Pending,2023-11-20T12:43:21.565536Z,2023-12-23T12:43:21.565536Z,0,,
e6cefe0896dd47b3a6fccea9,66129474addf941b98f24c63,66129479addf941b98f24cb1,44eeffad79e94281bbf5ab84,Approved,2023-07-08T12:43:21.565536Z,2024-05-22T12:43:21.565536Z,0,Gun including tax participant despite election ok every. Television body season important expect federal police city.,1.0
11ccd39f70564134a7a92f4d,66129487addf941b98f24d88,6612947faddf941b98f24d07,8fcfa99425ef478cb9c97e63,Rejected,2023-08-29T12:43:21.565536Z,2024-07-02T12:43:21.565536Z,0,Commercial could avoid situation above matter. And chance get call. Hear product whose six class run. Enter easy somebody for who should charge.,1.0
68f630fb442d4aafa7796c73,6612947caddf941b98f24cd9,66129471addf941b98f24c28,1ff5c05b0f5c4b1387854b96,Pending,2023-07-04T12:43:21.565536Z,2024-04-17T12:43:21.565536Z,0,,
509bc456f2fb4c688bb153f3,66129473addf941b98f24c46,66129489addf941b98f24d9e,8d602bc7663b42d9b5c0912c,Rejected,2023-11-26T12:43:21.565536Z,2024-04-27T12:43:21.565536Z,0,"Suddenly approach market focus pressure establish. Level girl contain blood wrong.
Significant adult area available now company bar probably. Attack low guess everybody ok simply door.",4.0
0924f1baab8c46758cf66cdd,6612947eaddf941b98f24cf7,66129489addf941b98f24da0,f859577331124c7598398a2b,Pending,2023-05-25T12:43:21.565536Z,2023-11-23T12:43:21.565536Z,0,,
6f7ab7b0ce304b2eb0d2670e,66129478addf941b98f24c9b,66129470addf941b98f24c1f,74f32dea502244c3a368d735,Rejected,2023-05-11T12:43:21.565536Z,2024-02-21T12:43:21.565536Z,0,"Notice south course situation draw scene. Skill popular century who decide hand.
Professional former tell stand pick of amount. Congress production various its seven.",4.0
a9c5b987e7f44def868e7679,66129480addf941b98f24d1c,66129474addf941b98f24c57,03dfb985eba742d18e3907b5,Approved,2023-05-18T12:43:21.565536Z,2024-04-08T12:43:21.565536Z,0,"Wear power reduce movement. Resource team president good.
Measure generation phone. Arrive morning campaign suddenly tend forward someone. Site trouble million thousand hear.",1.0
cd3b433fa4b64193afd92bdc,66129475addf941b98f24c6c,66129484addf941b98f24d51,6a46e89e4c5741908b82c847,Rejected,2024-03-10T12:43:21.565536Z,2024-12-23T12:43:21.565536Z,0,Day law federal month. Adult option new just surface game whatever thus.,3.0
bc7ad691e54249d183f0eea1,66129483addf941b98f24d42,6612946caddf941b98f24bd6,5a1064fe5cd144a880e44c0c,Rejected,2023-09-20T12:43:21.565536Z,2024-02-18T12:43:21.565536Z,0,"Even feeling base our always entire really child. Note daughter woman throw. Probably scene glass within me speech.
As tax page two conference. Kitchen sea current upon over job.",5.0
85cb0802e29e4bbfb98a8ce3,66129488addf941b98f24d97,6612947eaddf941b98f24cff,2e4afa59acc344858820a337,Approved,2023-10-14T12:43:21.565536Z,2023-12-29T12:43:21.565536Z,0,"Section world experience manager. Nature simple throw happy anyone.
Tend situation page method though. Strong avoid ever house bill.",3.0
88e0311a958c4621b2d4b546,66129477addf941b98f24c89,66129484addf941b98f24d5a,e6b17ac6ce334011adb6e966,Approved,2023-11-08T12:43:21.565536Z,2024-05-21T12:43:21.565536Z,0,"Huge themselves lay job. Person bar behavior defense.
Standard color treatment travel environmental case build.",1.0
0ca8acecfa8e456d814465ff,66129478addf941b98f24c99,6612946eaddf941b98f24bfb,e10bf962972046e19e7040d4,Pending,2024-02-04T12:43:21.565536Z,2024-11-19T12:43:21.565536Z,0,,
57ae1dc618ab42cd935bb5ec,66129474addf941b98f24c55,66129476addf941b98f24c75,a30667ef1b7e4bcb996d87ea,Pending,2023-11-28T12:43:21.565536Z,2024-03-24T12:43:21.565536Z,0,,
ae9b460ebb0748dca6683a6a,6612946daddf941b98f24bf3,6612946daddf941b98f24bed,e0611afe37fd47559c83636e,Rejected,2023-12-16T12:43:21.565536Z,2024-10-16T12:43:21.565536Z,0,Reach three try if. Again skin PM ago real thus task. Station possible arm themselves off scene concern.,5.0
de883155760346de9bcfe968,6612947caddf941b98f24cd7,6612947caddf941b98f24cd5,fcf1fcbcf746467a825f543c,Rejected,2023-12-23T12:43:21.565536Z,2024-07-19T12:43:21.565536Z,0,"Happen speak firm forget walk role build herself. Director accept rather watch.
Case stay state summer relationship sound have. Any relate direction see.",5.0
9461a4c224c240e5bd251c3b,66129489addf941b98f24da2,6612946eaddf941b98f24bf6,949e4fa9a0d04e0e852b437d,Pending,2023-12-22T12:43:21.565536Z,2024-09-01T12:43:21.565536Z,0,,
6ceb04b6e39e492fb9ea22c0,66129486addf941b98f24d71,6612946eaddf941b98f24bf8,12bc12e580644276949c26ac,Rejected,2023-07-06T12:43:21.565536Z,2023-07-26T12:43:21.565536Z,0,Religious mind sea two apply too. System sea heavy professor material center single view. Bit school as yes leave defense company.,3.0
3bccc3b5d3b942b18003e7cf,66129479addf941b98f24ca8,66129487addf941b98f24d84,2a6d6b6751dd4a37a112306c,Rejected,2024-02-15T12:43:21.565536Z,2024-03-26T12:43:21.565536Z,0,"Think room building painting card red. Decide order public while.
Front Republican quickly week may name situation. Safe student despite quite.",1.0
9d794922789d4a32aeee70fc,66129482addf941b98f24d37,66129477addf941b98f24c8b,8f57ce66780640f2ad5af9b0,Pending,2023-06-15T12:43:21.565536Z,2024-01-02T12:43:21.565536Z,0,,
84d63b611d544b0dbadf894b,66129477addf941b98f24c88,66129476addf941b98f24c7c,625a19d00e074fcf87036001,Pending,2023-11-26T12:43:21.565536Z,2024-02-25T12:43:21.565536Z,0,,
fc7674dcb7eb4173979e5338,6612948baddf941b98f24dbb,6612947caddf941b98f24cd8,53ddb7157d774ab69d79367c,Pending,2023-10-25T12:43:21.565536Z,2024-03-30T12:43:21.565536Z,0,,
8e2e004e805145109402a07f,66129482addf941b98f24d37,66129484addf941b98f24d51,d9a328fc3403474b8a5fb4cf,Pending,2023-04-16T12:43:21.565536Z,2023-06-01T12:43:21.565536Z,0,,
2874cf16c2e54a369933ea81,66129471addf941b98f24c2f,66129489addf941b98f24da3,a20cb7da4e3743b5b67afc10,Rejected,2024-03-10T12:43:21.565536Z,2024-03-19T12:43:21.565536Z,0,Loss quite small court left oil leader herself. Brother practice system professional home office than. Catch two coach country prevent financial light.,2.0
16ae65ad179f4ea0a7fc9c5d,66129479addf941b98f24ca3,66129483addf941b98f24d3f,b74a02a2538c404891c63ab6,Rejected,2023-08-02T12:43:21.565536Z,2023-08-18T12:43:21.565536Z,0,"People short example these include carry friend. Student point he keep difference room.
Save front eight term record TV away. Gas at easy behind. Stay always run accept light future despite.",2.0
569a643cfb2d4396a02a8af0,6612947aaddf941b98f24cba,66129471addf941b98f24c34,d619091cdf22443fab00cfc6,Approved,2024-03-29T12:43:21.565536Z,2025-03-26T12:43:21.565536Z,0,"Crime tough all reality. Act former culture possible.
Low whole natural call through. Open three onto coach concern off skin.
Million once measure drug. Worker improve individual brother official.",4.0
34abbd041464410fbc9f8f34,6612948baddf941b98f24dbc,6612946eaddf941b98f24bf6,43aa39a7f48a4152975ab69e,Rejected,2023-05-08T12:43:21.565536Z,2023-07-21T12:43:21.565536Z,0,Us guy positive go the. Among opportunity prevent build major exactly.,5.0
9c51a72e440e4af0b2d16102,6612948aaddf941b98f24dad,66129489addf941b98f24d9b,74d6e36e42fd48b7aa97bc94,Approved,2023-07-05T12:43:21.565536Z,2024-04-23T12:43:21.565536Z,0,"So feel somebody skin accept eight cup. Feel result cultural relate when film less.
Happen born rate forward treatment poor. Section sometimes director.",1.0
6e40aca8b77a42a8be1dcc00,66129473addf941b98f24c4e,66129488addf941b98f24d9a,77ec12d9845640ff8c5d8c09,Pending,2023-10-15T12:43:21.565536Z,2024-05-06T12:43:21.565536Z,0,,
cec9a67e9bf3428a9ecfad22,66129488addf941b98f24d99,66129480addf941b98f24d19,00a22584d3a64e87a5d52d55,Rejected,2023-10-25T12:43:21.565536Z,2024-06-30T12:43:21.565536Z,0,"Best strong every land record also. Fall soldier lot soldier bar laugh success.
Everyone matter program court. Fight white bring land. Pull recent set myself.",1.0
00060ea90fe64a16bb2a58e0,66129484addf941b98f24d51,6612947eaddf941b98f24cf8,f7992ae11863454ca200ec77,Pending,2023-08-19T12:43:21.565536Z,2023-09-16T12:43:21.565536Z,0,,
71ac7961cc2342c590ee1f07,66129477addf941b98f24c88,6612947caddf941b98f24ce1,675803c6d58a486ab67b7f17,Approved,2024-03-13T12:43:21.565536Z,2024-06-29T12:43:21.565536Z,0,"Wife area head. Sea walk international security. Outside unit happen build.
No control guess city tell agency. Worry little president evening large poor. List game throughout eat create kid could.",5.0
81777c3b743c4f72854f8df9,6612946eaddf941b98f24bf6,66129471addf941b98f24c2f,58cb9448ca7b45afb9530568,Approved,2023-07-16T12:43:21.565536Z,2023-12-13T12:43:21.565536Z,0,"Develop different Democrat cost. Sell allow ground such.
Cut listen carry represent lawyer put prepare social. Ball history machine herself. Forget her wait reason sing month.",1.0
7656113fe4514e0b9281f111,66129475addf941b98f24c68,66129472addf941b98f24c3d,f3cedf8bf8e74adcaf68916e,Approved,2023-12-08T12:43:21.565536Z,2024-01-23T12:43:21.565536Z,0,"Situation owner administration claim every Republican whatever grow. Radio old rise race.
Crime artist per poor maybe foot. Evening soldier various region everyone box summer safe.",4.0
7a804b2dd2d24400adfb3ab0,66129476addf941b98f24c82,66129482addf941b98f24d30,736d7993be4049b8b7d2c526,Approved,2023-10-16T12:43:21.565536Z,2023-12-08T12:43:21.565536Z,0,"Accept arm choice week cut evidence system. Tell concern argue down drive happy. Cell ever really foreign land.
Soldier today because simple safe method. Computer stuff wind them radio add cause.",2.0
82eca4ab7052435996f534b1,66129486addf941b98f24d75,66129476addf941b98f24c77,280dd42b701c441c86f7b671,Pending,2024-01-23T12:43:21.565536Z,2024-10-24T12:43:21.565536Z,0,,
ab1c669d23f04939b57cacee,66129478addf941b98f24c99,66129485addf941b98f24d66,c5a29b30ffdc4c3ea462aa22,Approved,2023-09-30T12:43:21.565536Z,2024-01-28T12:43:21.565536Z,0,"Treat successful shoulder goal season range. Idea industry person agency church bring attention.
With treatment finish. Enough benefit story bad mention.
Report town certain carry require.",5.0
f23ff5d233f849b09b3833cf,6612946caddf941b98f24bd9,6612947daddf941b98f24cea,062c257eeb244791bdc17f4f,Rejected,2023-08-02T12:43:21.565536Z,2024-04-21T12:43:21.565536Z,0,Beyond whose bed. Note special decide see activity history school watch. Human establish alone wind anyone scene.,4.0
42a44f5bf02a462284289d89,66129485addf941b98f24d67,66129487addf941b98f24d83,4789205ca1064bccae1d890d,Rejected,2024-03-04T12:43:21.565536Z,2024-08-05T12:43:21.565536Z,0,"Dream better board write evening. Provide audience project white true you scene.
Later series general serious stop law agreement their. Can detail local parent later pass join. Parent among soon.",2.0
c07bfd74957e4b008b9cccd8,66129487addf941b98f24d7e,66129485addf941b98f24d68,21e6ebec96de453c8d60d00b,Approved,2024-01-23T12:43:21.565536Z,2024-12-18T12:43:21.565536Z,0,"Push top health play coach north. Rest keep wrong fire purpose eye debate.
Drug sense send when. Job lawyer federal front.",2.0
ae225f3e42234cb98801d362,66129472addf941b98f24c3d,66129486addf941b98f24d78,13b541cf0ec0460298e6b44c,Approved,2023-11-25T12:43:21.565536Z,2024-09-22T12:43:21.565536Z,0,Paper eight big yourself keep stock pull art. Every suggest cold nation southern spring. Everything technology brother together me.,2.0
2b52db62b81e483481ba516e,6612946faddf941b98f24c0e,66129486addf941b98f24d76,9a36dd0d0e13431baeb17eea,Pending,2023-04-25T12:43:21.565536Z,2023-08-24T12:43:21.565536Z,0,,
e96f64181a164d8590ee2528,6612946caddf941b98f24be0,66129475addf941b98f24c69,e717c292e12145eaad49607e,Rejected,2023-07-15T12:43:21.565536Z,2024-06-18T12:43:21.565536Z,0,"Many personal wait serve. Store instead ability organization answer instead large.
All quality institution.
Spring sometimes along. Once perform account order artist turn total.",4.0
5b7bbc248fb642e9b33773e3,6612947baddf941b98f24cc5,6612946faddf941b98f24c0a,5e1c733ffcc04c20bf84564f,Approved,2023-04-09T12:43:21.565536Z,2023-08-14T12:43:21.565536Z,0,"Piece enough resource father training. Turn evening wish suffer serve everybody industry. Concern we modern road.
Some send collection future few fight role. Put simply for fall.",4.0
01f5782f18a441d6adb16ed5,66129476addf941b98f24c7d,6612947eaddf941b98f24cff,83f91c78b7804b8882d5becc,Approved,2023-04-18T12:43:21.565536Z,2023-08-20T12:43:21.565536Z,0,Since enough light vote. Seat write figure dream thousand pretty year.,2.0
755a13fb03ee496098d7ee2a,6612946faddf941b98f24c0d,6612946caddf941b98f24be4,8f0e5158b30c4166b1d4e23a,Rejected,2023-06-01T12:43:21.565536Z,2024-04-05T12:43:21.565536Z,0,"Myself some seek short pay full class Mr. Almost garden very bar suggest animal amount.
Side better early talk rule. Use heavy station firm hair.",5.0
149b3561ab93419cb8e3874f,6612946baddf941b98f24bd3,66129488addf941b98f24d96,aea2bbdeee8e486593b8dcdc,Rejected,2023-04-11T12:43:21.565536Z,2024-03-27T12:43:21.565536Z,0,"Movie after across hard him effect.
Upon continue result no. Close American home future. Whatever will direction service.",4.0
2ed8d52d18294497aff4ca65,6612946daddf941b98f24bf2,66129477addf941b98f24c92,f3ee0feba7fc497db0de199e,Pending,2023-07-14T12:43:21.565536Z,2023-08-23T12:43:21.565536Z,0,,
48d52938224741ed8340ca4b,6612946eaddf941b98f24c04,6612946faddf941b98f24c08,8707046df6704097841674e9,Pending,2023-06-09T12:43:21.565536Z,2024-01-11T12:43:21.565536Z,0,,
13bbddab58aa422ca3448d35,6612947caddf941b98f24cdf,66129486addf941b98f24d73,9fb1b22b35a44a1fba200047,Approved,2024-03-16T12:43:21.565536Z,2024-07-31T12:43:21.565536Z,0,"Short discuss business wall.
Sport born brother different study wonder. Including from girl build. Hit western then food market employee office everyone.",3.0
08ce52d28f014fcc814b5f66,6612947daddf941b98f24ceb,66129479addf941b98f24ca6,0b4bb100601749448498d9d9,Approved,2023-11-28T12:43:21.565536Z,2024-04-11T12:43:21.565536Z,0,Prove even seek affect beat nation perhaps. Imagine strong court pull memory. Visit smile lose remember president. State factor add high treat Mrs significant industry.,3.0
2a02f9ea64b146d7b2056965,66129489addf941b98f24da8,66129485addf941b98f24d5d,69b040a991784c53ba47d5c3,Approved,2024-01-14T12:43:21.565536Z,2024-03-29T12:43:21.565536Z,0,Safe easy expert against coach. Service single risk test.,5.0
e4141024cc434a499d2c41d9,66129480addf941b98f24d14,6612947faddf941b98f24d0a,e3616e0f7528461db6daed49,Pending,2024-02-01T12:43:21.565536Z,2024-03-14T12:43:21.565536Z,0,,
b976d087ffa94725b4f85ba5,66129478addf941b98f24c98,66129471addf941b98f24c2d,16d66a0f817b4d28bbdb5d54,Pending,2023-09-19T12:43:21.565536Z,2024-05-03T12:43:21.565536Z,0,,
09b8d6748c32422e92f08efd,66129471addf941b98f24c2d,66129473addf941b98f24c49,180a95b03fc3451a84386929,Rejected,2023-11-08T12:43:21.565536Z,2024-09-22T12:43:21.565536Z,0,Behind artist inside develop. Return turn it may gun fire listen. Avoid on his task field home heavy.,3.0
b5fc6a386d71410c89525ad2,66129487addf941b98f24d87,66129474addf941b98f24c5d,fc825d3692b14bd08d8b7935,Approved,2024-04-06T12:43:21.565536Z,2024-12-15T12:43:21.565536Z,0,"Evidence itself camera federal instead line left. Imagine else nice nation stock cover us. Product indicate spring participant why actually page.
These them occur up stuff husband. Prevent walk miss.",5.0
36956e4938a1425291b049a1,66129489addf941b98f24da0,66129470addf941b98f24c1a,9653f90b840649d2bc9973c3,Pending,2023-11-26T12:43:21.565536Z,2024-09-11T12:43:21.565536Z,0,,
3dda000e8fb24a858407207d,66129483addf941b98f24d45,66129489addf941b98f24d9c,521c11b0f5814dc1b86c4b23,Rejected,2023-05-25T12:43:21.565536Z,2023-11-15T12:43:21.565536Z,0,"Hot color behavior whatever weight event whole fly. Woman job with per.
Play my fish kid officer mean. Age discover executive range account. Resource statement friend parent trade.",3.0
9ba0bb32688844c684e0aa1d,6612947daddf941b98f24ce7,6612947aaddf941b98f24cb7,c3a06045f1a14036aa109e70,Approved,2024-02-15T12:43:21.565536Z,2024-05-31T12:43:21.565536Z,0,"Recent American usually institution learn despite not others. Father they firm arrive film.
Success speech mean read magazine crime hear. Support marriage you article.",5.0
9541c5e290da4ae5915e6850,66129480addf941b98f24d14,66129476addf941b98f24c84,53f52b2192934322b76d5bc8,Rejected,2023-10-26T12:43:21.565536Z,2023-11-25T12:43:21.565536Z,0,Sound should federal strategy. Mouth any explain when situation moment including. People receive trade serve price two special.,3.0
62d0197119564300b0b5137c,6612946faddf941b98f24c0a,66129486addf941b98f24d7a,9194f232a9f948fb9d7ac73d,Approved,2023-11-08T12:43:21.565536Z,2023-12-19T12:43:21.565536Z,0,"Product seek significant.
Mission police method kind western deep. Newspaper question camera and listen memory night discuss.
Personal child statement record heavy individual garden. Life risk under.",3.0
2c2b28d65626438fa698826d,66129480addf941b98f24d1b,6612946baddf941b98f24bcf,79691378f9f64bfda8e8d4d0,Pending,2024-04-03T12:43:21.565536Z,2024-08-16T12:43:21.565536Z,0,,
d4c58b84948e47b89e123a16,66129484addf941b98f24d54,6612947aaddf941b98f24cb2,c8e61407f8a1428ab07d0dc0,Rejected,2024-03-01T12:43:21.565536Z,2024-10-30T12:43:21.565536Z,0,"Trouble hair until art difficult. Myself figure city old. Trade past something ball man me many entire.
Try possible mother. Behavior government idea. Bill increase line life hair.",4.0
2c2117ff2277410a95fe7652,66129472addf941b98f24c3b,6612947caddf941b98f24cd7,df3e585862a9482db208012c,Approved,2023-11-18T12:43:21.565536Z,2024-04-06T12:43:21.565536Z,0,Never wonder much offer stuff rich check. Society across address whether create particular job. Upon system our likely low area.,4.0
4a8299a915254fa48f468261,6612947caddf941b98f24cd2,66129473addf941b98f24c51,aa17c7b66db34271af24632c,Rejected,2023-10-09T12:43:21.565536Z,2024-01-21T12:43:21.565536Z,0,"Never two upon seem many. Choice market from image everybody behind. Town provide story specific painting.
Her build billion voice hope recent film. Successful back production run.",5.0
cd6cce8db3a349ee981d8527,66129482addf941b98f24d30,66129488addf941b98f24d98,ab6bc275524f490d9f3aeaa1,Approved,2023-06-14T12:43:21.565536Z,2023-12-25T12:43:21.565536Z,0,"Market draw region reflect church fund bill. Serious play high week miss.
Middle activity it road. Be team in involve wish reveal family. Religious seven so consider on clear else.",5.0
52ab7429a9f442919956cdba,6612947eaddf941b98f24cff,66129484addf941b98f24d59,b05b9d825c8749ea88f2d64f,Rejected,2023-12-10T12:43:21.565536Z,2024-10-27T12:43:21.565536Z,0,"Although reason low here reach someone approach. Meet any suffer.
Society use thing company. Rich student environmental forget nation significant.",2.0
c7ab3990b0fe418f9d3e5210,66129487addf941b98f24d88,66129471addf941b98f24c25,d99b15a1cb7e4a78a01b3626,Approved,2024-02-12T12:43:21.565536Z,2024-02-21T12:43:21.565536Z,0,"Fine business newspaper strategy nearly still authority. Floor drive billion home fast west. Mother conference sit study detail American.
Investment wear contain treatment cultural ahead season.",2.0
354007f3698541e2be1da1a6,6612946baddf941b98f24bd2,66129477addf941b98f24c8e,28a0b8d5c362499091b25cb3,Pending,2023-07-15T12:43:21.565536Z,2023-09-08T12:43:21.565536Z,0,,
f28252fa8fa44ef2b08c9f25,66129486addf941b98f24d6d,6612947aaddf941b98f24cbf,0ce663a17a4f47238317b6ab,Rejected,2023-04-30T12:43:21.565536Z,2024-02-16T12:43:21.565536Z,0,Street support simply drug defense. Technology director at measure answer base receive realize. Visit American never different above.,5.0
3c52bf8330b74fa3b9dbf183,66129480addf941b98f24d1d,6612947caddf941b98f24cd2,e133ba9a6e39411ead1c2be2,Approved,2023-08-17T12:43:21.565536Z,2024-05-30T12:43:21.565536Z,0,"Security provide business can decide full. Catch class now old business.
Mind yet suddenly. Them key government data.",2.0
05133ff5b6094c9baa5bb8f9,66129479addf941b98f24cac,66129485addf941b98f24d5f,75f7503e89c2414c838f7a83,Pending,2024-04-01T12:43:21.565536Z,2025-01-18T12:43:21.565536Z,0,,
8cd3db7983ba42dcabd161b3,6612947aaddf941b98f24cba,66129481addf941b98f24d2f,3ab5f04185bd4b79a853c16f,Pending,2023-11-01T12:43:21.565536Z,2024-10-15T12:43:21.565536Z,0,,
