_id,userId,approverUserId,userSkillId,status,createdAt,updatedAt,__v,comments,rating
fd7d100f15414f8ca6c774ab,6612947daddf941b98f24ce8,6612946baddf941b98f24bce,a7f84d8186f448e3b2d0eaf2,Approved,2023-05-19T12:43:21.418084Z,2023-05-27T12:43:21.418084Z,0,"Standard program message. Area tonight south.
Truth anyone themselves keep fill within without. Especially nearly forward.",3.0
2d6f339412a44562a5b92cd4,66129475addf941b98f24c6e,66129483addf941b98f24d44,5a17887cae7549a7ac3f442c,Rejected,2023-06-15T12:43:21.418084Z,2024-02-09T12:43:21.418084Z,0,"Other speech yourself technology live wait. Drug amount will lose apply.
Live Democrat ball maintain usually strategy. Firm safe low expect. Yourself agreement available myself.",2.0
95933a65fb0c4904859a7293,6612946faddf941b98f24c07,6612947baddf941b98f24cd0,92b3403ccf634601af93aca2,Approved,2023-10-03T12:43:21.419181Z,2024-04-26T12:43:21.419181Z,0,Mention lay much. Blue information everyone family right. Kid culture management young school wait top.,2.0
a8fca608180f4e65b07a3247,6612947eaddf941b98f24cfb,6612946eaddf941b98f24bfc,64dd6b182d8a47b8bc5964c9,Pending,2024-02-29T12:43:21.419181Z,2024-06-03T12:43:21.419181Z,0,,
04b034b9c16540349f5e0e0a,66129477addf941b98f24c90,66129471addf941b98f24c2b,a30b08701ef143eeb5512016,Rejected,2023-04-08T12:43:21.419181Z,2023-05-11T12:43:21.419181Z,0,"Candidate last health great media. Traditional explain need doctor. But hotel foot but base.
Use half room full role. Across fall ok when away newspaper.",1.0
017d819ab84d4517b7a4a827,66129473addf941b98f24c4b,6612946eaddf941b98f24c00,8de18964eadf4e5291b367f9,Pending,2023-08-20T12:43:21.419181Z,2024-01-02T12:43:21.419181Z,0,,
e229cfa84fb3449a9174d145,6612948baddf941b98f24dbd,6612947caddf941b98f24cd8,ba58015225a64467b2c2bd41,Approved,2024-03-20T12:43:21.419181Z,2024-08-02T12:43:21.419181Z,0,Pull should long feel conference. Put run foreign ready heavy upon. Believe home century several animal.,1.0
c4a9e9a57927479ebf805e56,66129478addf941b98f24ca0,66129481addf941b98f24d29,85336b386c58481885a410ce,Pending,2024-02-18T12:43:21.419181Z,2024-12-05T12:43:21.419181Z,0,,
d6f156000ea74e868d6f66f2,66129484addf941b98f24d5a,66129488addf941b98f24d98,492d384d68874fc9bbb206b6,Rejected,2023-09-20T12:43:21.419181Z,2023-10-20T12:43:21.419181Z,0,"Girl real bit long. Anything radio himself heavy week range special form.
Military whether year option clear. Main green hear.
Purpose similar population age. Partner despite window no dark together.",1.0
89be2e43fbb04f5281549a8c,6612946caddf941b98f24be5,66129472addf941b98f24c3b,bfc0e1e9a96b4206b2b8a981,Pending,2024-03-14T12:43:21.419181Z,2025-02-05T12:43:21.419181Z,0,,
6ac04ccc6c2245d9a03e4cd6,66129485addf941b98f24d61,66129475addf941b98f24c68,12875d87b4c34319ad1b6ed2,Rejected,2024-01-04T12:43:21.420199Z,2024-07-17T12:43:21.420199Z,0,"Firm likely decade doctor just. Husband baby everybody piece job continue.
Rock myself air three real bank why.",4.0
acc33fa98ae94414aa821d79,66129472addf941b98f24c39,66129487addf941b98f24d7f,e80d7505061e4189b7db4db3,Approved,2023-05-27T12:43:21.420199Z,2023-08-05T12:43:21.420199Z,0,Front coach image tonight young. Adult data including piece level serve who. Couple rather energy work court.,1.0
1c4f08e35a8241a8b88985ae,66129488addf941b98f24d8f,6612947daddf941b98f24cef,bfa52e0fffd1450f94c56aab,Rejected,2023-10-22T12:43:21.420199Z,2024-03-16T12:43:21.420199Z,0,Low nothing relate career side music. Probably civil never participant simply town six. Institution last write support time.,3.0
681029742f334e098b5ec216,66129487addf941b98f24d83,66129477addf941b98f24c8d,b05b9d825c8749ea88f2d64f,Rejected,2023-10-24T12:43:21.420199Z,2023-12-28T12:43:21.420199Z,0,"Mr dream ground resource. Entire simply thank stuff what reveal.
Nice scene them stop visit remember. Indeed especially raise gas effort. Rate human degree senior large wonder size other.",1.0
34e6e606c62347bdbe110f31,6612947aaddf941b98f24cba,6612948aaddf941b98f24dae,740614bf0999462398a7fcde,Rejected,2023-11-21T12:43:21.420199Z,2024-02-07T12:43:21.420199Z,0,"Later beat recent trouble training. Son two clear strong.
Degree interview I four arrive partner. Fish admit become small.",1.0
39a808a76b9d4b2ab2570b61,66129485addf941b98f24d5d,6612946eaddf941b98f24bfe,211aa8ae117540559be7da6e,Pending,2023-10-04T12:43:21.420199Z,2024-05-10T12:43:21.420199Z,0,,
2403f00c810749b082502ead,66129472addf941b98f24c3e,66129481addf941b98f24d22,35397534db1a4b3b93998522,Rejected,2024-02-10T12:43:21.420199Z,2024-04-03T12:43:21.420199Z,0,Religious heart career up individual third bad. Parent grow store visit reduce. Ten alone necessary.,4.0
794cad38bffb489eb1869af2,6612948aaddf941b98f24dae,66129475addf941b98f24c6e,707b4db4b4b74b1280f86f4e,Rejected,2023-05-08T12:43:21.420199Z,2024-04-16T12:43:21.420199Z,0,"Development American already respond stock window people. Draw state himself shoulder rock.
Road very land large himself ground. Occur live voice century thought wish. Low husband hold education.",2.0
29fe078499254f608a2ed942,66129488addf941b98f24d8f,66129471addf941b98f24c33,38e545fe7bad40c1847d88d0,Approved,2024-03-05T12:43:21.421188Z,2024-12-11T12:43:21.421188Z,0,Pay scientist per husband during military leave. Air culture stock ten. Step up product career time every suggest yet.,2.0
bc6b2132fbc645cca35765ec,66129482addf941b98f24d34,66129485addf941b98f24d60,75f7503e89c2414c838f7a83,Pending,2023-09-24T12:43:21.421188Z,2024-01-07T12:43:21.421188Z,0,,
12b3ca8e25fa4a03b3b10f6b,66129482addf941b98f24d30,6612947baddf941b98f24ccf,1a5feae9912c4e91a9092b37,Approved,2024-01-20T12:43:21.421188Z,2024-09-27T12:43:21.421188Z,0,Whether run than key professor. Dinner finally account step across information difficult environmental. Government perform age quality stage edge amount four.,3.0
d015fc57d9a049e09c165935,6612947faddf941b98f24d10,6612946caddf941b98f24bdc,33d7f9f4bc8c40d5a8b2a922,Pending,2023-09-14T12:43:21.421188Z,2023-09-19T12:43:21.421188Z,0,,
c3a8f0a234d54768b3e8cc83,66080b98b85746ebc7e40654,66129471addf941b98f24c2b,3c51530cf82e4add96beb4e5,Pending,2023-07-25T12:43:21.421188Z,2023-12-02T12:43:21.421188Z,0,,
768503fc514c45c3a59e65f0,66129482addf941b98f24d31,6612947baddf941b98f24cc9,7fb80e6d910c487f891dbb76,Pending,2023-12-16T12:43:21.421188Z,2024-11-21T12:43:21.421188Z,0,,
f65626071cf742768682af9a,6612947baddf941b98f24cc3,6612947aaddf941b98f24cbf,2e0ae17846584de9abf4a320,Pending,2023-10-06T12:43:21.421188Z,2024-01-29T12:43:21.421188Z,0,,
06c0f473518c4731bd885cbe,6612947caddf941b98f24cd1,66129480addf941b98f24d13,ae64429872f2432391fce473,Pending,2023-06-04T12:43:21.421188Z,2024-04-05T12:43:21.421188Z,0,,
c639dc7d1b334485bc96776a,66129482addf941b98f24d35,66129488addf941b98f24d90,dcaa82d3d62a420f9911bf0b,Rejected,2023-10-31T12:43:21.421188Z,2024-05-20T12:43:21.421188Z,0,"Reality so arm. Receive stage police so.
Imagine nor establish. Such account her agent race. Affect task suggest per seem Mrs serve they.",4.0
2b6c640af3de4b828b40606c,66129482addf941b98f24d31,66129473addf941b98f24c50,056771b405a0426185c3a5ae,Pending,2023-11-09T12:43:21.421188Z,2024-03-09T12:43:21.421188Z,0,,
33c2c2161eb94631a9294098,66129488addf941b98f24d98,6612946eaddf941b98f24bf6,8d2a101c577e4554bb93da9e,Approved,2023-06-30T12:43:21.422199Z,2024-02-10T12:43:21.422199Z,0,"Heavy analysis admit store. Worker along garden machine no just case. Argue follow expect thing hope.
Another party hospital among protect science.",4.0
100091b45fb04dc8843e6a74,66129470addf941b98f24c1b,66129487addf941b98f24d81,1b479a091ffb400a87541763,Approved,2023-10-06T12:43:21.422199Z,2024-05-26T12:43:21.422199Z,0,"Lay husband agent glass its effort under whom. Time baby tend street other.
Even middle stuff staff reflect difficult. Whether shake full medical yourself hear. Show area like challenge hit.",5.0
f05fadae35b147d69c01ce6c,6612947baddf941b98f24cc8,6612947aaddf941b98f24cc0,5af795f56a3b4269bf264923,Rejected,2023-04-21T12:43:21.422199Z,2023-09-18T12:43:21.422199Z,0,Down trade tonight. If city road series various war mission.,1.0
d4556acb39b3434d94f21ee8,66129475addf941b98f24c72,66129480addf941b98f24d18,d28d3be0f2364b91b0707a56,Rejected,2023-04-15T12:43:21.422199Z,2023-10-08T12:43:21.422199Z,0,"Throw product military trade.
Past over news college national. Difference open explain. Wear take our program.",4.0
2d3a1a65ce4b400f8064da00,66129471addf941b98f24c34,66129475addf941b98f24c69,7f46fbf237bb4266a07760cd,Rejected,2023-06-21T12:43:21.422199Z,2023-08-31T12:43:21.422199Z,0,International agent similar nation occur perform. Leg activity option choice long well state. Remember me market. Agree wide tree.,4.0
a5147091c6b540998314b78a,66129480addf941b98f24d17,66129482addf941b98f24d33,b8c5a8317a974927a99bfca8,Pending,2023-10-07T12:43:21.422199Z,2023-10-20T12:43:21.422199Z,0,,
c16296ab28c6463da1286444,6612947eaddf941b98f24cf7,66129484addf941b98f24d50,e2fa5024790348709220b1f2,Approved,2023-07-19T12:43:21.422199Z,2023-09-14T12:43:21.422199Z,0,"Environmental individual trade social agreement trouble growth. Wear either while message. Try east serious.
Network entire day behind me owner. Season laugh assume eye meet here.",4.0
b292b6dd827948159bcba6d4,66129488addf941b98f24d91,66129474addf941b98f24c61,7e3531e117494831b269e065,Rejected,2023-05-26T12:43:21.422199Z,2024-02-19T12:43:21.422199Z,0,"Hold help trial. Think truth system discuss decade.
Happy power forward. Financial star no image song of prepare impact. Per paper month tax believe level.",2.0
51b72ef687e74f8b888d4b4a,66129478addf941b98f24c97,6612946caddf941b98f24bde,bbe97bf637d34c7388a2ead5,Rejected,2023-04-23T12:43:21.423189Z,2023-11-12T12:43:21.423189Z,0,"Test room thousand weight. Be small get work away.
Some sense identify. Skin affect staff light dark. Some send dog defense girl.",3.0
6c919c3dffff43049344705b,6612946baddf941b98f24bd2,66129476addf941b98f24c80,c5a29b30ffdc4c3ea462aa22,Pending,2023-06-27T12:43:21.423189Z,2024-03-03T12:43:21.423189Z,0,,
3e4b283374ff4d87af24f889,6612946baddf941b98f24bcd,6612947faddf941b98f24d10,b04366fda8e445dab94ed3dc,Rejected,2023-09-27T12:43:21.423189Z,2024-09-24T12:43:21.423189Z,0,Beat unit lay general them body gas. Deep trial anyone myself class computer us. Almost discuss resource available point pressure these past.,5.0
17295efacf2b4b938d754456,66129480addf941b98f24d1b,66129470addf941b98f24c17,8f38b5556c2c4e54b323903d,Approved,2023-08-08T12:43:21.423189Z,2023-11-23T12:43:21.423189Z,0,"Else rich surface well. Up toward major take.
Receive civil mean education let. Response space turn where.
Picture section day cell as.",2.0
3c6ef4c792d941e3b32d0f01,660c44e1031dafee85d11d05,66129475addf941b98f24c72,44e36ba6733644559001942b,Rejected,2023-10-02T12:43:21.423189Z,2023-12-16T12:43:21.423189Z,0,"Strong if evidence through. Interview history since human table research situation.
About magazine education popular action painting on.
Really six place box.",3.0
9129ddd80bc44a14bf4e5605,66129482addf941b98f24d37,66129470addf941b98f24c16,97396021855042d38d0cace6,Pending,2024-02-14T12:43:21.423189Z,2024-10-04T12:43:21.423189Z,0,,
e02abf99ca5b4d0b9481f17e,6612947baddf941b98f24ccb,6612947faddf941b98f24d09,3012b6e39abe46a59e48b73a,Rejected,2023-10-30T12:43:21.423189Z,2023-12-25T12:43:21.423189Z,0,Some relationship usually fight. Chair tell decade thing stop show. End letter likely so clear degree field.,4.0
f824e8339d18419f94f08b41,6612946faddf941b98f24c0b,66129479addf941b98f24cb0,e9fe34c6e9dd4bafb4fa35e9,Pending,2023-09-06T12:43:21.423189Z,2023-12-16T12:43:21.423189Z,0,,
9429dd4511344024ab154ff1,6612947aaddf941b98f24cbd,6612947caddf941b98f24cd1,567a5df30d8744769a08bc61,Approved,2024-02-07T12:43:21.424182Z,2024-10-16T12:43:21.424182Z,0,Easy spring increase appear. Certain keep tax against opportunity religious relationship.,3.0
09efaa670da54e67a655327b,66129486addf941b98f24d6c,66129476addf941b98f24c75,616641b2a44f491bae955163,Approved,2024-03-18T12:43:21.424182Z,2024-08-01T12:43:21.424182Z,0,"Movement her hospital different. Nor leave article.
Light rock war probably certain budget. Break among possible instead off final. Poor student one music sometimes growth establish.",4.0
191c525eb2c94b02adafc35f,66129489addf941b98f24da0,6612947daddf941b98f24ced,d61e511c71354f47b12a6ee7,Approved,2023-11-04T12:43:21.424182Z,2024-03-14T12:43:21.424182Z,0,"Rather interest continue sit result moment. Leg vote so support. Standard capital image rule.
Trade available mission yourself. Another perhaps seat space garden stock he.",5.0
06d1be9a3de042ec98ec2bb5,66129485addf941b98f24d5d,6612946baddf941b98f24bd4,efd85b1872d04c24b1a6c07c,Approved,2023-11-22T12:43:21.424182Z,2024-06-24T12:43:21.424182Z,0,"Good part option until. Clear rule trouble contain.
Rise place century add safe especially. Which price suggest control try. His old state energy significant.",4.0
5f93463baec14f089fa3dc92,6612947baddf941b98f24ccb,66129488addf941b98f24d8f,4f4ce5ddd1f546d59ed71665,Pending,2023-07-11T12:43:21.424182Z,2023-08-18T12:43:21.424182Z,0,,
c0f1a9e598fe46b782904005,6612947aaddf941b98f24cb3,66129474addf941b98f24c59,5a9cd7dfff7d4733a106809a,Approved,2024-03-28T12:43:21.424839Z,2024-05-09T12:43:21.424839Z,0,Treatment level rule. Will like indeed direction might. Memory defense network structure.,3.0
1049c5088bd345d592453ed1,66129487addf941b98f24d81,66129475addf941b98f24c65,ef5ebb2c6a054d6fab17869d,Rejected,2024-03-04T12:43:21.424839Z,2024-09-14T12:43:21.424839Z,0,"Could cut growth price western include hit.
Require worry especially hair use. Ground half family relationship painting thus.",2.0
8c75079eaf8f4da39cb60872,6612948aaddf941b98f24dac,66129470addf941b98f24c22,e133ba9a6e39411ead1c2be2,Approved,2024-02-27T12:43:21.424839Z,2024-10-01T12:43:21.424839Z,0,Door audience month test police. Service stage very entire account resource do. Likely claim each prove office research money.,1.0
c66d14517fd54bf1ba1000c5,66129481addf941b98f24d2f,6612946caddf941b98f24bdd,7b77178c6aef453f942a06af,Pending,2024-03-03T12:43:21.424839Z,2024-09-25T12:43:21.424839Z,0,,
12e8aa2884bf4424b0030fef,66129484addf941b98f24d54,6612946daddf941b98f24be8,ae3263a66716468e9fbd322c,Pending,2023-07-30T12:43:21.424839Z,2023-11-06T12:43:21.424839Z,0,,
6d67891d1f7e479891300c34,6612946daddf941b98f24bec,6612948aaddf941b98f24db2,9c3c0c0febf04b45b5c730ff,Pending,2023-06-24T12:43:21.424839Z,2023-09-05T12:43:21.424839Z,0,,
a276296bd57942a190c83691,66129482addf941b98f24d30,66129482addf941b98f24d32,3a0920d4c2cb49939bc7079e,Approved,2024-02-05T12:43:21.425867Z,2024-12-05T12:43:21.425867Z,0,"Score scene room hot. Really discussion president serious friend wonder country. Indicate within perhaps should.
Sport seven election group Mr. Against teacher town night million.",3.0
4f930d5e7804400e80bf546b,66129487addf941b98f24d85,66129471addf941b98f24c2b,2115fb1f54ec4a1582d39652,Rejected,2023-04-08T12:43:21.425867Z,2023-05-14T12:43:21.425867Z,0,"Fall social including draw young finally. First interview people force action.
Read sea whatever over window both indeed. Among present body hear wonder oil better.",5.0
e89f00683cd2458dbed0d99f,6612947daddf941b98f24cef,66129471addf941b98f24c26,7745df8d9bf144ceac4abf31,Rejected,2023-10-11T12:43:21.425867Z,2024-10-10T12:43:21.425867Z,0,"Son race any side mouth. Bad debate me baby power rule color.
Defense two write citizen pressure possible protect. Team trial amount allow local meeting. Put physical Republican crime.",2.0
9682321fbef74ec5b8540256,66129477addf941b98f24c8d,66129470addf941b98f24c15,627b039e3cab44f2bc90d067,Rejected,2023-11-23T12:43:21.425867Z,2024-11-05T12:43:21.425867Z,0,Friend condition international social him suffer risk.,2.0
c5f9797788df40fd820f7cda,66129485addf941b98f24d69,66129473addf941b98f24c47,34a92820e8a14ce995ab3faf,Pending,2023-06-30T12:43:21.425867Z,2024-06-22T12:43:21.425867Z,0,,
bc1b6537e7104eb49d03c693,6612947faddf941b98f24d02,66129478addf941b98f24c9d,efd85b1872d04c24b1a6c07c,Approved,2023-09-20T12:43:21.425867Z,2023-11-08T12:43:21.425867Z,0,"Never father memory movement financial two over. Exactly suddenly walk each may.
Stay book fine character card every.",5.0
9a00618ba3d74d5fa9bdc4cf,66129477addf941b98f24c92,6612947daddf941b98f24ce4,0dc8c91f2537401bac321474,Approved,2024-03-25T12:43:21.425867Z,2024-10-06T12:43:21.425867Z,0,"Contain success where. Fish help everything area discussion. Product up south.
They left firm. Decision return option deal keep method. Power skin cut none sing daughter.",2.0
d09a69f268ff43fcaa999ce4,66129483addf941b98f24d45,66129482addf941b98f24d30,8807432c55244a9a9eed41ce,Pending,2024-03-17T12:43:21.425867Z,2025-01-11T12:43:21.425867Z,0,,
37248d23903244aa8109163a,66129470addf941b98f24c18,66129473addf941b98f24c47,0a5cffed0ede406d876145b9,Pending,2023-12-24T12:43:21.426881Z,2024-11-03T12:43:21.426881Z,0,,
ec1dd8452ead431f8d404400,66129471addf941b98f24c2a,66129489addf941b98f24da6,10709fcd2239430f911403d7,Pending,2023-07-28T12:43:21.426881Z,2023-10-05T12:43:21.426881Z,0,,
7c5f213d958b499795ea4dae,66129470addf941b98f24c17,66129489addf941b98f24da1,0654f28ef4764f0c8129a988,Approved,2024-01-11T12:43:21.426881Z,2024-06-07T12:43:21.426881Z,0,"Draw threat myself officer. Establish late east eat out yard.
Certainly through me place class wife. Especially card spring long. Practice effect contain keep body.",4.0
776f45d7ce3c4a0c8f21b515,6612947daddf941b98f24ce6,66129483addf941b98f24d43,e3107b0a9be04e0eaaebff5a,Rejected,2023-09-12T12:43:21.426881Z,2023-11-01T12:43:21.426881Z,0,Draw specific better one perform general today. Science especially director culture before individual relate. Car maybe home.,4.0
905b4c6afd8e491684667230,6612947faddf941b98f24d03,66129480addf941b98f24d18,c56bf7a482bb431da01fb0a0,Approved,2024-03-19T12:43:21.426881Z,2024-10-17T12:43:21.426881Z,0,Toward appear great turn himself improve big. Such series appear rate generation senior.,2.0
077be8b6bdad41f5b3c2b561,66129486addf941b98f24d73,66129489addf941b98f24da1,e6dc7e3019e743548fac10db,Rejected,2024-02-24T12:43:21.426881Z,2024-05-12T12:43:21.426881Z,0,"Eat science write war. Several wrong standard down good street. Yes party no bank piece consider.
Free difficult student edge chance music suddenly. Reality manage example Republican.",3.0
c82aff38228b4703ba2e7176,66129488addf941b98f24d8d,66129476addf941b98f24c81,bb508c2946c94bdca6566f88,Pending,2023-09-21T12:43:21.426881Z,2023-12-25T12:43:21.426881Z,0,,
63b9b14b7f844961b02a8318,6612947eaddf941b98f24cf2,66129483addf941b98f24d3f,1fdcfe975a4c466b9ed0000c,Rejected,2023-09-17T12:43:21.426881Z,2023-10-03T12:43:21.426881Z,0,"Simply speech firm science defense. Seven energy level serve theory.
Night care court form. Article great scene lead. However card responsibility left.",1.0
5eae7e985a6746b389bfae10,66129480addf941b98f24d16,66129489addf941b98f24d9c,548ea76123124ac99580abaa,Approved,2023-09-16T12:43:21.427958Z,2024-01-20T12:43:21.427958Z,0,"Happen usually teacher plant federal. Save public we hand show figure.
Wide ability available visit above involve. Job should industry art.
Compare hear ask see return book drive.",2.0
a39d1c1b668246ee83cd4669,66129488addf941b98f24d8e,66129470addf941b98f24c1a,0c396fcba84a42f9a7c64fa4,Rejected,2023-08-06T12:43:21.427958Z,2023-10-02T12:43:21.427958Z,0,"Seem common finish. Other huge Mr produce about technology.
Foreign line market again. Standard anyone here plan. Seek behind white senior.",2.0
5a5e011e0a634555ba3718ba,6612948aaddf941b98f24daf,66129480addf941b98f24d13,ef6bd999c63a412c83b337e4,Rejected,2023-10-09T12:43:21.427958Z,2024-01-24T12:43:21.427958Z,0,"Attention matter choice camera including series. Debate message side stay member.
Population tree six support put. Skill argue table simple assume father present.",4.0
99ed984aede144cf891725a2,66129481addf941b98f24d2f,6612947eaddf941b98f24d00,27d01bc665684bc09fd97d4f,Rejected,2023-09-03T12:43:21.428468Z,2023-09-13T12:43:21.428468Z,0,"Among right course main say. Run color mother finally responsibility woman.
Section keep population. Drop become quite. Change so manage red all especially.",1.0
2a282dfb7c734ec08b1cc1d6,66129480addf941b98f24d1f,6612946daddf941b98f24bec,8ae88025bd1547488f6d5e51,Rejected,2023-12-14T12:43:21.428468Z,2024-03-03T12:43:21.428468Z,0,"Science life likely. Remain such win.
Despite traditional eat meeting heart young affect. Computer shoulder prepare staff.",1.0
aabb88e2e382464d802855d6,66129487addf941b98f24d86,66129477addf941b98f24c85,100f6488b4e94731b13fe303,Approved,2024-01-30T12:43:21.428804Z,2024-04-12T12:43:21.428804Z,0,Share above program pick city method something. Social early huge star continue a.,2.0
e28a19178fb9428dbd4f46c1,66129489addf941b98f24daa,6612948aaddf941b98f24dae,b0b30648152a48c793d5c828,Pending,2023-10-06T12:43:21.428824Z,2024-03-28T12:43:21.428824Z,0,,
ea380ed25cbd4b46ac114d87,66129489addf941b98f24d9d,66129476addf941b98f24c7c,b0c2480d87534acaa8bb8bfb,Rejected,2023-04-17T12:43:21.428824Z,2023-10-14T12:43:21.428824Z,0,"Throughout matter system happen piece. South training off drop third visit.
Billion future pay direction whose executive bank along. Need politics particular really pay.",2.0
0b1a7b05a4174717a187da9f,6612947faddf941b98f24d01,6612947caddf941b98f24cde,4c4421ff5f5349a9991eb6e0,Approved,2023-10-04T12:43:21.428824Z,2024-08-25T12:43:21.428824Z,0,"Instead sing now nothing see check perhaps.
White state data show out management citizen. House former research book ever indicate. Suffer security yourself movie.",1.0
ac1cb4a9856a4468b98d8bd9,66129482addf941b98f24d32,66129474addf941b98f24c5e,f9947464a50149bd890783fe,Pending,2024-03-22T12:43:21.428824Z,2025-02-17T12:43:21.428824Z,0,,
95ac614a9c964ed289bdc514,6612947eaddf941b98f24cfc,66129486addf941b98f24d76,3068aa4dcf934a77a14bdb8c,Rejected,2024-02-29T12:43:21.429485Z,2024-10-14T12:43:21.429485Z,0,"Strategy trade certain education serious.
Business eye clear decide. With course skin itself project until clearly.
Produce once care fact. Small down consumer heart list meeting arm son.",5.0
18ec2acafd294ee0bdfc2e17,6607d1475162a636379e9834,66129470addf941b98f24c18,75f7503e89c2414c838f7a83,Rejected,2023-09-07T12:43:21.429485Z,2024-05-29T12:43:21.429485Z,0,"Establish economic year manage citizen. Pretty away type size move agent real. Call they might world list like by.
Fine involve your along senior piece. Finish public sell fine church since official.",2.0
88865cb090d849dca3191cdf,66129477addf941b98f24c8e,66129472addf941b98f24c3d,ca04e9108178492fabcc7dbb,Rejected,2023-12-27T12:43:21.429485Z,2024-03-18T12:43:21.429485Z,0,"Thus follow walk me his know official pull. Safe at almost senior.
Under memory yeah heart. Teach production rest top effort down. Need meet thought true science show director.",4.0
5bed3e2c11504a3c81f89cef,66129471addf941b98f24c2e,66129471addf941b98f24c27,7e3531e117494831b269e065,Approved,2024-03-02T12:43:21.429485Z,2025-02-20T12:43:21.429485Z,0,Various benefit I trade. Number follow career evidence. North chance focus suddenly heavy rule door reflect.,2.0
2c3e0c63c2634a9f924e030e,66129486addf941b98f24d74,66129473addf941b98f24c46,a2ab247f8b4c41cc9fdb047e,Rejected,2023-05-30T12:43:21.429485Z,2023-12-06T12:43:21.429485Z,0,"Popular subject machine it. Each about Democrat three couple. A leader serious poor.
Hit green resource program. Factor east remain live tree.",4.0
a394ff213a4445f2bc0520e8,66129481addf941b98f24d2e,66129471addf941b98f24c26,39dd9abf5b05427593ca8030,Rejected,2024-02-06T12:43:21.429485Z,2024-09-15T12:43:21.429485Z,0,"Game data science born. Appear watch bank quality human under wait. Office new drive glass national address.
Blood improve product represent teach almost fish.",5.0
0f8a1aea830f459b922cc95c,6612947baddf941b98f24cc8,66129472addf941b98f24c3b,559def1274424316abb719d8,Rejected,2023-10-22T12:43:21.429485Z,2024-10-02T12:43:21.429485Z,0,"Thousand give half. Service win quickly half allow.
Lead choose life. Best son watch ahead woman.
Nature everything building.",4.0
11daa4b54099427e8a57d0f4,66129479addf941b98f24caf,66129483addf941b98f24d40,19a81287c3c94a7dbd132bf9,Pending,2023-09-19T12:43:21.429485Z,2023-10-05T12:43:21.429485Z,0,,
a66549dd09584d25b3295bf7,66129475addf941b98f24c65,6612947eaddf941b98f24cfa,f7992ae11863454ca200ec77,Pending,2023-06-26T12:43:21.429485Z,2023-07-16T12:43:21.429485Z,0,,
20c04dad764346d5aff4e222,66129474addf941b98f24c57,66129477addf941b98f24c91,d46328b2feb3426abc1bd771,Rejected,2023-10-22T12:43:21.429485Z,2024-09-17T12:43:21.429485Z,0,Generation difference give own environment participant end. Return only may.,4.0
096bf4e68f2c44a298d2b96e,66129486addf941b98f24d72,6612947daddf941b98f24ce9,bf6055b460f34989afc32529,Rejected,2024-01-09T12:43:21.429485Z,2024-01-19T12:43:21.429485Z,0,"Case hotel worry perform building Mrs.
Both for everybody interview similar town movie. Near sure travel somebody partner.
Task like sport series until. Use or easy than. Trouble with such section.",1.0
003441eeb97e433aa7932f68,66129477addf941b98f24c8a,66129476addf941b98f24c84,d8a4b34d4c814a17b8bdaff5,Approved,2023-07-16T12:43:21.429485Z,2023-12-15T12:43:21.429485Z,0,"Source nothing but pay. That hundred drive.
Federal science pay happy as compare suddenly. Enough candidate part similar let. Yes news third along against.",4.0
6d562571df404a0795d1173a,66129476addf941b98f24c7c,66129476addf941b98f24c79,9240477469824f938e2a5707,Pending,2024-02-21T12:43:21.429485Z,2025-02-17T12:43:21.429485Z,0,,
59a0fe5160d649edb87094a6,66080b1eb85746ebc7e4064f,66129478addf941b98f24c9c,7cea030939d14aecbe14d75c,Pending,2023-06-24T12:43:21.429485Z,2024-06-18T12:43:21.429485Z,0,,
4befbd3730f044c9b3c7679e,6612947caddf941b98f24cd7,66129483addf941b98f24d4a,59242bf6dfc045849727e150,Rejected,2024-03-20T12:43:21.429485Z,2024-06-26T12:43:21.429485Z,0,Season dark question lead organization special. Early item bar kid. Hard half little old.,5.0
