_id,userId,approverUserId,userSkillId,status,createdAt,updatedAt,__v,comments,rating
9b02932437424143b1f4269d,6612947caddf941b98f24cd3,66129483addf941b98f24d4b,6f82f3f90b614a4ca4be1719,Rejected,2023-11-13T12:43:21.518662Z,2024-01-17T12:43:21.518662Z,0,Cost available current window standard kind around. Expect case space enter save southern worry. Interest admit save teacher include.,5.0
8286909bed8042abb4bb6d1e,66129470addf941b98f24c17,66129480addf941b98f24d16,ec17a69825b443ccb55211f3,Pending,2023-12-18T12:43:21.518662Z,2024-07-29T12:43:21.518662Z,0,,
da402d1505134df4b8e2938f,6612947daddf941b98f24cf0,6612947caddf941b98f24cdc,50f7d0a5464444abab7ba4a7,Approved,2023-11-20T12:43:21.518662Z,2024-07-05T12:43:21.518662Z,0,"Firm former begin. Moment various himself about word sure. Trip occur air where case.
Class them act. Politics something memory figure sell thing.",5.0
03fc963c4cd44fa1bc90c816,66129477addf941b98f24c8f,66129470addf941b98f24c1b,d07610400baa4574a754f6b6,Rejected,2023-06-20T12:43:21.518662Z,2024-04-17T12:43:21.518662Z,0,Three difficult receive past black many system. Keep center interest third. Play this describe. General interview might available both result open.,4.0
dba43ae0473448e88b6aad97,66129486addf941b98f24d79,66129471addf941b98f24c34,23d51bfec36041bca45c996c,Pending,2023-10-17T12:43:21.518662Z,2024-03-23T12:43:21.518662Z,0,,
c8e63732b13f4bffa912a658,6612946faddf941b98f24c0c,66129478addf941b98f24c9b,07b540519d114e36bb51545a,Pending,2024-02-21T12:43:21.518662Z,2024-09-26T12:43:21.518662Z,0,,
f2bcbfc59b5748f19b7ec21b,66129478addf941b98f24c9e,66129479addf941b98f24ca9,e58c8522b55f460db74072eb,Pending,2023-11-09T12:43:21.518662Z,2024-06-07T12:43:21.518662Z,0,,
7f0e6dcddfc141978615d997,66129489addf941b98f24da4,66129487addf941b98f24d81,574263389d534958bd5371e1,Pending,2023-08-23T12:43:21.518662Z,2023-11-28T12:43:21.518662Z,0,,
3ee70c63a25540f6924ed8df,6612946eaddf941b98f24c02,6612948aaddf941b98f24db6,4cbe8c03df22422caa61323a,Approved,2023-11-30T12:43:21.518662Z,2024-05-03T12:43:21.518662Z,0,"Base bed often memory even. Million research opportunity quite result car trial senior.
Reach medical matter sing low court finish. Agree car option agent side right time from.",1.0
08072d4582bb43cc8b7c549e,66129472addf941b98f24c35,66129472addf941b98f24c36,de6567327985464cbe3a0c8d,Rejected,2023-10-14T12:43:21.518662Z,2024-08-28T12:43:21.518662Z,0,"Young something what enjoy hotel glass here. Which sort to. Along office region wife thought mind trial.
Style indicate event table. Media prepare fact accept later.",1.0
1b34116fc9bc4c318908c62d,66129476addf941b98f24c77,66129480addf941b98f24d18,fc2cdcf831b64f5993bde42c,Approved,2023-12-22T12:43:21.518662Z,2024-06-13T12:43:21.518662Z,0,"Democrat capital international month water boy. Consumer success through.
Anyone account onto fight again tough energy water. Open cost good than.
Draw live too friend.",1.0
5b4926c71ef94ca7a66393e7,6612948aaddf941b98f24db5,66129477addf941b98f24c8f,1969a53fb824467aaedfdb08,Approved,2023-11-22T12:43:21.518662Z,2024-05-19T12:43:21.518662Z,0,"Form special leg operation. Congress trip work material town discussion full.
Yet shoulder key become involve opportunity. Born call each become six tree past. Pattern ten campaign nearly wrong.",1.0
661368a00388476daa122bbb,6612947baddf941b98f24cc4,6612946daddf941b98f24bef,7089a1d82ca84ad68ef715df,Pending,2023-06-24T12:43:21.518662Z,2024-03-17T12:43:21.518662Z,0,,
5723434b79be4bd884a4906a,66129485addf941b98f24d6b,6612948aaddf941b98f24db0,6e4f73ce033a44469a17bb37,Approved,2023-12-10T12:43:21.518662Z,2024-02-17T12:43:21.518662Z,0,Hundred whatever into one nothing. Total Republican language activity list. Moment case recognize father prove.,5.0
f6ca058fa8034b708b1473c0,6612947faddf941b98f24d06,66129483addf941b98f24d49,10603713e162414eaf2051ff,Rejected,2024-02-24T12:43:21.518662Z,2025-02-21T12:43:21.518662Z,0,"Pretty study feeling phone throw born line. Peace if that. Cold book avoid rock.
Mr light lot thus. Test couple half window Mrs mouth thus. Want success region his by.",3.0
baff86d8f66a4fd2a9397595,66129484addf941b98f24d59,66129470addf941b98f24c17,3168258d1b774f78a6bf4f59,Pending,2023-07-02T12:43:21.518662Z,2024-01-05T12:43:21.518662Z,0,,
d42b907defb14feab1137b99,66129476addf941b98f24c7e,6612947faddf941b98f24d0a,7089a1d82ca84ad68ef715df,Approved,2023-11-08T12:43:21.518662Z,2024-02-16T12:43:21.518662Z,0,Such call real safe. City open begin suggest official bill. Mr oil she six determine such animal.,2.0
e2c597804f564608b6d8ac62,66129483addf941b98f24d47,6612947daddf941b98f24ce2,2f160b5ebe4541a7b2419d8d,Rejected,2023-07-14T12:43:21.518662Z,2024-05-15T12:43:21.518662Z,0,"About wait yeah actually administration. Catch seek though.
Action north article newspaper follow left already plant. With upon education. Right animal what foot next.",2.0
2446afd28b5f4715875f94a7,6612947caddf941b98f24cdb,66129473addf941b98f24c48,2c6ddde051d0434d97f10830,Approved,2023-09-24T12:43:21.518662Z,2023-12-16T12:43:21.518662Z,0,Six tell white hope yet personal simply. Card short charge president fall. Store popular decide meeting try style light.,5.0
f2b487c175c9434b9e49e0f4,66129479addf941b98f24ca7,66129475addf941b98f24c6a,c9a9a18628324184848c6f6a,Pending,2023-10-12T12:43:21.518662Z,2023-11-15T12:43:21.518662Z,0,,
b764eaa9fecb4e07944c0cde,66129486addf941b98f24d77,6612946caddf941b98f24bde,b91895c7c6844b44ae3f9e76,Approved,2023-09-16T12:43:21.518662Z,2024-06-13T12:43:21.518662Z,0,Vote sell onto interview another family. Late force military each. Another environment also reason my Mrs.,5.0
232fc237acfc4455bba8fb54,66129483addf941b98f24d44,66129479addf941b98f24caf,84936964ce974d9382f65fbb,Approved,2024-01-08T12:43:21.518662Z,2024-03-26T12:43:21.518662Z,0,"Prepare ground detail. Community measure personal someone perform buy recent.
Stay fine election woman use visit ten. Send then boy so into southern.",1.0
8bb2212ca405454f8ce62081,6612946eaddf941b98f24bfc,66129480addf941b98f24d1e,dbc163c67db746639a66c38c,Rejected,2024-02-14T12:43:21.518662Z,2024-05-16T12:43:21.518662Z,0,"Great stop among girl will. Good world officer century say individual myself. Significant price know the.
Research pattern without four government. Should force newspaper detail carry.",5.0
882682edd880425b8ec50e05,6612947daddf941b98f24ce2,6612947eaddf941b98f24cfb,6527f6cda9ff4fe49f181a25,Approved,2023-08-01T12:43:21.518662Z,2023-12-11T12:43:21.518662Z,0,"Position food book discuss range remember police. Both executive various president involve whole plant.
South when history meeting stop. Baby pattern describe building citizen. Too pull ball.",5.0
21937d5eb255413f86fb2af5,66129486addf941b98f24d73,6612948baddf941b98f24dbe,f6f65e3a87b94a8d9eb5c914,Approved,2023-05-29T12:43:21.518662Z,2023-05-31T12:43:21.518662Z,0,"According real set art. Teacher push television campaign myself join. Some dark role major page tax old.
Much choice policy campaign concern buy. Player exist site decide off fine child find.",1.0
64f43fa5d0a94603b8b7e2fa,66129483addf941b98f24d40,66129487addf941b98f24d87,889ecddce06f42a1b0f478b1,Rejected,2023-10-01T12:43:21.518662Z,2024-05-24T12:43:21.518662Z,0,"List road area onto check bar sea. Possible where employee three.
Deal too evening despite. Happy trial common sense play move art market. War house model administration key end.",1.0
d0e80ca4fc6041248caa3c87,6612946baddf941b98f24bd0,66129486addf941b98f24d78,dcb6c1f320004af7b14e41aa,Approved,2023-07-12T12:43:21.518662Z,2023-10-16T12:43:21.518662Z,0,"Kid beyond lead.
Son pay best middle officer area suddenly we. Meeting available visit deal. Apply manager woman follow follow art son. Buy seek hold TV unit tonight whose.",4.0
3b3abc03a48b48a3ad1b1e64,66129476addf941b98f24c83,66129488addf941b98f24d9a,b6a76af242fc473db84bb998,Pending,2023-05-05T12:43:21.518662Z,2024-04-17T12:43:21.518662Z,0,,
f97495bf2e544820a1c7ab81,6612946faddf941b98f24c09,66129480addf941b98f24d1d,e0611afe37fd47559c83636e,Approved,2024-03-17T12:43:21.518662Z,2024-11-21T12:43:21.518662Z,0,Well young agent total daughter great despite none. Happen site however spend life third ability. Likely owner past ball know. Series physical theory however.,5.0
902939bee02a46fd93ecd61c,6612947baddf941b98f24cc9,66129484addf941b98f24d54,98f0c1d0b97849b59eda0293,Rejected,2024-01-19T12:43:21.518662Z,2024-08-08T12:43:21.518662Z,0,"Yard professor visit. Second station any act.
Enough everything ever whom. Head present a today baby goal weight. Economic court senior financial bed across happen article.",3.0
5e59d86a59bf40b9ae5f74b2,6612946caddf941b98f24be5,6612947eaddf941b98f24cf6,ea90f6963b76473ebe5e6e66,Pending,2023-09-15T12:43:21.518662Z,2024-04-26T12:43:21.518662Z,0,,
f92bad0cfa124080aa5bc61a,66129489addf941b98f24da7,6612946baddf941b98f24bd1,9c2a4be288b6499287db53d7,Rejected,2023-06-27T12:43:21.518662Z,2024-03-21T12:43:21.518662Z,0,"Son itself hear. Would determine send Congress. Read final hour remember.
Will TV international career. Free state himself. Year heart purpose stock final.",1.0
824d42ab75e94463ac9674af,66129483addf941b98f24d45,66129486addf941b98f24d6d,c6670f6ddb4b4eb3ba829250,Rejected,2024-02-23T12:43:21.518662Z,2025-01-16T12:43:21.518662Z,0,"Draw information religious. Street call control why shoulder beautiful.
Democrat pay although. With black page win pretty appear. Out wide direction.",5.0
23ab3bb6479945a385d4b148,66129487addf941b98f24d84,66129476addf941b98f24c7d,79e86aa222174b1a9d5ee658,Rejected,2023-12-08T12:43:21.518662Z,2023-12-14T12:43:21.518662Z,0,American media remain under day use. Doctor red either laugh throw. Build woman spring pass it concern note difference. Her manager by general thousand central lose.,4.0
1852ae8ba12840c4acb5fca9,66129477addf941b98f24c8c,66129480addf941b98f24d15,74d6e36e42fd48b7aa97bc94,Rejected,2024-03-17T12:43:21.518662Z,2025-03-11T12:43:21.518662Z,0,Surface but direction experience like test least. Price under health continue buy rise.,5.0
db5bb45d681140d390726ec9,66129487addf941b98f24d8b,6612946eaddf941b98f24bfe,f55cc1a759f743d0b19d4863,Pending,2023-12-06T12:43:21.518662Z,2024-08-01T12:43:21.518662Z,0,,
89348ff5789a479aa3e8fe15,6612946faddf941b98f24c09,66129471addf941b98f24c31,3c73cc14720d4213bc50c6d7,Rejected,2023-10-26T12:43:21.518662Z,2023-11-26T12:43:21.518662Z,0,"Degree cold step trial. Nor form control. Probably skin response already magazine against. Natural business class long.
Successful answer mean difficult.",3.0
82099546c80c4be6a3535101,66129486addf941b98f24d7b,66129470addf941b98f24c1f,84658ef9a6b24a33981345f6,Rejected,2023-07-14T12:43:21.518662Z,2024-02-14T12:43:21.518662Z,0,"Manager daughter pick far since have. Down center arm trouble form would every.
Month test police community value. Less whatever gas various site.
Bill between want each rate space through even.",1.0
9bf6616ee71b4f2a936e124a,66129486addf941b98f24d74,6612946caddf941b98f24be1,9e79bf0b10874c84a2069f50,Rejected,2024-02-27T12:43:21.518662Z,2025-01-30T12:43:21.518662Z,0,"Affect media return admit act daughter quality.
Thousand suggest sea doctor wrong film. Develop opportunity seek apply available hundred.",3.0
5a4d07e94f6e4e9f8cd7a45a,66129487addf941b98f24d80,66129472addf941b98f24c3c,5ddb5e733699464e8537bb58,Approved,2023-12-20T12:43:21.518662Z,2024-05-25T12:43:21.518662Z,0,"Past step century school agreement threat. Rate body trial method rise. Baby happy community yourself understand.
Hot hour next themselves be. Which then whatever that.",4.0
c19d47f2299f486ea1eee55e,6612946faddf941b98f24c0f,6612946daddf941b98f24bf1,44e36ba6733644559001942b,Rejected,2024-03-05T12:43:21.518662Z,2024-11-04T12:43:21.518662Z,0,Throw financial century appear our significant. Live culture audience order. Ten probably discussion entire.,5.0
47ed37eabe934ba881cedfbe,6612946faddf941b98f24c08,6612947caddf941b98f24cd6,1b95df4ad8514c03aa8d1d36,Rejected,2023-04-19T12:43:21.518662Z,2023-04-27T12:43:21.518662Z,0,"No thought marriage. Make world low animal it five. National stay minute response local total away.
Idea way memory industry again. Environmental somebody traditional thousand down usually mention.",1.0
a6de4ff176fc4f2bba71a8c4,66129484addf941b98f24d5c,6612947faddf941b98f24d06,0436d811213a44a6a62d81af,Pending,2023-08-09T12:43:21.518662Z,2023-11-07T12:43:21.518662Z,0,,
e8569ab433f44f4fab3b2e6a,66129484addf941b98f24d50,66129485addf941b98f24d69,ede3ef335123440093cecf0b,Approved,2024-02-17T12:43:21.518662Z,2024-03-13T12:43:21.518662Z,0,Money career available produce church smile. But those them responsibility for attack each. Political couple every create.,5.0
1660e3d72dc144d7af62936e,66129487addf941b98f24d82,66129486addf941b98f24d71,b4b4090dd777406681596335,Pending,2024-01-01T12:43:21.518662Z,2024-10-01T12:43:21.518662Z,0,,
986cca87baed45c8bf50fde1,66129481addf941b98f24d21,66129473addf941b98f24c47,98caf5d9963e4554b9e37557,Pending,2023-11-02T12:43:21.518662Z,2024-06-17T12:43:21.518662Z,0,,
b6464fd322044822b818f4bf,6612947eaddf941b98f24cf7,66129476addf941b98f24c75,00a22584d3a64e87a5d52d55,Rejected,2023-04-21T12:43:21.518662Z,2023-10-12T12:43:21.518662Z,0,"Area source girl thing. Food take sign.
Land well realize response. Drug operation more become save yet. Poor indicate road indicate second smile home decision.",2.0
60481494caa047f2af084a09,66129488addf941b98f24d8e,6612946caddf941b98f24be3,85bad7cb94a249928f3b5d13,Rejected,2023-06-17T12:43:21.518662Z,2023-11-08T12:43:21.518662Z,0,Be born skill certainly per skill get. Can save site accept medical example performance. Wind build life although notice tax country rather.,1.0
8a0fa4bbab0a46aeacde61b0,6612947aaddf941b98f24cbb,66129472addf941b98f24c39,7db5f5c1502a4820be88a0d7,Pending,2023-10-02T12:43:21.518662Z,2024-04-06T12:43:21.518662Z,0,,
0f1c12b9d51348fc8ac76224,6612948aaddf941b98f24dba,66129485addf941b98f24d60,a33a030f6a9744529a66fb44,Rejected,2023-09-18T12:43:21.518662Z,2024-04-10T12:43:21.518662Z,0,"Occur bad fact eat my give before natural. Anyone weight reach indicate section character.
Real leg western east local size. Let him car have. President young current seem social significant.",4.0
878eb6cebc02431db4eb05d8,66129477addf941b98f24c88,66129474addf941b98f24c5d,c852c8b5bd764f87936f671f,Pending,2023-04-25T12:43:21.518662Z,2023-10-21T12:43:21.518662Z,0,,
a94ad4c8b921425091bed47b,66129480addf941b98f24d1a,66129475addf941b98f24c67,83a80f82772d4f40aa3b5a41,Approved,2024-02-15T12:43:21.518662Z,2025-01-20T12:43:21.518662Z,0,"Hope defense store director.
Campaign town machine fight national political. Deal make short knowledge world. Relationship drug hear kitchen task office scientist.",5.0
198ba8a0ea9d457da2d6c56f,66129479addf941b98f24caf,66129483addf941b98f24d4d,2db2a5a8d27a48aaa0087e81,Rejected,2023-05-27T12:43:21.518662Z,2024-04-03T12:43:21.518662Z,0,"Hair rule cover benefit. Control city today enough. Focus enjoy although. Respond true sort usually real behind.
State building seem grow peace spring. Key sign region develop prepare star.",2.0
e316abd8c49d490db9505cbc,66129489addf941b98f24da9,66129473addf941b98f24c4f,cf444674095945d5bfff2cd5,Approved,2023-07-01T12:43:21.518662Z,2023-10-28T12:43:21.518662Z,0,Audience design into rock pressure. Budget democratic soldier property either usually. Media adult star off money choose culture.,5.0
3a718a48a0144a8196eb60d8,66129489addf941b98f24da4,6612947faddf941b98f24d02,31c07d44c83e4b74b70e8049,Pending,2024-02-06T12:43:21.518662Z,2025-01-04T12:43:21.518662Z,0,,
669a2b11670643b0a98df25f,66129488addf941b98f24d98,6612947aaddf941b98f24cc1,f207501f55324693be5356ab,Rejected,2023-09-28T12:43:21.518662Z,2024-01-08T12:43:21.518662Z,0,"Sister home wear ability thousand.
Process visit figure our force. Exist nation quickly inside line him miss represent. Can two yard a.",5.0
9160057c2e18417585f9f5c8,66129478addf941b98f24c96,6612946faddf941b98f24c12,5b88f088ca27457680ba0cf8,Pending,2023-06-06T12:43:21.518662Z,2024-01-31T12:43:21.518662Z,0,,
a1ce468857f1449282359ab9,6612946caddf941b98f24bde,6612947baddf941b98f24cc5,195b66b4db7047f79de1af26,Rejected,2023-06-07T12:43:21.518662Z,2023-09-22T12:43:21.518662Z,0,"Move go food century. Team blue continue treatment. Not rather detail situation from stay lead owner.
Turn point fight edge be. Art here site sometimes case think. Stand sea art although surface.",4.0
8ac7b58133014a6fb75b337e,66129471addf941b98f24c25,66129476addf941b98f24c7b,53b7b1cfee6b44c39b64b133,Rejected,2023-09-16T12:43:21.518662Z,2024-02-03T12:43:21.518662Z,0,Bar blue really down put remain. Community recently community shoulder minute.,2.0
c234f618857d4331867cde35,66129474addf941b98f24c55,66129478addf941b98f24c99,5b3bf46e21c0450bbd0c6bd5,Approved,2023-06-01T12:43:21.518662Z,2024-01-05T12:43:21.518662Z,0,"Area church effort mission class appear. Country effort visit reduce senior. Yard final score in however look community. As summer describe instead.
Beyond chance finally community rise involve.",2.0
f9223ed8dc2b4c999f811c58,6612946caddf941b98f24be2,6612947aaddf941b98f24cbc,021fb242017046d4b1cfb3c0,Approved,2023-10-11T12:43:21.518662Z,2024-05-01T12:43:21.518662Z,0,"Quickly moment structure action.
Rate behavior them point parent learn. Truth Congress miss make.",4.0
d05834c2d4624255b154979c,66129485addf941b98f24d66,66129483addf941b98f24d4b,3c415026b2b34abcab7fc275,Approved,2023-06-15T12:43:21.518662Z,2023-10-02T12:43:21.518662Z,0,"Piece current leader. Determine staff study crime ground writer.
Total floor sing might impact benefit machine with. Act provide happen religious entire near note.",2.0
a5f0edf2e2dd4317bcdeb1cf,66129471addf941b98f24c2c,66129474addf941b98f24c5e,10f3ae47689d4ee495ba338e,Approved,2024-02-10T12:43:21.518662Z,2024-11-10T12:43:21.518662Z,0,"Hotel front few her less certainly. Challenge election others world without popular.
House either room play pull western clear. Reduce so show brother thus attention pattern. Fear or four personal.",1.0
13a3d02e6db74ae6a9e2b32d,66129482addf941b98f24d33,66129480addf941b98f24d1f,a346f1269be8444dbf9cecaf,Approved,2024-02-02T12:43:21.518662Z,2024-11-29T12:43:21.518662Z,0,Life person her chair perform Republican. Time despite name itself alone worker throughout once. Dark style collection standard rate whole down.,1.0
e25f346aad2b459d8f656ed5,66129487addf941b98f24d88,6612948aaddf941b98f24dab,39dd9abf5b05427593ca8030,Rejected,2024-03-29T12:43:21.518662Z,2024-09-03T12:43:21.518662Z,0,"Hair Republican just ever husband. Much everybody game consider else commercial. Measure thing animal.
But fill radio free at. Start us fight send.
Price former day happy such such even.",5.0
0fa7f5c7602c4a308e39feba,6612946daddf941b98f24bf2,6612947daddf941b98f24ce7,fc825d3692b14bd08d8b7935,Pending,2024-04-05T12:43:21.518662Z,2024-06-03T12:43:21.518662Z,0,,
e10be868dbae4add88b054aa,66129486addf941b98f24d73,6612948aaddf941b98f24dab,4e4d55a7e6d945bea83ae03b,Approved,2023-04-29T12:43:21.518662Z,2023-08-28T12:43:21.518662Z,0,"Cell bill agreement. Alone article song keep main.
Daughter least range whatever difference expect reason. Forget expect trial person work certainly.",4.0
69464436e1fc444084b5ed21,66129481addf941b98f24d28,6612946eaddf941b98f24c00,3484697d26444a43b2c289ec,Rejected,2023-06-26T12:43:21.518662Z,2024-06-10T12:43:21.518662Z,0,Everyone rise almost claim Mrs same. Official cut rise anything building certainly serve sport. Head these up bad.,4.0
2b65b54163944e55ba2b2c9d,66129482addf941b98f24d34,66129472addf941b98f24c38,9a36dd0d0e13431baeb17eea,Rejected,2023-10-10T12:43:21.518662Z,2023-12-09T12:43:21.518662Z,0,"Paper imagine soon according argue pass. Ask training later yeah gas parent enjoy.
Environmental send anything affect. Offer over decade plan.",1.0
e9622fb97fe84b218fb464d9,66129480addf941b98f24d1d,66129481addf941b98f24d26,1dde12eb59e84ff699de4604,Approved,2023-08-24T12:43:21.518662Z,2024-05-01T12:43:21.518662Z,0,"Write history five to sit able. Often learn sense sport speak. Seek some large opportunity civil on.
Study concern watch. No onto common after option.",5.0
3ca031f2fd2f4f77897fb6bd,6612946caddf941b98f24bdd,66129476addf941b98f24c75,cf3fdf508d1249aa8538284a,Rejected,2023-12-24T12:43:21.534282Z,2024-05-12T12:43:21.534282Z,0,"Story seat agency design. Mind necessary catch sing.
Live state foreign interview image thank traditional child. Not popular control tax work main main. Like personal pick attack behavior.",1.0
6fe0bbe6b7b74526ad8b91e2,66129487addf941b98f24d87,66129484addf941b98f24d5c,5d26574475ab4485998fab1c,Rejected,2023-09-05T12:43:21.534282Z,2024-03-18T12:43:21.534282Z,0,"Single plan through doctor. And expect probably your else similar member.
Which point truth write someone trade. Contain single environment down give.
Treatment show show however avoid race.",5.0
709d0ca3cfef4d82aee8751c,66129488addf941b98f24d91,6612947daddf941b98f24ce6,cf2f986ee2954974b398840f,Pending,2024-03-13T12:43:21.534282Z,2025-01-27T12:43:21.534282Z,0,,
be5264f54b1c4ea783b5bd2d,66129488addf941b98f24d8e,66129481addf941b98f24d28,9eb9bcbbfa614511b0bf2515,Pending,2023-05-02T12:43:21.534282Z,2023-09-16T12:43:21.534282Z,0,,
6886a7f794324902b2a10d39,6612947aaddf941b98f24cbf,6612947baddf941b98f24ccf,de2196ba79e94321acb4b56b,Rejected,2024-01-10T12:43:21.534282Z,2024-11-23T12:43:21.534282Z,0,"Ball price dog later nation. Establish nearly bag happen high charge huge.
Safe tax Mr music light mouth military life. Like discuss occur south.",4.0
0a579a4f57a84b55ab67aefb,66129477addf941b98f24c8b,6612948aaddf941b98f24db0,a1029bbe7d304f069f847d74,Pending,2023-10-08T12:43:21.534282Z,2023-12-03T12:43:21.534282Z,0,,
0e4af6eb8b0f4aec887beef1,66129472addf941b98f24c39,6612947eaddf941b98f24cf2,9fb1b22b35a44a1fba200047,Approved,2024-01-04T12:43:21.534282Z,2024-06-24T12:43:21.534282Z,0,Standard improve indeed the expert establish. Popular whatever hot. Paper should training single certainly ability.,5.0
b046890847b74dd1b5043ec1,66129483addf941b98f24d47,66129479addf941b98f24ca3,7e35a04dc06748f696c73a1d,Rejected,2023-12-06T12:43:21.534282Z,2024-03-21T12:43:21.534282Z,0,"Well life lawyer husband. My pressure floor out. Through life information himself. Open our indicate majority.
Hard than surface add every. Environment student begin wish program garden could.",1.0
c8af7e5459914ce3ac9de3de,6612946eaddf941b98f24bfe,66129477addf941b98f24c8f,574263389d534958bd5371e1,Approved,2023-04-22T12:43:21.534282Z,2024-01-13T12:43:21.534282Z,0,Structure lot consider partner. Fact before knowledge charge foreign probably medical. Agency huge music debate energy. Subject blue different girl policy.,1.0
5667885bf6ef465b95dc122c,6612946daddf941b98f24bea,6612947baddf941b98f24cc3,7712a8ae528f4dc086abe5f6,Rejected,2023-11-03T12:43:21.534282Z,2023-11-20T12:43:21.534282Z,0,"World your financial response affect any. Stay ahead wrong scene sell then case become. Even to so feeling.
Hand question discussion computer write maybe movie. Put western charge.",3.0
49c87f246ba047b7b6eeafae,66129475addf941b98f24c73,66129475addf941b98f24c66,a922a4f36d8b498b83cc4f16,Rejected,2024-01-04T12:43:21.534282Z,2024-05-02T12:43:21.534282Z,0,"Knowledge enter statement possible skin other. Minute lawyer story.
Easy relationship position my that peace. College beyond business network cover. Keep summer table account.
Natural not garden.",1.0
ae9cc5c4c36747a6bbcb943a,66129476addf941b98f24c79,6612947aaddf941b98f24cbe,1a5feae9912c4e91a9092b37,Pending,2024-03-22T12:43:21.534282Z,2024-06-07T12:43:21.534282Z,0,,
24354ad6c5c947439861966b,66129479addf941b98f24cab,66129476addf941b98f24c7e,2a6d6b6751dd4a37a112306c,Rejected,2024-02-27T12:43:21.534282Z,2025-01-10T12:43:21.534282Z,0,"Should student describe call. Which its alone buy maybe. Nation morning computer source hold management.
Economy street high. Attention me discover material floor.",5.0
c682fc3ef5a14136a8e4879a,66129475addf941b98f24c66,66129477addf941b98f24c8b,0c18301ca8b9495b8e04691f,Rejected,2023-04-14T12:43:21.534282Z,2024-03-11T12:43:21.534282Z,0,"Role adult alone heavy. Concern other trip common I film such debate.
Skin huge green them expect. Provide modern operation again apply.",3.0
48cabdfb507a420aa0693b12,66129483addf941b98f24d4a,6612946faddf941b98f24c08,977006d6e8fe4328bd62b4a4,Rejected,2024-02-27T12:43:21.534282Z,2024-08-24T12:43:21.534282Z,0,Move century travel arm meet. As write build federal front certainly produce. Bed himself wear happen. Produce structure discuss onto lawyer force contain that.,5.0
99a81456f7a842e5b1259265,6612947baddf941b98f24cc6,66129484addf941b98f24d57,ee686aac87dd41bead632cb8,Pending,2023-04-09T12:43:21.534282Z,2023-07-12T12:43:21.534282Z,0,,
3f737cab87b64b6d9465e8ad,66129485addf941b98f24d5d,6612947faddf941b98f24d08,f5da64aafad44c72b037e7da,Pending,2024-01-29T12:43:21.534282Z,2024-05-07T12:43:21.534282Z,0,,
d3fc4d86110647d48fbe49e6,66129477addf941b98f24c87,6612947faddf941b98f24d06,19f44be23ab64ecd938d9baf,Approved,2023-09-26T12:43:21.534282Z,2023-10-22T12:43:21.534282Z,0,"Above fall catch generation age left. Loss environmental mother ever. Cultural find left side spend.
Tree since second light Mrs garden act son. Ago surface space person catch move.",3.0
677bdbb38be14c50966919ba,66129485addf941b98f24d63,66129482addf941b98f24d3e,8de03b0e4a6a40dd9c6d44f8,Pending,2023-06-29T12:43:21.534282Z,2024-01-13T12:43:21.534282Z,0,,
5af50a988f4d41cda76ba463,66129487addf941b98f24d8b,66129489addf941b98f24d9e,1dccc9cbb0994721a705519f,Approved,2023-10-17T12:43:21.534282Z,2024-08-13T12:43:21.534282Z,0,Approach each increase store soon around. Clearly low suddenly food way. Real something drive father where once job. Several TV fund leg suddenly themselves.,4.0
9e849d6653334dffb4092b07,66129486addf941b98f24d79,66129470addf941b98f24c21,c878312c2e594162992c64dd,Pending,2023-11-27T12:43:21.534282Z,2024-09-03T12:43:21.534282Z,0,,
a03d89d1b9c54f73a83321c1,66129481addf941b98f24d2b,6612947daddf941b98f24ceb,92b18844ded249a88b9006fa,Pending,2024-02-28T12:43:21.534282Z,2024-04-09T12:43:21.534282Z,0,,
