_id,userId,projectName,description,startDate,endDate,supportedDocumentLink
5b7fc276e8a842928ef1c9ec,6607d1475162a636379e9834,Perez Group,"Do memory model. Remember value series exist.
Energy represent enter force president. Happy quality economic police behavior treat.",2023-10-23T12:42:48.244522Z,2024-06-21T12:42:48.244522Z,http://gregory.org/
aaaa6b46014d47fd8ef3b3dc,6607d1475162a636379e9834,Wright Group,Throughout individual hundred. Program include reality artist measure hold power store.,2024-01-26T12:42:48.245522Z,2024-12-27T12:42:48.245522Z,https://mccoy.com/
bd0518f8636b4b98838158bc,66080b1eb85746ebc7e4064f,Robinson Ltd,"On data ground show party man detail. Trip minute each threat woman.
Necessary assume financial identify sometimes side. Along put know center research everyone might.",2024-03-18T12:42:48.245522Z,2024-10-09T12:42:48.245522Z,https://www.holmes.com/
8a877ad066eb452ca463f2e7,660c44e1031dafee85d11d05,Berg LLC,"Most personal less quickly. Thank where early character treat top research.
Discussion billion economy view their. Military product table understand job cost. History physical as should anything.",2023-10-25T12:42:48.246642Z,2023-12-24T12:42:48.246642Z,https://smith.com/
bab295d0789e4d5a902dd1e4,6612946baddf941b98f24bcc,Lopez LLC,Go live former line simple. Laugh party service place page card partner. Camera training artist free high time politics.,2023-09-28T12:42:48.246642Z,2024-06-24T12:42:48.246642Z,https://todd-jones.biz/
4a6108f1fbef4acd9e861904,6612946baddf941b98f24bcc,"Bradshaw, Thornton and Harris",Huge staff rate every maintain Democrat. Any consumer style year ground happy national. Probably person seat shoulder administration. Finish law I job edge skin.,2023-10-03T12:42:48.247613Z,2024-05-31T12:42:48.247613Z,http://www.kelly.net/
4e5ffe7c1ab34be6bb48dbd0,6612946baddf941b98f24bcd,Hogan-Richard,Military nature price some nice theory serve good. And subject consumer check. Carry move interesting wind arm tell crime as.,2023-09-24T12:42:48.247613Z,2023-09-30T12:42:48.247613Z,https://www.brown.com/
bb094fe626cb416fa28c6c24,6612946baddf941b98f24bcd,"Blair, Adams and Farmer",Ten agent government lead course. Education own foreign between it understand. Single although add board human we particular these.,2023-05-15T12:42:48.248613Z,2023-12-17T12:42:48.248613Z,http://smith.biz/
782f01bd911f4826883ddf3d,6612946baddf941b98f24bce,Taylor-Kelly,"Item near mouth draw. Simple goal popular use me the until talk.
My cost it green. Economy push main dark forget people. Cold child measure trial authority build.",2023-09-27T12:42:48.248613Z,2023-12-15T12:42:48.248613Z,https://www.nguyen.com/
f2bebfbec00842b088427041,6612946baddf941b98f24bce,"Oconnor, Kelly and Johnson","Peace until smile even. Officer spring near have growth name nice. Someone century fund exist.
Key movement she behind carry. Alone benefit age million condition much.",2023-10-09T12:42:48.249622Z,2023-11-20T12:42:48.249622Z,https://www.lawson.biz/
e99ef607368b466ea44b35fa,6612946baddf941b98f24bcf,Torres and Sons,Should take trade doctor evening music. Case eat participant pattern add make. There animal arrive east thing.,2023-08-01T12:42:48.249622Z,2023-10-25T12:42:48.249622Z,http://adams.info/
d98734e315be44a2abbf41e6,6612946baddf941b98f24bcf,Porter-Anderson,"Base town back information spring nation include.
Protect appear politics character choose per. Forward include learn alone art nature.",2024-01-27T12:42:48.250616Z,2024-04-16T12:42:48.250616Z,http://www.noble.net/
96d2e635705041ef9feebd27,6612946baddf941b98f24bd0,Olson LLC,Seven feel success. Behind pretty above memory trouble central eight. Station such goal she ask traditional. War those note economic onto create about.,2023-09-05T12:42:48.250616Z,2024-05-12T12:42:48.250616Z,http://www.jackson-rowe.com/
60d324a1b93d469b8f350c5f,6612946baddf941b98f24bd0,Brady Inc,"Herself growth I would.
Reduce trial which agency physical attorney else.
Case treatment least series. Light than may mission represent add feeling.",2024-03-27T12:42:48.251621Z,2024-12-23T12:42:48.251621Z,https://www.lucero.com/
502c1c44df15400b956a0d1f,6612946baddf941b98f24bd1,Mcclain-Harvey,Modern crime PM put believe billion final. Have agency where with. Speech community capital side far market job. Though contain example every nice keep.,2023-12-29T12:42:48.251621Z,2024-12-03T12:42:48.251621Z,https://www.gonzalez-williams.com/
919a99833cc84179899fcd6a,6612946baddf941b98f24bd1,"Matthews, Lane and Howard","News all conference last whose training serious bag. Remain series cut successful season.
For next assume rest myself.",2023-11-10T12:42:48.252623Z,2024-02-04T12:42:48.252623Z,https://johnson.com/
83255a843da24dc8a9bab2c5,6612946baddf941b98f24bd1,"Hale, Pierce and George","Heavy Republican whose near left real explain. Point idea music try.
Heavy partner available environment. Sort whole off generation raise give certain page.",2024-01-01T12:42:48.252623Z,2024-07-06T12:42:48.252623Z,http://www.anderson-little.biz/
5ad113dd8f684b63bf10787f,6612946baddf941b98f24bd2,"Brady, Washington and Patton","Heavy still sing.
Assume market occur whom subject lawyer. Enough resource purpose Mr floor production.
A she manage allow admit. Experience use when talk.",2023-05-07T12:42:48.253625Z,2024-04-25T12:42:48.253625Z,http://www.powell.com/
6e62299e49c149d1a75db326,6612946baddf941b98f24bd2,"Collins, Lopez and White",To democratic sit economic car value. Not travel left increase kind response both. Painting already management cover.,2023-04-24T12:42:48.253625Z,2023-10-22T12:42:48.253625Z,https://www.colon.com/
55b9fb165a144056bc028422,6612946baddf941b98f24bd3,"Allen, Thomas and Williams","Heart suggest throughout. Anything news treatment town.
Wife mean international build. Moment up wide three special enter family.
Ground trouble baby stock play old natural. Who this various us.",2024-03-23T12:42:48.254619Z,2024-11-19T12:42:48.254619Z,http://lee.com/
efc682ab53474a9e83cc4ca8,6612946baddf941b98f24bd5,"Vazquez, Ingram and Harris","Claim contain film two four. Left business hot defense.
Box others job party. During their pick world game structure. Feeling across address politics evening enough away industry.",2023-09-26T12:42:48.255593Z,2024-07-13T12:42:48.255593Z,https://www.wilson.biz/
163f3c45d5fb4141a6357f5e,6612946baddf941b98f24bd5,Wagner-Ross,Others also source more town. Table red leg money computer reality. Rich result wall budget if detail whose. Authority coach room cause close position.,2023-05-04T12:42:48.255972Z,2023-06-06T12:42:48.255972Z,http://www.little.com/
f1bf320df4c942b1a26a9959,6612946baddf941b98f24bd5,Jones-Perry,"Push situation arrive night very. Fight entire story various school tree.
Personal current something. Room picture science tough through energy spend.",2023-10-02T12:42:48.256974Z,2024-01-21T12:42:48.256974Z,http://www.myers.com/
632f4dc7f67f4a2e894080c3,6612946caddf941b98f24bd6,Conway and Sons,College hotel source until staff top. Campaign animal scene include low system. Well inside hospital whether sell Mrs pressure.,2024-01-16T12:42:48.256974Z,2024-09-29T12:42:48.256974Z,http://www.hansen.com/
b70e44d12e684af5a363d129,6612946caddf941b98f24bd6,"Thomas, Torres and Smith",Although key teach everyone style a. Doctor check care road station lawyer build property. Blue discover type arm.,2024-04-05T12:42:48.258070Z,2024-09-15T12:42:48.258070Z,https://garcia-dunlap.net/
2e0da9c9df2648cfbd6c2039,6612946caddf941b98f24bd8,Vincent LLC,This future Republican. Wife little enjoy agreement organization myself husband tonight.,2024-02-06T12:42:48.258070Z,2024-02-19T12:42:48.258070Z,http://moore-sheppard.com/
bfb414560a4e4cf5a39ea440,6612946caddf941b98f24bd8,Perry Inc,"They space of think actually. High exactly nearly animal good compare report. Issue defense air.
Method enter buy respond more. Find meeting professional test.",2023-05-23T12:42:48.258983Z,2023-06-28T12:42:48.258983Z,https://fox-benitez.biz/
9c1c9f8e35864a3dab45d3f8,6612946caddf941b98f24bd9,"Cannon, Wilkins and Jensen","Thought least before science detail against red. Car without money then hot policy. Expert pick quickly eye run hold without.
Four both can may big fly wife unit. Face arrive remember writer.",2023-12-20T12:42:48.258983Z,2024-10-25T12:42:48.258983Z,https://mcdonald.com/
f6e592f15ac3465bbdd55f20,6612946caddf941b98f24bd9,"Bautista, Mcdaniel and Medina",Tell growth step politics do recently. Pretty many night second worry girl.,2023-12-23T12:42:48.259904Z,2024-12-21T12:42:48.259904Z,http://reed.com/
d45c673cba4c4d19ab67828b,6612946caddf941b98f24bd9,Martinez Ltd,"Human recognize than every story adult. Hospital expert art PM thus college range.
Artist prepare evening recent phone. Article window social after.",2023-08-29T12:42:48.260906Z,2024-05-29T12:42:48.260906Z,http://ortega-henderson.com/
3295d2e72e8d4a63907d862a,6612946caddf941b98f24bda,Phillips Inc,"Democrat involve reach foreign meet investment difficult whom. Weight spend check today. Into technology without station say. Image lot long wide husband store.
Hot draw wish themselves raise create.",2023-05-21T12:42:48.260906Z,2023-10-15T12:42:48.260906Z,https://www.serrano.com/
ea174792bc8d4739aaf46359,6612946caddf941b98f24bda,Holland LLC,"Road me beat which stock green response. Rich sense decade customer wish dog. Together president space.
Draw her appear. Memory should claim TV day find mind.",2023-12-04T12:42:48.261785Z,2024-06-16T12:42:48.261785Z,http://chan.org/
ba62b9af86d146a49a970a02,6612946caddf941b98f24bda,"Campbell, Larsen and Reyes",Share father opportunity million big. Commercial significant form walk. Sport four how minute produce give. Of reduce hit speech special low.,2023-12-13T12:42:48.261838Z,2024-03-29T12:42:48.261838Z,https://www.butler.org/
96dcb35bdb8f408ca931f7d5,6612946caddf941b98f24bdb,Sims-Anderson,"Off machine career fight employee. Expert PM heavy.
Mind since can kid letter meet art assume. Relate time safe sure. Key majority value and nothing.",2024-02-14T12:42:48.261838Z,2025-02-05T12:42:48.261838Z,http://www.chavez.com/
fed1ff9f59324c459c23ba82,6612946caddf941b98f24bdb,Carrillo-Potts,"Reveal detail glass themselves event marriage. Morning forward head surface.
Expect culture politics remember hope. Mention security office common from race.",2023-08-20T12:42:48.262941Z,2024-06-22T12:42:48.262941Z,http://www.vance.com/
359a16f35eab4297ab7d12a8,6612946caddf941b98f24bdc,Willis-Smith,"Reveal certain authority four. Course physical institution think.
Condition fight role small action film message other. Particularly challenge develop suffer.
Would camera force.",2023-11-20T12:42:48.262941Z,2024-08-23T12:42:48.262941Z,http://pacheco.com/
70385abba2e846e097f4575d,6612946caddf941b98f24bdc,Wells LLC,"Human cold police hold. Either enjoy realize heavy word special hundred.
Under group together such system your window agreement.",2023-09-17T12:42:48.262941Z,2024-02-25T12:42:48.262941Z,http://black-ali.com/
ee2c2525efe54f319fc42ba1,6612946caddf941b98f24bdd,"Hernandez, Wood and Alvarez","One quickly store worker tax speak soldier focus. Behavior quite among conference represent.
According open nearly quite manager year history. Around difficult pick court ok.",2023-12-09T12:42:48.262941Z,2024-08-01T12:42:48.262941Z,http://www.fowler.org/
20ff37e9ff33411fb130a829,6612946caddf941b98f24bdd,Anderson Ltd,Act rich south we responsibility imagine suddenly who. Dark debate Republican risk send travel shake. Similar pressure particularly owner.,2023-11-14T12:42:48.263950Z,2024-06-12T12:42:48.263950Z,https://www.thompson.com/
dba5110bffc74457bc074d85,6612946caddf941b98f24bdd,"Edwards, Thomas and Phillips","Stay easy base thank. Defense well would near.
Huge base draw drive. Matter rate pressure dinner kitchen environment brother system. Beyond while avoid pay own late could.",2023-11-03T12:42:48.263950Z,2024-04-12T12:42:48.263950Z,https://www.morales.info/
77deeb7ab7d14e29b01465e7,6612946caddf941b98f24bdf,Juarez-Harrison,"Behavior represent reason third three. Sport happen picture way again.
Seat billion foreign writer although. Whom gun behavior structure to.",2023-09-16T12:42:48.263950Z,2023-10-05T12:42:48.263950Z,http://www.wyatt-powell.biz/
a34b6b2b93a746579a46e2ed,6612946caddf941b98f24be0,Price LLC,"Age manager good investment. Attention outside identify something.
Price time manager majority mother. Practice later friend fish likely. Office ask kid.",2023-10-08T12:42:48.264985Z,2024-08-03T12:42:48.264985Z,https://www.beltran.org/
fd9728edb3ae45f58d599f6a,6612946caddf941b98f24be0,Watkins and Sons,Color table food hundred service. Story during wrong decide police ground. Concern analysis score form.,2024-03-05T12:42:48.265350Z,2025-01-03T12:42:48.265350Z,https://franklin.net/
666683cbd8ec4220a821d587,6612946caddf941b98f24be2,Hogan-Foster,Local item pattern. Four south say many budget song course girl. Something radio no weight. Fire develop arrive politics.,2023-12-21T12:42:48.265350Z,2024-06-19T12:42:48.265350Z,https://fritz.com/
3166a325d1b9463d9956f9be,6612946caddf941b98f24be2,Adams Ltd,Tough believe everybody local method. Up tonight today cell. Tonight nice task add even picture PM.,2023-12-30T12:42:48.265932Z,2024-05-26T12:42:48.265932Z,https://herrera.info/
e60b108ef1df423688db9db3,6612946caddf941b98f24be2,Walker PLC,Current since necessary program star. Hope every reason want police yeah. Continue pay different outside vote various. Indeed usually data perhaps.,2023-07-24T12:42:48.265932Z,2023-12-01T12:42:48.265932Z,https://www.rosario.com/
a212dcf0614843e6927d96fb,6612946caddf941b98f24be3,Watson-Jenkins,Fill modern I system brother. Road word full. Dream part everybody including ok.,2023-09-07T12:42:48.265932Z,2024-07-16T12:42:48.265932Z,https://www.evans.net/
f1ec6751f7ad4c849ae0c0ae,6612946caddf941b98f24be4,"Blair, Butler and Sanchez",Majority media care determine catch direction single. Letter give nation develop half. View fine generation carry across.,2024-02-06T12:42:48.265932Z,2024-08-16T12:42:48.265932Z,https://woods.info/
5499926294614340a78f4dd0,6612946caddf941b98f24be4,Allen-Burton,Pay job be tell charge piece market. None rather beat hope. Imagine entire coach lawyer fact more. Here north suffer give over movie various trade.,2023-08-09T12:42:48.265932Z,2024-03-02T12:42:48.265932Z,https://thompson-sutton.com/
5db7f28e098049139ef41dc1,6612946caddf941b98f24be4,"Johnson, Jones and Howard","Down teach alone. Method debate produce media these although head.
Group away conference street clearly relate control window. Clear play billion story. Moment green analysis small memory send.",2023-06-25T12:42:48.265932Z,2023-12-13T12:42:48.265932Z,http://myers-yates.org/
41ee38cbbc994e8b9bab16a8,6612946caddf941b98f24be5,Jenkins Inc,City important want opportunity born really economic. Policy hundred reason agree need.,2023-11-05T12:42:48.265932Z,2024-04-26T12:42:48.265932Z,http://rodriguez-gutierrez.org/
2f3e3426306f4d98accec5c3,6612946caddf941b98f24be5,Jackson-Brooks,"Development itself worker program bit. Seven it vote event phone again music.
Food suffer rate other produce. Industry assume draw decade.",2023-04-15T12:42:48.265932Z,2023-06-03T12:42:48.265932Z,http://www.hill.com/
aff02be03b4d430c9ac480f1,6612946caddf941b98f24be5,Hayes-Sanchez,May simply health shoulder. Friend whatever against heart. Serious easy inside week thank cold.,2023-11-20T12:42:48.265932Z,2024-02-15T12:42:48.265932Z,https://bell.info/
33e799994e054f439a8e2d48,6612946caddf941b98f24be6,Brown-Cuevas,"Base strong star certain side real. Hair entire cold oil believe. Great image fund history.
Feeling four spend. Who begin test believe life. Challenge network hospital page specific free group.",2023-12-16T12:42:48.265932Z,2024-07-22T12:42:48.265932Z,https://cruz-small.com/
62289ace18634d69b12ae9ef,6612946daddf941b98f24be7,Williams-Kim,"Knowledge interest interesting such.
Population whatever prove wish fear. Different front goal purpose.
Option answer half. Get bad country she moment.",2023-12-28T12:42:48.265932Z,2024-12-11T12:42:48.265932Z,http://hampton-moore.info/
2ee6b92a43ee4fe0ab9eb178,6612946daddf941b98f24be8,"Carlson, Mckinney and Giles",Movie rather better task financial make. Avoid successful page inside save control tonight. Possible others same others dog across.,2023-12-15T12:42:48.265932Z,2024-04-14T12:42:48.265932Z,https://keith.com/
87e38ff590d446e197905d36,6612946daddf941b98f24bea,Johnson and Sons,"Natural site necessary article voice place. Country everybody than machine into pass.
Close sing week couple week watch huge. Officer measure professor property.",2024-03-24T12:42:48.265932Z,2024-05-18T12:42:48.265932Z,https://www.norton-sanchez.biz/
ce7318d2259a4d6abf917cb2,6612946daddf941b98f24bec,"Mcdonald, Garza and Church","Key turn east skill catch less read audience. Force south great least strong large structure.
Tv that anything huge so boy. Such apply different majority whose pretty. Itself quickly whether.",2023-10-01T12:42:48.272735Z,2024-09-06T12:42:48.272735Z,http://www.nelson.biz/
09ce0f0f11be4656a4b1530c,6612946daddf941b98f24bed,Hernandez Group,Suggest production forget. Born million responsibility east event offer board specific. Find two away series add program save must.,2024-03-03T12:42:48.273698Z,2024-06-29T12:42:48.273698Z,http://www.espinoza-holloway.com/
e31b0f89443b40af8a6a0364,6612946daddf941b98f24bef,Hubbard-Simpson,"Oil later feeling. Determine deep identify size.
Win international economy fast. Century far agent rich daughter edge. Another within writer movement environmental imagine star maybe.",2023-12-18T12:42:48.273698Z,2023-12-25T12:42:48.273698Z,https://cobb.com/
68ea1b08366c46398bab6d01,6612946daddf941b98f24bf0,Davis Inc,"Reduce weight together pattern pressure street up. Exactly kid listen look.
Field traditional left hotel beyond ahead. Reflect animal whether series. Car perform house tree.",2023-11-21T12:42:48.273698Z,2024-10-23T12:42:48.273698Z,https://www.wise-foster.com/
887d8ae9ae9f4b52add4a75e,6612946daddf941b98f24bf1,"Russell, Gonzalez and Miller",Population model rule structure standard edge hope. Work wonder movie anything. Experience concern health. Its cold everyone physical mission somebody in.,2023-08-08T12:42:48.274698Z,2024-04-11T12:42:48.274698Z,https://glover-walter.com/
71b72190c52b4f938f258d12,6612946daddf941b98f24bf2,Walls-Matthews,According themselves vote once appear. Example explain behind nature color single effect. Fall next former chair term ok many.,2023-06-01T12:42:48.274698Z,2024-04-15T12:42:48.274698Z,https://www.mills.com/
374f9509b9d6491c86362b0d,6612946daddf941b98f24bf2,Webster PLC,Military this name send defense court past pass. Back between quickly travel. Officer produce quality media.,2024-03-23T12:42:48.275697Z,2024-04-18T12:42:48.275697Z,http://www.jones-lloyd.info/
5ac67612a4824fb3a31e6277,6612946daddf941b98f24bf2,"Rivera, Martin and Jones",Region long point something as serious fact day. Rich international deal statement financial stage everything matter.,2023-08-31T12:42:48.275697Z,2024-06-14T12:42:48.275697Z,http://www.williams.com/
e3c838c2294e4cc29a39b59d,6612946daddf941b98f24bf3,Cain-Jones,Air method maybe star majority sure seat. Head major plan kitchen child cold.,2024-03-09T12:42:48.277111Z,2024-03-30T12:42:48.277111Z,http://www.jackson.com/
f92854c8dbf6408ebf43d13a,6612946daddf941b98f24bf3,Holt-Young,"Other baby five late represent government. Do party program act.
Often current try improve. Oil recently back. Style shake public seven.
Animal necessary be recently hundred quality anyone.",2024-03-10T12:42:48.277111Z,2024-03-31T12:42:48.277111Z,http://www.hansen.com/
056756c745cb43dbb46805e0,6612946daddf941b98f24bf4,Hernandez-Brown,"Current son but item. Read wind most key.
Apply lot watch. Learn spend season reduce must thought. Serious poor relationship structure.",2023-08-04T12:42:48.277111Z,2023-12-08T12:42:48.277111Z,http://www.nunez.com/
342aebf4a64349b698eb7a15,6612946eaddf941b98f24bf7,Hays-Evans,Join evening professional evidence. Painting factor on green try right toward. Perhaps safe star others scientist card similar. Explain tend left seven light might.,2023-12-23T12:42:48.277111Z,2024-01-08T12:42:48.277111Z,https://www.myers.org/
46007ef4438b4c44aa3e8f36,6612946eaddf941b98f24bf9,Ross-Alexander,Every student collection sound quickly. Old article watch organization company grow election. Court million husband.,2023-06-14T12:42:48.277111Z,2023-12-03T12:42:48.277111Z,http://robertson-caldwell.info/
f19cdc7d6c134495a8431350,6612946eaddf941b98f24bfa,Burch Group,"Left edge turn community color. Personal yourself alone consider better.
Dog home end before west finish. Alone senior away for. Maintain contain I force feel reach wrong.",2023-05-26T12:42:48.277111Z,2023-06-22T12:42:48.277111Z,http://henderson-gomez.com/
c7ca9897f34245218e3a8d82,6612946eaddf941b98f24bfc,Smith Group,"Individual sort accept general data develop successful project. Month decide parent red theory argue. Owner fine old.
Treat and town positive. Ahead laugh example star.",2023-04-10T12:42:48.277111Z,2023-08-16T12:42:48.277111Z,https://mack.com/
7e5544d847c145dc9958fcd9,6612946eaddf941b98f24bfc,Washington-Costa,"Particularly walk minute interesting factor beautiful. Focus item wall worry authority owner.
Place generation almost or concern choice.",2023-07-14T12:42:48.277111Z,2023-11-16T12:42:48.277111Z,https://nguyen.net/
f8a8725ddbe94dd9b00d3d39,6612946eaddf941b98f24bfe,"Smith, Palmer and Meyer","Pull probably after glass. Again section surface piece yet.
Opportunity call country probably assume. When trial much difficult number. Develop future high term crime.",2023-07-18T12:42:48.277111Z,2023-09-10T12:42:48.277111Z,https://oconnell.com/
43557214653f449aa5e66da1,6612946eaddf941b98f24bfe,Tucker-Thomas,"Save low whether democratic skin writer education. Image possible similar beat.
Hit often compare.
Score civil end stand.",2023-08-04T12:42:48.277111Z,2023-12-02T12:42:48.277111Z,http://www.hess.com/
90711e376ae040e8a13794b1,6612946eaddf941b98f24bff,Mendoza and Sons,Big role environmental measure difference on increase. Bar effort history treatment official doctor. Thousand tough bank. Wear let open respond.,2023-04-14T12:42:48.277111Z,2024-03-03T12:42:48.277111Z,https://www.liu-ross.com/
ffa32729a7dd4b50a035b682,6612946eaddf941b98f24bff,Butler-Torres,"Build discuss your Mrs. Describe foreign along summer become into. Foot plan require.
Discussion method tend yes never.",2023-12-18T12:42:48.277111Z,2024-08-04T12:42:48.277111Z,https://www.henry.biz/
3b74ecdc23f4442a9ea9f56c,6612946eaddf941b98f24c00,"Mack, Mcdaniel and Cook","Artist whether a thousand character yeah several some. Imagine computer say whom return.
There perhaps more news choose attack dream. Which senior single crime grow property.",2023-08-20T12:42:48.277111Z,2024-01-13T12:42:48.277111Z,https://leon.info/
b6c8a084c567470793bbc7dd,6612946eaddf941b98f24c00,"Simmons, Goodman and Woods","Issue almost until run. Fly life down American.
Wait just rest. Receive face threat agency manage speak little. Point watch economic what.",2023-10-01T12:42:48.277111Z,2024-04-17T12:42:48.277111Z,http://wilson-lawson.com/
e96ff69143c043f8bd05f331,6612946eaddf941b98f24c01,Barker PLC,"Style Republican improve. Back west strong though without. Girl trade future five find behind half.
Cause American sit until past develop. List course drop film. Over will believe ahead can full.",2023-08-24T12:42:48.277111Z,2024-08-07T12:42:48.277111Z,https://whitaker.biz/
8a11dc7594394d868b4205eb,6612946eaddf941b98f24c01,"Ward, Marks and Morales",Affect such join other suddenly. Television kid series answer set other put. Guy college one stage bar treatment by.,2023-10-23T12:42:48.277111Z,2024-05-14T12:42:48.277111Z,http://www.pope.net/
2c25ce113488493db187397c,6612946eaddf941b98f24c01,Anderson Inc,Authority might side maintain admit. Amount north guess every past fund push. Majority model five magazine lay reality minute.,2023-10-21T12:42:48.277111Z,2024-06-07T12:42:48.277111Z,http://www.carr.biz/
d44323adf89749ecbcf125bf,6612946eaddf941b98f24c05,Stone PLC,"Increase father instead become toward forget glass. Ball concern yard market author.
Right also factor kind. Guess show member cover. Television or treat skill.",2023-09-16T12:42:48.277111Z,2024-01-16T12:42:48.277111Z,https://www.davis.com/
2f730169184e48e18f47eea7,6612946eaddf941b98f24c05,"Hernandez, Simpson and Whitehead","Home order politics the listen line. Pay similar debate its.
Wide general scene be final police generation including. Discuss light major.",2023-06-10T12:42:48.277111Z,2024-05-07T12:42:48.277111Z,http://www.hull.org/
808ab8c682ed409b956cf5f4,6612946eaddf941b98f24c05,Campbell Group,Resource figure either consumer cup. Politics thus example poor nor system yourself. Watch look direction service edge.,2024-01-28T12:42:48.277111Z,2024-01-29T12:42:48.277111Z,https://www.mccoy.com/
2bf6cbc3053d45738f09053b,6612946faddf941b98f24c06,Collier-Hayden,"Example tree above against. Conference good way other.
It if job indeed.
Position gas condition. Sit operation still else.
Voice this today expect federal meeting stay new.",2023-08-17T12:42:48.277111Z,2023-10-01T12:42:48.277111Z,http://miller-becker.com/
e69cfb92dfe54f24a183a118,6612946faddf941b98f24c06,Smith-Nash,Discuss its today lead common mission industry. Majority word he yeah.,2023-04-12T12:42:48.277111Z,2023-09-28T12:42:48.277111Z,http://thomas.com/
a07ba78848a1486ca004c3a5,6612946faddf941b98f24c08,Cherry and Sons,Century kid occur place. Technology court enjoy realize radio represent bank address. Surface song mission assume standard perhaps pretty.,2023-05-29T12:42:48.277111Z,2023-07-03T12:42:48.277111Z,http://www.lewis.com/
