_id,userId,projectName,description,startDate,endDate,supportedDocumentLink
91f124115e9b47959e62850b,66129480addf941b98f24d20,"Brown, Robertson and Gray","Western thus hand at wind nation. On street first really course place. Person very these next.
Everyone baby man. Thank million yes billion father.",2023-11-24T12:42:48.412441Z,2024-09-02T12:42:48.412441Z,http://www.carey.net/
38028292e3944635a7b318a7,66129480addf941b98f24d20,"Lee, Riddle and Patterson",Green see heavy step international different summer. Ground daughter human security newspaper these. Partner drop worker positive TV enjoy expect.,2023-10-03T12:42:48.412441Z,2023-10-10T12:42:48.412441Z,https://www.oliver.info/
bb6a07d257e5441685bf77fd,66129481addf941b98f24d21,"Warren, Walsh and Nguyen",Book natural rise if through. Point science performance south teacher. Hope enter money not their response.,2023-11-23T12:42:48.412441Z,2024-09-23T12:42:48.412441Z,https://www.reynolds.com/
f49d8003baee420fb6adda39,66129481addf941b98f24d22,Jimenez and Sons,"Since set doctor key. Region mother myself draw easy be.
Office cup inside Mr including. Know after a very involve later together sort.",2023-05-31T12:42:48.412441Z,2024-02-22T12:42:48.412441Z,http://hicks.com/
3bf98290d15649aaa8492157,66129481addf941b98f24d22,"Edwards, Page and Salazar","Dinner main PM or. Seat training its how difficult.
Town you sit carry soon return increase. Full maintain start against near tell. Animal six discussion analysis.",2023-09-12T12:42:48.412441Z,2024-04-30T12:42:48.412441Z,https://www.thompson.com/
7e64a7cb947e4d6e960fbd7e,66129481addf941b98f24d22,Lawrence-Lester,"Popular serve work cut direction week east. Very member defense high standard.
Garden skin administration card. Carry back small help.",2024-02-14T12:42:48.412441Z,2024-04-02T12:42:48.412441Z,http://walker.com/
749aaf451c66456a9f98919c,66129481addf941b98f24d23,"Harris, Hayden and Hansen",Wrong day about new compare. Certain result sport professional. Never include back ground arm mind view but.,2023-06-25T12:42:48.412441Z,2023-12-12T12:42:48.412441Z,http://english-conley.net/
b6333e2622684352ae4b12c8,66129481addf941b98f24d23,"White, Jones and Farmer","Edge food general before how dream. Each that democratic country minute which.
Including similar carry one record anyone. Send between recently manage claim indeed factor.",2024-03-31T12:42:48.412441Z,2024-10-27T12:42:48.412441Z,https://www.olson-rice.com/
1f96d0ed8fa5412487d3d7c2,66129481addf941b98f24d23,"Blanchard, Thomas and Newman","Stand child article position. Able serve keep kid.
His describe carry everyone. Similar look fast here personal.
Training major administration soldier how certain. Usually act dream memory able.",2023-07-13T12:42:48.412441Z,2023-09-18T12:42:48.412441Z,http://www.hooper.info/
1f135e12c3d040d58eee89b6,66129481addf941b98f24d24,Singleton-Kim,"Black ask central find them here toward size. Painting they her news close important. Movement level turn hotel.
High eight lose manage spend decade age. Ever pattern president.",2024-02-19T12:42:48.412441Z,2024-04-12T12:42:48.412441Z,http://www.phillips-stephens.com/
72d5d4cb2b344fc28eb67b2e,66129481addf941b98f24d26,Wood Ltd,"Girl manager school improve stay long. What yet tell college buy. Themselves sort church they might finish exist.
Hour notice stay focus contain rich. Turn cold rich wonder must.",2023-08-26T12:42:48.412441Z,2023-10-23T12:42:48.412441Z,http://chen.org/
d17f570866e84360ad1accdd,66129481addf941b98f24d27,Peters-Flores,"Probably skin simple American perform green. Keep to few.
Student teach nice section friend organization public. Avoid sense financial change. My sure feel. Few side world itself.",2023-04-20T12:42:48.412441Z,2023-11-14T12:42:48.412441Z,http://www.horn.com/
bc27116bda9449f2a21a65aa,66129481addf941b98f24d27,"Valentine, Long and Howell",Enter draw onto task structure assume serve. Do class itself Republican forget describe model something. Every thank free this arm religious.,2024-01-01T12:42:48.412441Z,2024-06-13T12:42:48.412441Z,http://best-robbins.com/
96074e0cc58f4b8e9178513c,66129481addf941b98f24d27,Banks LLC,"Reduce deep never sense can president none personal.
Do everybody performance professional bad. Future move number grow successful own.",2023-06-23T12:42:48.412441Z,2023-07-27T12:42:48.412441Z,http://howard-dominguez.org/
9c8c7eee02a944a0a2dc3dcb,66129481addf941b98f24d29,Parks-Davis,"Inside ahead add six happy personal. Industry difference sport man gun they. Among next region month mention accept.
Until nature yard night. Picture seven daughter character attack main.",2024-03-25T12:42:48.412441Z,2024-10-26T12:42:48.412441Z,http://sullivan.net/
711b2fd4e6e54b8b9eee3178,66129481addf941b98f24d29,Meadows PLC,"Themselves responsibility game summer. Head information form office.
Human shake book actually his very get. American lawyer still staff surface. Cut including southern health.",2023-11-14T12:42:48.412441Z,2023-11-29T12:42:48.412441Z,http://mccarthy.com/
79599f7053964c9fb2e2eb35,66129481addf941b98f24d2a,"Mahoney, Conley and Walker",Provide third best cut. Defense will business decision thousand recently language. Field decade when stuff discuss store.,2024-02-12T12:42:48.412441Z,2025-02-06T12:42:48.412441Z,http://alexander.com/
1457aa4c2c98411883aad6c6,66129481addf941b98f24d2a,Calhoun-Campbell,Under political interesting from. Power involve race strategy. Bar together style.,2023-10-18T12:42:48.412441Z,2023-12-02T12:42:48.412441Z,http://www.joseph.com/
11212b6ba83b4f51b0f44829,66129481addf941b98f24d2a,Jones PLC,"Three hair describe expert. Anything wrong enough heart.
Couple there sport article gas son. Pay expect game form thank. Ability know spring go feel write treat. Case firm much minute much.",2023-06-26T12:42:48.412441Z,2024-01-01T12:42:48.412441Z,http://www.wright.com/
614a7f6b88b74de580a3dbb1,66129481addf941b98f24d2b,Bender LLC,"Hard friend treatment sometimes dinner every discuss. Toward one father through beat lay. Thousand pass why south every.
Senior training difference never. Treat join mean huge herself happy.",2023-07-10T12:42:48.412441Z,2024-02-07T12:42:48.412441Z,https://cole.com/
5b192d6e81744787aa8522bb,66129481addf941b98f24d2b,Waters-Gibson,"Cover war exactly its clearly quite ground. Attack enjoy why place. Statement key Republican rise movie space.
Green difficult order. Range growth style laugh standard take participant.",2023-04-21T12:42:48.412441Z,2024-02-21T12:42:48.412441Z,https://www.brown-baker.com/
3cbb93e91de5488db371f2cb,66129481addf941b98f24d2c,Brown PLC,"Recognize nor also speech low unit. Why wife market already.
Where gas month what top all.
Team also teacher agree great not quickly. Public they view official. Talk between recognize knowledge.",2023-09-04T12:42:48.412441Z,2024-04-10T12:42:48.412441Z,http://www.davis-fuller.net/
5aa4256637104b82a31ed395,66129481addf941b98f24d2c,"Adams, Mcintosh and Hutchinson","Concern design end weight blue high line they. National turn management early article would. Race question establish.
Poor defense left reach property. Direction better same.",2023-08-31T12:42:48.412441Z,2024-01-05T12:42:48.412441Z,https://www.hernandez.com/
1b1b917d855d4eea93624af5,66129481addf941b98f24d2c,Wood Group,Economic deep name from doctor should so. Degree pattern remain four direction. Require pretty glass. Choice strategy set last meeting.,2023-11-05T12:42:48.412441Z,2024-03-31T12:42:48.412441Z,http://harmon-moore.com/
575e312f579940eb857f6309,66129481addf941b98f24d2d,"Schultz, Jacobs and Warner","Relationship employee wife. Design for hour office factor eight hear.
Number tree school church capital. Mission daughter student may form summer. Consider impact heart.",2023-11-19T12:42:48.412441Z,2024-09-18T12:42:48.412441Z,https://www.owens-russell.info/
03c5dd68a6ce40568a375f1a,66129481addf941b98f24d2d,Calderon-Norton,Possible since operation energy should natural too wear. Laugh behavior now against Mr.,2023-07-17T12:42:48.412441Z,2023-10-14T12:42:48.412441Z,https://www.maldonado.com/
2707364fc0224351b1858536,66129481addf941b98f24d2d,"Turner, Decker and Graham","Move especially particularly drop word glass. Me some example want yet cost. Response everything society six happy prevent phone hard.
Usually your determine.",2023-09-29T12:42:48.412441Z,2024-02-20T12:42:48.412441Z,http://www.tran-dougherty.com/
11f86c2172d44a9e8959be99,66129481addf941b98f24d2e,Reese Group,"Media show century ask medical remain. Lot involve parent person example letter organization.
That country month see attention because wide. Own through present western everything believe shoulder.",2023-08-04T12:42:48.412441Z,2023-08-31T12:42:48.412441Z,http://www.thompson.com/
a40ff3e7bd664d4ba7011eb8,66129481addf941b98f24d2f,"Bowers, Lewis and Stewart",Say increase last get skill employee. Shake call former good try discuss still where. Just team traditional.,2024-02-13T12:42:48.412441Z,2024-06-09T12:42:48.412441Z,http://wilson.com/
0dcb4cb2d34342d5badaf017,66129481addf941b98f24d2f,"Thomas, Odom and Holmes","Trial foot guess see candidate year big because. Try another ahead wish.
Study pretty during. Foot building people sing next participant itself.
Fact always bring. Cut institution financial Mrs.",2023-11-03T12:42:48.412441Z,2023-11-08T12:42:48.412441Z,https://www.flowers.com/
45f301f3db6d47469999770e,66129482addf941b98f24d30,Miller-Thomas,"Appear sister bed this mind myself. Never first resource help market. Skin very word board arm its name.
Draw thing minute spend help threat among.",2024-03-16T12:42:48.412441Z,2025-01-18T12:42:48.412441Z,http://www.gross-martinez.com/
6af80641164849bf834b93fe,66129482addf941b98f24d30,Hayes-Montgomery,"Report computer suddenly door. Last to anything tend certain box.
Western political term paper Democrat. She thousand according amount despite. Data even it military community.",2023-07-07T12:42:48.412441Z,2023-12-28T12:42:48.412441Z,https://benton-ware.com/
3f5ec3b42d7744b8960a7a55,66129482addf941b98f24d31,"Winters, Calhoun and Wilson",Able bar bag left world. Material response medical send seem real. Early all card no while spend white. These knowledge moment color mouth never free.,2023-09-13T12:42:48.412441Z,2024-01-07T12:42:48.412441Z,https://www.santana-downs.info/
ad34f29b4a0242b0a555cf71,66129482addf941b98f24d31,Campos and Sons,"Information begin article true. Base body clearly hotel artist.
Finish general different director. Public strong along business this former.",2023-05-28T12:42:48.412441Z,2024-03-26T12:42:48.412441Z,http://www.davis-lynch.biz/
26aeb49931044046834e230a,66129482addf941b98f24d33,Monroe-Diaz,"While writer blood much. Ten may really pass main view.
Open team current prove. Soldier anything rate memory. Health tend interest majority unit.",2023-10-03T12:42:48.412441Z,2024-04-07T12:42:48.412441Z,http://wiggins.com/
2abb5540b38f40f886370198,66129482addf941b98f24d33,Williams-Trujillo,Detail friend population look film could. Candidate art follow level we hard cover.,2024-01-03T12:42:48.412441Z,2024-05-04T12:42:48.412441Z,http://thomas-ruiz.com/
943928ae0d4f4b87b348d76f,66129482addf941b98f24d34,Hunt PLC,Available first own offer page two choice TV. Item everybody computer think worker several parent woman. Modern phone himself ask detail energy again.,2023-12-02T12:42:48.412441Z,2024-11-30T12:42:48.412441Z,https://www.patel.com/
794e713864274a558f68e346,66129482addf941b98f24d34,Valentine-Walker,Reality trade animal prepare two right serve. Decide visit writer western yeah professor. Policy south dark phone find fish. Campaign particular key small now computer identify seven.,2024-01-31T12:42:48.412441Z,2024-07-26T12:42:48.412441Z,http://www.bishop.org/
ac1703b15c284f54983359a9,66129482addf941b98f24d34,"Luna, Harris and Huynh",Anything similar house himself whole type could. Impact step from mission both role. Not interesting trade do office style participant nothing. Herself past vote check.,2024-03-10T12:42:48.412441Z,2024-06-19T12:42:48.412441Z,http://www.luna.com/
4df8df9372424446b72fd1fc,66129482addf941b98f24d35,"Cardenas, Adams and Gutierrez","Leader especially seat pick activity enough. Value pay visit east front action see.
Green through three begin choice. While customer day seek threat central.",2024-02-04T12:42:48.412441Z,2024-07-06T12:42:48.412441Z,https://martinez.com/
6ba904d971404b23bbfdd142,66129482addf941b98f24d35,Weaver-Garcia,"Realize where ever job charge soldier large. Market better after.
Option doctor administration painting rest. Public relationship member crime. Moment foreign movie environment human relationship.",2023-04-12T12:42:48.412441Z,2023-12-12T12:42:48.412441Z,http://www.owens.com/
076a932a7d3940f2b792955c,66129482addf941b98f24d36,"Johnson, Ellison and Garcia",Person story peace system list key. Behavior thus go employee bar help together Republican. Mention suggest let others call another. Also ready experience particular lot song.,2024-03-31T12:42:48.412441Z,2025-02-01T12:42:48.412441Z,https://curry-davies.com/
7804228eb09d475998e3b8c8,66129482addf941b98f24d37,Zavala-Stokes,"Family process scene wear. Item campaign all score.
Answer lawyer white part. Indicate nice home benefit study.",2024-03-25T12:42:48.412441Z,2024-11-17T12:42:48.412441Z,http://booth-owens.com/
0750c1b69f7c4ff0bed1c8b4,66129482addf941b98f24d37,Jones-Gonzalez,Shake person government dream collection. Start friend certainly them this reveal space. Account serious officer once.,2023-10-07T12:42:48.412441Z,2024-02-25T12:42:48.412441Z,http://www.nash-graham.com/
8cbe100023b44747b6a96728,66129482addf941b98f24d38,"Hanson, Carlson and Carpenter","Begin by remember leader allow final low activity.
Local or expert certain night area. Ago himself Mr fish.
Across sit weight true be bar. Billion hundred future reflect.",2023-06-25T12:42:48.412441Z,2023-10-14T12:42:48.412441Z,https://george.biz/
3e84887b61ed4bacb734f942,66129482addf941b98f24d38,"Holden, Moore and Pennington","Despite democratic same.
Cold family space test. Series want get behind something. Church sister human green cause training.",2024-02-18T12:42:48.412441Z,2024-05-26T12:42:48.412441Z,http://kelly.com/
efb1f70ffc02437e92c2e82e,66129482addf941b98f24d38,Hicks-Rodriguez,"Name history consumer allow expert. Because enjoy establish perform recognize teacher.
Social letter food over perhaps appear. Two walk least generation small admit.
Thought different else week here.",2024-01-29T12:42:48.412441Z,2024-02-23T12:42:48.412441Z,http://jones.com/
bf32f4b4f9824407ab2ed449,66129482addf941b98f24d39,"Brown, Holmes and Armstrong","True question national two yourself small. Maybe population mention cell house identify want.
Dinner sign student again. History box game machine parent. Report investment them feeling fill.",2024-03-24T12:42:48.428066Z,2024-04-18T12:42:48.428066Z,http://browning-roberts.biz/
d660bb82e29c43ae9fa7e924,66129482addf941b98f24d39,"Jordan, Neal and Reed","Including suggest dark important peace. Hard focus mean change author before some. Few believe Democrat nation step player move involve.
Maybe allow short. Pull treatment piece arrive during peace.",2023-09-01T12:42:48.428066Z,2023-11-28T12:42:48.428066Z,https://www.lane.com/
77df8ba2f931423b9acd1cbd,66129482addf941b98f24d39,Bird-Holt,"North early fear learn order positive. Really positive source sound. Her evidence free receive.
Town star soon reveal important service. Citizen challenge still law. Young fine hold.",2023-12-12T12:42:48.428066Z,2024-10-02T12:42:48.428066Z,https://walker.com/
8b618fe14d024d45ba65f6c7,66129482addf941b98f24d3a,Long-Anderson,"Character agent above value argue way manage service. Political bed whole return. Record threat little front bank top scientist.
Between live minute manager kid.",2023-08-14T12:42:48.428066Z,2024-04-29T12:42:48.428066Z,https://www.hamilton.com/
074fc07eb4c0477aa9122475,66129482addf941b98f24d3a,"Mcdonald, Blake and Martinez",Wonder pay perhaps agent on. Husband possible find seat drive. Offer nation side kid.,2023-09-28T12:42:48.428066Z,2024-08-25T12:42:48.428066Z,https://white.com/
d791f6a493a74a1cba32561e,66129482addf941b98f24d3a,Williams-Hutchinson,"Produce billion story social sign as. Up focus including trial.
Condition usually long discover suffer officer certain.
Them view someone shake. Least single cause me relationship find.",2023-11-27T12:42:48.428066Z,2024-09-20T12:42:48.428066Z,https://www.rodriguez.org/
6e59b94837434fc58b5fc93a,66129482addf941b98f24d3b,Hart and Sons,"Factor talk election performance chair. Much movie top way. Plan they step poor.
Sort two answer customer worry. Floor set whom direction contain difficult mouth.",2023-09-30T12:42:48.428066Z,2024-04-15T12:42:48.428066Z,http://rogers.com/
671c31ec7463483daf007b04,66129482addf941b98f24d3b,Shaw-Stevens,Rise one dog dog turn cover most. Method treatment interest study Congress store. Push who so city data choose rock.,2023-07-18T12:42:48.428066Z,2024-04-03T12:42:48.428066Z,https://www.harvey-thompson.org/
fa4fbe04cb1f44bbb32361b2,66129482addf941b98f24d3b,Stanley and Sons,"Dark guess set seem such reflect everybody. Benefit outside east want by.
Future make improve Mrs. Thought among administration consumer study same.",2023-10-21T12:42:48.428066Z,2023-11-11T12:42:48.428066Z,https://fleming-collins.com/
800b7d513fbd4b938d528123,66129482addf941b98f24d3c,Rodriguez Inc,Cost center us age research inside. It easy person six rich art.,2024-03-23T12:42:48.428066Z,2024-11-01T12:42:48.428066Z,http://wells-cain.com/
fac55108408048be9195d73a,66129482addf941b98f24d3c,"Goodwin, Hayes and Patton",Citizen low newspaper need reflect. Him hit movie charge difficult. Garden candidate east about.,2023-07-07T12:42:48.428066Z,2023-12-19T12:42:48.428066Z,https://www.jones.com/
d52130355d824de98ee59abd,66129482addf941b98f24d3e,"Jones, Fowler and Rice","Cover alone response. Evidence west look develop worker step matter. Whom face energy could would her.
Rock more even evening customer however. Suddenly management apply myself.",2024-02-14T12:42:48.428066Z,2024-02-21T12:42:48.428066Z,http://brown-nichols.com/
c6277d251d96432a94f48d43,66129482addf941b98f24d3e,Rivera-Clark,"Speak hear actually organization however modern argue cost. Energy term job president. Nature partner study executive move idea.
Term air green land born play.",2024-01-11T12:42:48.428066Z,2024-07-08T12:42:48.428066Z,http://www.santos.com/
001afe9eaecc499484a34dfe,66129483addf941b98f24d3f,Brown-Vazquez,"His thank under sense. Product expect bar.
Tell happy among he reach. Big toward win forget author. Least low sing read student. During rest least recent moment peace perhaps.",2023-09-30T12:42:48.428066Z,2023-11-05T12:42:48.428066Z,http://hamilton.com/
be2e4391ba044f90b6635ae1,66129483addf941b98f24d40,Ortiz-Richardson,"Technology word area laugh work buy. Collection any radio middle.
End dream turn in television space significant. Gun civil able none. Fast strong star national he.",2024-01-03T12:42:48.428066Z,2024-06-12T12:42:48.428066Z,https://dean.net/
02b5cab3d0f74d7da07ab2ea,66129483addf941b98f24d40,"White, Reed and Alvarez",Ago down door share chair place. Behind name from score election office individual. Light grow personal protect.,2023-09-04T12:42:48.428066Z,2024-04-12T12:42:48.428066Z,https://www.melendez-cochran.net/
9cea65f5109e44e29109c30a,66129483addf941b98f24d43,French-Castillo,"Opportunity theory single side question both material. Business such against behavior rock.
Effect interview condition allow read challenge effort. Responsibility force by site.",2023-11-04T12:42:48.428066Z,2023-11-25T12:42:48.428066Z,https://www.hurst.com/
d41c7142a21848a184bed5c6,66129483addf941b98f24d48,Obrien-Coleman,"Dream prevent push scene. High indeed they next break.
These positive think place citizen. Produce activity one five certain camera. Event side attack.",2024-01-30T12:42:48.428066Z,2024-04-15T12:42:48.428066Z,http://www.miles-lee.com/
132deee538c24f9fb971e52a,66129483addf941b98f24d49,"Brooks, Garrett and Powell",Heavy garden article easy when safe ask. Analysis which hospital from then. Scientist develop though still white outside.,2023-06-06T12:42:48.428066Z,2023-12-07T12:42:48.428066Z,https://arroyo.com/
f6ec8e2dc87d4383b7c3fabf,66129483addf941b98f24d4a,Livingston LLC,Step on each kind strong. Before none read from process support. Write discussion cause also unit economic yourself collection. Tonight lead ability medical example director thousand.,2023-07-16T12:42:48.428066Z,2024-03-30T12:42:48.428066Z,https://www.brown.org/
30ff8caba8234521997418ce,66129483addf941b98f24d4d,Dean and Sons,"Rather pick matter never if arm. Unit spend painting too bad rich whatever.
Traditional organization no some under. Single maintain shake once age.",2024-03-13T12:42:48.434591Z,2024-10-12T12:42:48.434591Z,https://www.guerrero-cochran.com/
19bf86db3803409bbbc9109b,66129484addf941b98f24d4e,Brown and Sons,History feeling number lot present song laugh. Event statement physical could prepare agent take me.,2023-04-29T12:42:48.434591Z,2024-01-05T12:42:48.434591Z,https://www.wilson.biz/
e9084ad9e34c4f1eaeeb0901,66129484addf941b98f24d4e,Jenkins and Sons,"Apply story true prepare rest job leg. Cell trip would. Manager chance run him admit.
Bring worker tell value most class time. Program themselves ever.",2023-10-10T12:42:48.434591Z,2024-03-06T12:42:48.434591Z,https://www.henson.com/
db577fe6a88149b6a7019cff,66129484addf941b98f24d4e,Wilkinson-Hull,"Three send science bad product person despite. Range affect Congress.
Also task politics. Teacher whose side mind final yes administration. A wide election individual history Mr.",2023-07-26T12:42:48.434591Z,2023-09-15T12:42:48.434591Z,http://garcia-johnson.com/
966233abed5f49249c360d2c,66129484addf941b98f24d4f,"Petty, Alvarez and Thomas","Wait machine sort win magazine window ground. East reveal reason.
Unit owner less plant seat good. Live sense term child pick.",2024-03-28T12:42:48.434591Z,2025-02-21T12:42:48.434591Z,http://www.taylor-flores.com/
f34fb2f3a36c4de6847a18d7,66129484addf941b98f24d4f,"Hunt, Harris and Norris",Company major affect away rich. Determine week manage response open stand either. Number clearly different position. Rest change value spring.,2023-07-21T12:42:48.434591Z,2024-05-20T12:42:48.434591Z,http://nicholson.net/
893db7bc4cc1494f9787800f,66129484addf941b98f24d51,Beard-Smith,Spring score some now defense day. Car me partner strategy. Race number necessary outside woman point.,2023-11-27T12:42:48.434591Z,2024-07-03T12:42:48.434591Z,http://www.mcguire.com/
94bc728471e24fe691a91ecc,66129484addf941b98f24d51,"Nguyen, Love and Houston",Staff effort management success. May total similar seven someone. Decide exist stock player suddenly throughout marriage.,2023-11-12T12:42:48.434591Z,2024-06-22T12:42:48.434591Z,https://white.org/
627bdbb6799940bab7bd943d,66129484addf941b98f24d52,Oneill-Choi,"Week wonder various maintain. Boy manage direction bar.
Pm everybody can during ok store. Opportunity national drop look particular care. Something house media argue teacher positive radio.",2024-04-02T12:42:48.434591Z,2024-07-16T12:42:48.434591Z,http://www.suarez.com/
36a01160e95f44c587bc0a0e,66129484addf941b98f24d52,Hayes-Johnson,Officer rest prevent wall generation appear. Field seat left effort property head. Claim site ago physical our.,2023-04-20T12:42:48.434591Z,2023-08-01T12:42:48.434591Z,http://www.moore.com/
25d4724e24cf41a3b286b939,66129484addf941b98f24d53,Stephens Inc,Simple effect tough choose. Today population still positive recognize home Mrs. Expert collection guess church particular. Group grow note government no hit another paper.,2023-09-20T12:42:48.434591Z,2024-05-01T12:42:48.434591Z,https://www.bentley.info/
38de48e99d0c442f8f4bcb30,66129484addf941b98f24d54,"Miller, Bond and Cabrera","Stay all fact these. Few environment last deal.
Specific seem remain push catch live product. Cup attack two attack poor. Glass wrong him ahead effort wait break.",2024-01-19T12:42:48.434591Z,2024-09-24T12:42:48.434591Z,http://www.salazar.net/
d1b26071db8844e59285f4b2,66129484addf941b98f24d54,Murray PLC,"Necessary quality middle. Property join professor effect condition ten book. Stuff film far sure always.
City manager such lead. High public base sea.",2023-07-03T12:42:48.434591Z,2023-08-11T12:42:48.434591Z,http://gonzalez.biz/
205ea98f7a9042f08dfae1aa,66129484addf941b98f24d54,Arroyo-Collins,"Finish contain after computer class however. Present professional conference yard.
Bank fly south theory teacher grow.",2023-09-15T12:42:48.434591Z,2023-12-09T12:42:48.434591Z,https://www.phillips-leonard.com/
a08aeabee72c4b41b739e93d,66129484addf941b98f24d57,Daniel LLC,"Only mother above them might him course. Economic lead where although.
Represent those growth music. Large simply never population modern system.",2024-01-30T12:42:48.434591Z,2024-12-03T12:42:48.434591Z,https://www.luna-humphrey.org/
e81b155862d7460db8367469,66129484addf941b98f24d59,"Dixon, Collins and Washington","Pressure discussion build item including team section. Crime sea perform couple employee.
Send call manager thing relate claim. Cut risk strategy far behind. Prevent it owner top strategy.",2024-03-06T12:42:48.434591Z,2024-06-22T12:42:48.434591Z,http://www.curtis.com/
6fcf3a6e3d5d43ca9bdf1ff9,66129484addf941b98f24d5b,Garcia PLC,"Help couple what bit. Draw test receive list. Seat form woman.
Tax garden argue manage all. Offer gun that. Young picture reach every continue.",2024-02-16T12:42:48.434591Z,2024-12-26T12:42:48.434591Z,https://www.brown.com/
e65998097df44933ba48f854,66129484addf941b98f24d5c,Baker Group,By building center approach. Board music idea on line focus. Week public near ask me American appear. Into amount present program whom travel miss look.,2024-02-18T12:42:48.434591Z,2024-06-15T12:42:48.434591Z,http://farmer.com/
