_id,userId,projectName,description,startDate,endDate,supportedDocumentLink
490e39d7ab874b3a99b8d93e,66129479addf941b98f24cac,Keller PLC,"Machine network dream here ask detail single. Paper improve third laugh entire cause despite. He study others.
Throughout executive old travel. Per health news. Put population us receive.",2024-01-16T12:42:48.350025Z,2024-11-16T12:42:48.350025Z,https://miles.com/
4c94a1417477450db67b5528,66129479addf941b98f24cac,Lawrence Ltd,Road agency born remember water feeling star. Source cover plant.,2023-11-11T12:42:48.350025Z,2024-09-08T12:42:48.350025Z,http://www.harrell-knapp.com/
8f7c64ea639a4aef9e99eed3,66129479addf941b98f24caf,"Herrera, Phillips and Castro","Social prepare buy serve. Task pattern grow. Mind media none full.
Have speech able smile political tough. Morning better charge upon main doctor.",2024-01-08T12:42:48.350025Z,2024-11-14T12:42:48.350025Z,https://www.garner.info/
8fa2f314f8984773ac01228e,66129479addf941b98f24caf,"Wilson, Brown and York",Participant else parent stay. Thousand stay evidence human because scene. Heart but door word throughout friend.,2024-01-28T12:42:48.350025Z,2024-07-12T12:42:48.350025Z,https://patterson.com/
da6e170d419848578090b7f2,66129479addf941b98f24cb1,"Farrell, Steele and Mccarthy",Hot artist bag happy machine have argue. Win rock evening argue. She computer Democrat walk knowledge age learn.,2024-03-16T12:42:48.350025Z,2024-06-24T12:42:48.350025Z,https://walker.com/
4c3c0458e64044b9a69917e4,6612947aaddf941b98f24cb2,Davis PLC,"Different history want current whom. Reduce million blood teacher forward democratic occur news.
Bit man line himself somebody especially Republican.",2023-10-22T12:42:48.350025Z,2024-01-10T12:42:48.350025Z,http://richardson-singh.biz/
3193b94d55dd43fcb8e38e38,6612947aaddf941b98f24cb4,Smith PLC,Really church fact yard effect write. Mission station husband position expect investment me. Sister attorney you upon protect.,2024-01-18T12:42:48.350025Z,2024-01-23T12:42:48.350025Z,http://phillips.biz/
9246626be082421599b64013,6612947aaddf941b98f24cb4,Roberts-Perry,"Inside everybody remain this. Say me can. Improve only court. Professor somebody majority.
Edge writer prepare stay recognize section best. Hundred since few we wife every.",2023-10-11T12:42:48.350025Z,2024-06-24T12:42:48.350025Z,http://hunt.biz/
2c40c8faea4f48b180888e18,6612947aaddf941b98f24cb5,Crosby-Harris,"Interest beautiful room speech worker school. Item miss one soldier this office decide economic.
Safe turn million during career building determine. Machine year improve. Animal score Mrs tax none.",2023-10-21T12:42:48.350025Z,2023-12-24T12:42:48.350025Z,http://coleman-young.com/
9ff3bb4024c44bf2abd0e194,6612947aaddf941b98f24cb5,Allison-Wilson,"Less south power. Accept himself agent.
Interest rest dream physical such foreign leader. Easy wife every grow. Bar minute kid relate cold.",2023-09-23T12:42:48.350025Z,2024-06-26T12:42:48.350025Z,http://duncan.net/
761b92d0c35b4699af67cd16,6612947aaddf941b98f24cb5,Ross Inc,Movement amount crime beautiful need gas detail. Include machine church front record. Serve official art safe.,2024-01-02T12:42:48.350025Z,2024-11-21T12:42:48.350025Z,https://ramos.net/
4ed822f27b434a1498cd0b34,6612947aaddf941b98f24cb6,"Johnson, Myers and Soto",Cover unit star inside claim. Everything other upon behavior throughout. In follow available security sit eat cover color. Management street use test artist.,2023-04-23T12:42:48.350025Z,2023-08-08T12:42:48.350025Z,http://www.cameron.com/
0a274f2a56f943f6839057da,6612947aaddf941b98f24cb6,"Johnson, Yang and Dalton",Month collection which similar probably small challenge. Wind nation science cultural woman night.,2024-02-19T12:42:48.350025Z,2024-06-29T12:42:48.350025Z,https://www.velasquez.com/
db75968735e740a8a869cd70,6612947aaddf941b98f24cb9,"Gray, Moore and Sullivan","Kind history your also clear. Ground forget end American laugh some smile consider. Fall individual federal young assume son.
Those feel skill law so. Market difference executive set none.",2023-05-09T12:42:48.350025Z,2023-09-29T12:42:48.350025Z,http://www.solomon.com/
af0f6fec54fc4a4581b2575f,6612947aaddf941b98f24cb9,Watson-Phillips,"Also daughter check by tell where officer. First laugh service will effect.
Feel defense power TV. Whose born measure occur management.",2023-05-18T12:42:48.350025Z,2024-01-02T12:42:48.350025Z,http://bennett-nelson.com/
99fd1f85be47428e902ee4be,6612947aaddf941b98f24cba,"Martin, Miller and Hunter",Can ball majority mean over particular let list. Your near age catch.,2023-05-03T12:42:48.350025Z,2023-06-02T12:42:48.350025Z,http://www.cruz.biz/
61beb7dc9f564719a80a6586,6612947aaddf941b98f24cbb,Smith-Branch,Store best space five draw goal defense. Develop yes rich face explain be. Go head international sure senior.,2023-07-05T12:42:48.350025Z,2023-07-29T12:42:48.350025Z,https://butler.org/
4adbe5a5afb440e0b3b10ddf,6612947aaddf941b98f24cbb,"Simon, Flores and Freeman","Difference decide many more. Face use hard set fish spring.
Wear hour recognize consider. Piece certainly chance glass determine those interest.",2024-02-12T12:42:48.350025Z,2024-09-24T12:42:48.350025Z,https://murphy-hood.com/
cda23365e4b84a998b4d5567,6612947aaddf941b98f24cbb,"Johnson, Jones and Hurst","Author box those officer six. Rest city wonder fear when.
Wait head strategy service. You perform recognize try area whether. Happen ago each teacher member pressure call it.",2023-11-15T12:42:48.350025Z,2023-12-08T12:42:48.350025Z,http://www.conley.com/
fdfe325285ca4bd694072872,6612947aaddf941b98f24cbd,Aguirre-Mccann,"Sign black peace certain trouble he. Sport trouble push fast property government.
Air anything hundred something one bed. Husband increase listen seem game save. Almost here rich fill company.",2024-03-30T12:42:48.350025Z,2024-06-01T12:42:48.350025Z,http://dougherty-long.com/
bf283ca3372e438bb0ce0bab,6612947aaddf941b98f24cbd,Kirk Inc,Hospital upon suggest three however sure. Situation painting agreement out thought. Show available bit anyone.,2023-06-02T12:42:48.365622Z,2023-11-05T12:42:48.365622Z,http://www.smith.com/
5f55d83669a24c17b14d1f8f,6612947aaddf941b98f24cbe,"Andrews, Ramirez and Brown","Serve will laugh write whole. Education affect indicate carry current region tax early.
Perform decide strategy add true address. Answer prove over range.",2023-05-17T12:42:48.365622Z,2023-06-23T12:42:48.365622Z,http://www.miller-martinez.com/
57d8523ac5564375a4375560,6612947aaddf941b98f24cbe,"Robertson, James and Ward","Option Republican herself fight. Appear able official send.
Spend simple night data officer finish floor. Word sit sea across behavior expect.",2023-11-14T12:42:48.365622Z,2024-01-04T12:42:48.365622Z,https://www.booth-park.org/
98e1ce3f793c451fa5df3d12,6612947aaddf941b98f24cc1,"Hicks, Gonzalez and Hill","Go reason coach answer girl become. Guess save identify boy police remain again.
Explain unit national pull exist. Investment this building. Whose spend step.",2023-10-20T12:42:48.365622Z,2024-06-28T12:42:48.365622Z,https://www.long-lee.com/
e2bf8626599e4db2983a9910,6612947aaddf941b98f24cc1,Robertson and Sons,"White surface plan hair. None civil consider.
Pressure former either and. Mrs new build lot leg city. Despite spend financial explain including.",2023-04-10T12:42:48.365622Z,2023-11-07T12:42:48.365622Z,https://black.biz/
e9b668c15ac24cc0ae6bbc1c,6612947aaddf941b98f24cc1,Hughes Group,Item start nature beyond real plan. American campaign word bill back capital statement. Former wear better set site. Draw laugh pattern trouble shake skill with.,2024-04-04T12:42:48.365622Z,2025-03-28T12:42:48.365622Z,https://vang-miller.com/
2c6e2daf59584a87920129d0,6612947baddf941b98f24cc3,Sanchez-Singh,Suddenly site mission pretty spring prepare. Friend there deep leg general indeed. Service help professional subject friend.,2023-04-29T12:42:48.365622Z,2023-09-25T12:42:48.365622Z,http://johnson.com/
c7bdb00f3b634367ba34223d,6612947baddf941b98f24cc3,Baker-Johnson,"Particularly production source. Environmental kind lay his.
Us ready include ever sister. Spend thousand section.",2024-02-15T12:42:48.365622Z,2024-03-07T12:42:48.365622Z,https://www.compton.com/
0b9ff2f1f5374af5be306297,6612947baddf941b98f24cc4,"Miller, Briggs and Decker",Because herself student discover. Add different learn customer kitchen reflect you. Create issue style which rise discussion. Summer capital effort land expert democratic yard.,2023-05-08T12:42:48.365622Z,2023-05-31T12:42:48.365622Z,https://edwards-diaz.com/
691a9d325c7b4b708baf2fc1,6612947baddf941b98f24cc5,"Reyes, Smith and Smith",Building indeed someone free could finally poor position. Both lead building lawyer increase know draw around.,2023-04-14T12:42:48.365622Z,2023-05-18T12:42:48.365622Z,https://hanson.info/
1e5bd1e581ea48f28a107401,6612947baddf941b98f24cc5,Lawrence-Ross,Brother executive society care late item trade. Bed international our style.,2023-10-18T12:42:48.365622Z,2024-07-24T12:42:48.365622Z,https://www.jackson.com/
fec0b61a72004a578a918bb0,6612947baddf941b98f24cc5,Jones PLC,"Also on degree its player area maintain. Side agreement peace program.
Middle real avoid local thank message. Career someone war hope step foot yard.",2024-01-23T12:42:48.365622Z,2024-03-04T12:42:48.365622Z,https://hensley.com/
9df9e2a2c3744b1f8bb6145c,6612947baddf941b98f24cc6,Hayden-Mayer,"Use since far eight. Enter class draw our arrive forward class guess.
Data notice contain deep study service. Benefit first citizen under save before.",2024-02-01T12:42:48.365622Z,2024-06-01T12:42:48.365622Z,http://hawkins-thomas.com/
13f94ade448c4e7c9ad05442,6612947baddf941b98f24cc6,Wood-Wilkins,"Into say knowledge especially. Pick cut hot article.
Fall front PM several run better usually teacher. Real nor adult modern. Manager yourself at drop tax.",2024-02-16T12:42:48.365622Z,2024-04-18T12:42:48.365622Z,https://torres.biz/
fb75e84200564807ae7573ec,6612947baddf941b98f24cc6,Grant-Ferguson,"Commercial ball media American. Order end level Republican. Attorney I try.
Manager present significant. Radio build reflect we seek. Item catch usually create.",2024-03-13T12:42:48.365622Z,2024-05-16T12:42:48.365622Z,https://www.thompson.org/
8a65c7774f98452c8fe3fa02,6612947baddf941b98f24cc8,Williams LLC,"Together approach simple machine affect nation. By fire difference activity bill few.
Particularly wish clear work she office drug.",2023-10-14T12:42:48.365622Z,2024-06-20T12:42:48.365622Z,http://willis.com/
8488ffc816744dd1b842d595,6612947baddf941b98f24cc9,Christensen Ltd,Analysis charge training establish. Girl north run fill.,2023-04-30T12:42:48.365622Z,2023-10-15T12:42:48.365622Z,http://smith.com/
b5f695cdf17946429a9bcdc9,6612947baddf941b98f24cca,"Brown, Jenkins and Rodgers","Rather senior rate quality air animal. A ahead indeed somebody name ready.
Drop plan everybody house whole. Senior eight at.
Address say social officer through. Clear yard late study could.",2023-12-16T12:42:48.365622Z,2024-02-23T12:42:48.365622Z,https://www.chung.org/
aff216d075c543e9a14647bd,6612947baddf941b98f24cca,Evans Group,Low human meeting everybody data. Physical visit morning difference education level.,2023-06-04T12:42:48.365622Z,2023-08-15T12:42:48.365622Z,https://rivas-thomas.info/
f167c62e08604f38a0b3224a,6612947baddf941b98f24ccc,Nguyen-Williams,"Hand activity call since serve describe. Collection he anyone.
Point develop bad decade similar. Structure church suffer million week.",2023-08-14T12:42:48.365622Z,2023-11-07T12:42:48.365622Z,http://www.harris.com/
adfd8e7e3dc64f10b33842b4,6612947baddf941b98f24ccd,Cameron Group,"Consumer serious country his health. Among artist use letter young anything apply.
Speech because thing president they affect concern. Tough message effect difficult story pull.",2024-01-28T12:42:48.365622Z,2024-12-26T12:42:48.365622Z,https://adams-dillon.com/
a55606eef5254b9292cc5e11,6612947baddf941b98f24ccf,"Underwood, Graham and Mcclain",New development model week stop daughter bring whose. Company take word than. Do single once vote pressure the.,2024-01-07T12:42:48.365622Z,2024-05-07T12:42:48.365622Z,https://harrison.com/
e6851ecab4a7485f8a5f3c74,6612947baddf941b98f24ccf,Pugh Group,"Forward its policy only weight every manage. Benefit personal bank analysis available subject.
Analysis peace else suffer skill result. Property alone professor down mother.",2023-09-24T12:42:48.365622Z,2024-04-30T12:42:48.365622Z,http://perry-oneal.com/
daabc6bac3774e578d9ded7a,6612947caddf941b98f24cd1,Santiago-Warner,"Oil everything main recent drop thousand color. Those them rest expect worker yeah. Hope spring ask sing.
Pattern exist country movement.",2023-09-27T12:42:48.365622Z,2024-01-12T12:42:48.365622Z,http://www.carr.info/
e070ccd9a29e4417bdd65361,6612947caddf941b98f24cd2,Vega-Yang,Seek hold view. Season station purpose until special cultural no. Continue manager kind positive house themselves company since.,2023-10-06T12:42:48.365622Z,2023-10-29T12:42:48.365622Z,http://burnett.com/
ca466d18e32a4f7b9cc7d465,6612947caddf941b98f24cd3,Parker-Stone,"Friend building maintain exist five claim certainly read. Before build national interesting.
According board term. Human choice cause suddenly your necessary site. Election glass well art.",2023-10-02T12:42:48.365622Z,2024-08-10T12:42:48.365622Z,https://cruz.info/
22b248ff1f0c43b696c5253d,6612947caddf941b98f24cd3,Beck-Morris,"Series similar room per resource meet executive. Century effort seven. Have fill finally. Brother not guy agency.
Certain American operation dinner treat. Program last bad whatever he.",2023-04-21T12:42:48.365622Z,2023-12-24T12:42:48.365622Z,https://scott-brooks.info/
297b15cb6c5d42f7aca48fe3,6612947caddf941b98f24cd4,Williams Inc,"East human game special. These store physical wife hotel. Arm finally suddenly budget.
Administration field get.",2023-06-02T12:42:48.365622Z,2023-08-06T12:42:48.365622Z,http://www.lopez.net/
7b73d95260654af1a447b9e2,6612947caddf941b98f24cd4,Wilson-Rogers,"At sport right clearly cost. Occur different thank gas.
Girl without manager. Audience region three happen.",2024-03-01T12:42:48.365622Z,2024-04-25T12:42:48.365622Z,https://www.johnson.com/
97f2e4dd302b433191ef4065,6612947caddf941b98f24cd5,Brooks Ltd,"Energy statement arm go. Again red employee.
Provide above maintain. Doctor add maintain recent throw.
Commercial walk mission mouth blood. Special no interesting as.",2024-03-19T12:42:48.365622Z,2024-10-05T12:42:48.365622Z,https://www.ritter.com/
1b7b5be2b1bd4cccbcba1432,6612947caddf941b98f24cd5,Charles Inc,"Long even baby cultural responsibility surface picture. Often direction world sign.
Nature worker father window. Difference first apply.",2023-06-28T12:42:48.365622Z,2024-03-22T12:42:48.365622Z,https://williams-jones.com/
3c390a6ffd0345d8b571b47a,6612947caddf941b98f24cd6,Colon-Richardson,"View get chance. Trip him great fine majority director prepare.
His whose stand two. Company dream computer charge.
Personal through threat instead. Hot election since whatever which outside.",2024-03-06T12:42:48.365622Z,2024-12-11T12:42:48.365622Z,https://www.shepherd-fuller.info/
edb0b24330fb441d9a04b129,6612947caddf941b98f24cd7,"Swanson, Klein and Barrera","Forget join middle true travel onto.
Wish who anyone these always. Hot manage give finally would before.
Race power enjoy buy local impact read arrive.",2023-07-04T12:42:48.365622Z,2023-10-28T12:42:48.365622Z,https://english.net/
469764ee30ac440da77eeeb0,6612947caddf941b98f24cd7,Ward Group,"Open make authority little right.
Fire find learn common. Able treat explain class. Employee to resource enter consider physical.",2024-01-18T12:42:48.365622Z,2024-02-01T12:42:48.365622Z,http://lee.com/
065885f414cb40d79b409444,6612947caddf941b98f24cd8,Mcdowell-Stephenson,Teach every head animal paper we apply. Ten involve happen increase strong direction. Evening able court listen provide meeting build require.,2023-06-20T12:42:48.365622Z,2024-02-22T12:42:48.365622Z,https://holmes.com/
9fd4f30f0ee04b47be59ed77,6612947caddf941b98f24cd8,Bailey-Fernandez,"Give these during. Their support affect fly particularly character happy security. Particular black alone wrong action long.
Picture appear show medical factor into common. Trouble hit summer image.",2023-06-05T12:42:48.365622Z,2024-05-30T12:42:48.365622Z,http://stephens.info/
3e325402d12748dcb2b98ef2,6612947caddf941b98f24cd8,Hicks-David,Ask politics benefit team security size. Soldier machine chair subject lead carry. Movie trial high discuss place once increase.,2023-12-24T12:42:48.365622Z,2024-10-29T12:42:48.365622Z,https://www.simmons.com/
7c15aa06859e44e6ad02840d,6612947caddf941b98f24cdb,"Armstrong, Spencer and Williams",Hear tell challenge hotel power last. High each fund check up east station concern.,2023-06-05T12:42:48.365622Z,2023-12-30T12:42:48.365622Z,https://www.haas.org/
cf10e9a92a3b457688b49bf6,6612947caddf941b98f24cdb,Wade and Sons,"Goal south book economic. Partner walk follow.
Site then head free become help. Majority offer the why author skill. Compare eye letter region identify radio though provide.",2023-09-04T12:42:48.365622Z,2024-01-21T12:42:48.365622Z,https://www.williams.com/
cb3c0b4298df478d801dc97c,6612947caddf941b98f24cdd,Bell PLC,"Two industry action peace talk more. Actually Mr follow fly collection matter. Best they week.
Use age protect total north huge save street. Character wear green age.",2024-01-24T12:42:48.365622Z,2024-04-22T12:42:48.365622Z,https://www.nguyen.net/
0b28913d9f2d482da5eaddf0,6612947caddf941b98f24cdd,Klein-Goodman,"Indicate community no. Public writer data professor indicate radio side.
Day my mention imagine including southern.
Sign exactly bad own live. Alone forward safe reduce. Tv stuff hospital kid mind.",2023-08-31T12:42:48.365622Z,2023-09-18T12:42:48.365622Z,https://www.ellis.biz/
54944c596a804bee95adc64a,6612947caddf941b98f24cdd,"Wells, Robinson and Aguilar","Arrive not might. Skill management American paper they recently.
Cold ball information few maybe. Four certainly war teach talk. Letter rather far current term money.",2023-10-29T12:42:48.365622Z,2023-11-26T12:42:48.365622Z,http://fletcher.org/
8344dd712c7b4f85b8a7b283,6612947caddf941b98f24cde,"Adkins, Powers and Welch","Cost box ok finish. Together change especially industry quickly.
Wide resource live can. Bank range quickly away third.",2024-02-07T12:42:48.365622Z,2024-12-12T12:42:48.365622Z,https://www.brown.net/
4c0c75b2694743cebf79552d,6612947caddf941b98f24cdf,Turner Inc,"Teach six arm always. Goal star base already scientist word.
Team live store responsibility. Relate something morning people scene religious.",2024-03-09T12:42:48.365622Z,2024-12-08T12:42:48.365622Z,https://www.alvarado.info/
472300f9743b4020b5c37260,6612947caddf941b98f24ce0,Parker Group,Soldier without walk decide resource enough color. Month better tough blood arm trip TV.,2024-02-25T12:42:48.365622Z,2024-03-01T12:42:48.365622Z,https://www.benson.com/
5101eadf5f374ee285053c89,6612947caddf941b98f24ce0,Kelly-Williams,"Law explain exactly make section serve spring up. Draw arrive avoid rather let buy. Perform company professor bag technology.
Sometimes ten feel arm rather hope general.",2023-05-15T12:42:48.365622Z,2024-02-26T12:42:48.365622Z,http://hardy.com/
0a0a6a533ec242a182e19a84,6612947caddf941b98f24ce0,Wright-Webb,"Opportunity argue team visit. Impact concern art show team speak body. Could whatever mean.
Right it image good herself rest hard. Team space value statement.
Concern any entire wife computer.",2023-05-29T12:42:48.365622Z,2023-09-15T12:42:48.365622Z,http://proctor-lewis.biz/
6131694906894f5a8364a4a6,6612947daddf941b98f24ce3,Roberts-Lopez,"Technology take since year.
Political support institution fine religious smile. Modern view production near soldier.
After person always.",2024-03-19T12:42:48.365622Z,2024-11-24T12:42:48.365622Z,http://morales-williams.net/
e6f510af137744598b45f524,6612947daddf941b98f24ce4,Hays-Small,"At national prove quickly. Tax among gun part.
Improve box reach own statement purpose.
Look let position research similar late read both.",2023-06-30T12:42:48.365622Z,2023-07-13T12:42:48.365622Z,https://pearson-vaughn.com/
2941f563f77342ceaec8c5c5,6612947daddf941b98f24ce4,"White, Parker and Fernandez","Increase few our woman ten. Focus citizen push represent.
Act force agency. Direction seem hear travel family couple art.
Follow season address hot traditional.",2023-05-27T12:42:48.365622Z,2023-07-09T12:42:48.365622Z,http://www.rodgers.com/
de68e2d9d0bf44fe992cb764,6612947daddf941b98f24ce5,"Valdez, Duarte and Richardson","Rest today raise reflect join. Four family hospital kitchen. Employee unit memory force sister.
Work marriage recent. Station have degree station necessary a. Population how have seem woman.",2023-05-27T12:42:48.365622Z,2023-06-19T12:42:48.365622Z,https://www.campbell.org/
7eab5f7ed52a4cdea4081de7,6612947daddf941b98f24ce5,Frey-Scott,Choice however season sense really doctor fish. Training car similar head condition performance. Staff hold home possible growth themselves finally right.,2023-09-19T12:42:48.365622Z,2024-08-13T12:42:48.365622Z,https://ramirez.biz/
c2d04983f2c14f06860cc092,6612947daddf941b98f24ce5,"Barber, Miller and Armstrong",She beyond street she water. Agent fill morning get argue pressure. Everybody much against foreign drive.,2024-03-25T12:42:48.365622Z,2024-05-27T12:42:48.365622Z,http://www.mullins-phillips.com/
e997d3189d894e83a9aa9398,6612947daddf941b98f24ce6,Cannon-Howard,Choice huge low management hundred. Term American win point challenge do newspaper value. Start police if option city.,2024-03-07T12:42:48.365622Z,2024-08-18T12:42:48.365622Z,http://www.jensen.com/
20d676a9ab00435e9098d1c3,6612947daddf941b98f24ce6,Gomez Inc,Fight particular drop car air education center. Decide development speak general. National explain ever quality religious need.,2024-01-24T12:42:48.365622Z,2024-04-13T12:42:48.365622Z,http://archer.com/
a8a736aaa5d84e76a06db81c,6612947daddf941b98f24ce6,"Hernandez, Gonzalez and Nelson",Step husband page kid team move structure. Sell general professional site. From field finish clear together small whether security.,2024-01-16T12:42:48.365622Z,2024-12-05T12:42:48.365622Z,https://www.contreras.net/
d6188316bd474065a8e90c11,6612947daddf941b98f24ce7,"Peck, Riley and Harris",Change yard weight teach article political research military. Sort four several subject describe take.,2023-07-13T12:42:48.381190Z,2024-05-06T12:42:48.381190Z,http://garza-webster.com/
e34d83f594ad49c8b501b43b,6612947daddf941b98f24ce8,"Abbott, Acosta and Smith","Five final appear listen. Defense down wide themselves. Radio military employee field word suggest myself.
Pull read ahead.",2023-05-11T12:42:48.381190Z,2024-03-12T12:42:48.381190Z,https://perez-smith.info/
cd07bfe3cf01401181f2ac6a,6612947daddf941b98f24ce8,Shelton-Calderon,"According partner simple night. Mean paper current everything since house. Again bit short natural game long.
Agent out first eye finish now standard. Professional daughter actually toward life.",2024-03-26T12:42:48.381190Z,2024-04-27T12:42:48.381190Z,http://www.roberts.info/
18a88ea005464600ba0b98d1,6612947daddf941b98f24ce9,"Wagner, Holloway and Lloyd","Cultural road town letter. Wind argue who product woman. Former staff impact loss. Test among hour phone if.
Out determine customer during. City describe measure here turn consider work.",2023-08-04T12:42:48.381190Z,2023-11-25T12:42:48.381190Z,https://davis-rodgers.net/
de188364fa03490583afbe66,6612947daddf941b98f24cea,Bennett Inc,"Fund attention because. Win guess office.
Need section majority officer. Technology college purpose past card student law. Daughter discuss author reflect role soldier.",2023-04-18T12:42:48.381190Z,2024-03-31T12:42:48.381190Z,http://www.watkins.biz/
67df321c46a94fe2b8cc6dea,6612947daddf941b98f24ceb,Rodriguez-Cooper,"Near turn tend item people question. Believe someone by son network sign Congress.
Oil since particularly prove quickly about. Production guy always body idea stock after want.",2024-01-25T12:42:48.381190Z,2024-10-24T12:42:48.381190Z,http://hawkins.com/
93d31af09bf044ed8a370120,6612947daddf941b98f24cec,"Hammond, Smith and Henry","Somebody work prevent loss. Its month second continue strong.
Fast role success generation price. Assume act officer kind or. Such agreement argue evidence opportunity significant spring.",2023-05-29T12:42:48.381190Z,2024-03-20T12:42:48.381190Z,https://www.rodriguez-smith.com/
3cfc2f4d9b2244a799cb89e5,6612947daddf941b98f24ced,King-Huff,Word structure watch never above ball behavior something. Let language consumer among class between.,2023-05-02T12:42:48.381190Z,2024-02-06T12:42:48.381190Z,http://www.bridges.net/
4d0e0c3dc5ea4be591876143,6612947daddf941b98f24ced,Mcclure-Blair,Environment sort along knowledge. Poor several could participant. Agency mission across laugh such account ready.,2023-08-30T12:42:48.381190Z,2024-05-07T12:42:48.381190Z,https://williams.com/
11a4960b5d5e4a09a1376ae6,6612947daddf941b98f24cee,Barrera-Long,"Sort race environmental reveal page lawyer between. Follow see never small probably author. Teach determine statement toward collection above address.
Seem employee late want front.",2023-12-08T12:42:48.381190Z,2024-03-19T12:42:48.381190Z,http://colon-cole.org/
24720c028b3c4fa997a8ebe2,6612947daddf941b98f24cee,Turner and Sons,"Thousand hit fast decade.
Participant environmental debate boy. Whom market stock agree east life.
Professor would moment college end forward. Painting between most agreement.",2023-07-22T12:42:48.381190Z,2023-07-31T12:42:48.381190Z,http://www.murphy.com/
b6d8d9bca87e403895547dab,6612947daddf941b98f24cef,Rosales LLC,Water most remain method represent single technology. These until painting left Republican build lose. Since military take minute will finally.,2023-12-02T12:42:48.381190Z,2024-09-07T12:42:48.381190Z,http://www.ho-ortiz.net/
