_id,userId,projectName,description,startDate,endDate,supportedDocumentLink
2dcea92a2fb04fcca63edd1e,66129472addf941b98f24c40,Acevedo-Thomas,"Situation father peace tough. Feel sea as free whatever from. Race too fast similar word.
Run firm road keep fall husband rock. These thought maintain really white.",2023-11-27T12:42:48.310995Z,2023-12-07T12:42:48.310995Z,https://nunez.com/
6d4e501371a149e5b25a6d10,66129472addf941b98f24c41,Medina Ltd,"Test available military determine throughout.
Media first partner consider. Point of send worker performance. Try manager reflect ball environment hard.",2023-08-16T12:42:48.310995Z,2023-10-27T12:42:48.310995Z,http://zimmerman-berry.com/
ea5f3a36872a4aefb0f437a7,66129472addf941b98f24c41,Horne PLC,"Affect drop increase mission involve.
Sometimes institution future sing. Peace blood activity example or present your. Somebody environmental answer.",2023-11-23T12:42:48.310995Z,2024-10-17T12:42:48.310995Z,https://ellis.com/
3fbb7ad4f86d49798b52310b,66129472addf941b98f24c41,Johnson-Young,Large participant with suddenly material start. Community remember table unit soldier leader seem. Available hand price.,2023-05-22T12:42:48.310995Z,2023-12-03T12:42:48.310995Z,https://www.parsons.com/
0dbf60073c2b4a15aa8691e5,66129472addf941b98f24c42,Baker and Sons,"Check court statement fast. Consumer door point today middle friend view.
Republican party finish issue dog admit lawyer. Statement few focus around exist before.",2023-11-28T12:42:48.311996Z,2024-01-07T12:42:48.311996Z,http://www.archer.com/
8ae04e7ec9fc453c95045f99,66129472addf941b98f24c42,Lee-Owens,"All teacher cold writer a. Manage consumer enjoy officer director argue.
Practice night whatever officer hear financial and just. Experience support stand. Allow exactly common somebody.",2023-11-23T12:42:48.311996Z,2023-12-23T12:42:48.311996Z,http://bennett.org/
9837593beebe4a8da8abd137,66129472addf941b98f24c43,Clark Ltd,"Ten performance garden eye.
Floor watch movement beyond increase might decision. Skin early ok program of bad. National sea own detail six manage. Of follow will professor.",2023-04-10T12:42:48.311996Z,2024-01-22T12:42:48.311996Z,https://www.hart-kidd.com/
6988fe4f944643459b1e05d1,66129472addf941b98f24c43,"Chan, Salas and Bradley",Friend realize rather work. Age prevent remain live should realize.,2023-12-04T12:42:48.311996Z,2024-02-01T12:42:48.311996Z,http://www.bullock.biz/
7f15c0a5c3bf46779e495253,66129472addf941b98f24c43,Berry-Pacheco,"Score market bit relate up authority benefit short. Manage sport usually minute. Career miss practice sit.
Management commercial water thank person crime.",2024-03-07T12:42:48.312989Z,2024-11-03T12:42:48.312989Z,http://www.tanner.biz/
785b5acde8724fe69cdffd01,66129472addf941b98f24c44,Warner-Williams,"Last minute significant court win available thank. Reveal movie bill movie.
At wind class least floor those dog. Pick involve time piece commercial down tree.",2023-06-06T12:42:48.312989Z,2024-03-09T12:42:48.312989Z,http://www.mendoza.com/
30fda265ac0a401fabd5275c,66129473addf941b98f24c45,"Santos, Carter and Lopez",Explain military arm I opportunity street support. Record nearly image baby. Work dream sort up yeah.,2023-09-21T12:42:48.312989Z,2024-07-23T12:42:48.312989Z,https://lawrence.biz/
2463bcc2c5de4152a158ab1f,66129473addf941b98f24c45,Adams-Lawson,Executive experience discussion glass country season single. Its term party foot financial.,2023-04-20T12:42:48.312989Z,2023-06-04T12:42:48.312989Z,http://hebert.com/
714e134b124d4978bfe759b5,66129473addf941b98f24c46,"Mills, Sandoval and Garcia",Itself rest truth in why onto. Likely image form throughout project not.,2024-03-20T12:42:48.313992Z,2025-02-16T12:42:48.313992Z,https://www.little.com/
2340a1459dd8412db381ecd4,66129473addf941b98f24c46,Bryant-Martin,"Offer other product laugh yeah level. Baby military force place.
Them somebody partner far outside good population. Why seem investment race.",2024-03-12T12:42:48.313992Z,2024-07-14T12:42:48.313992Z,http://ellison.net/
f7da4767f2a34a70bd5ce7de,66129473addf941b98f24c46,"Stewart, Garcia and Moyer","Teacher music test concern risk. Early special party notice develop human.
Hit democratic bit much radio wide shoulder generation. Exactly buy professor these.",2023-08-20T12:42:48.313992Z,2024-03-28T12:42:48.313992Z,http://salas-ellison.org/
2560d45f74f54b28b3d32ef6,66129473addf941b98f24c48,Kennedy PLC,Tend shake increase their forget design. Data these watch here check sport. Fact my letter. Know amount institution create laugh coach.,2023-09-24T12:42:48.315012Z,2024-07-23T12:42:48.315012Z,http://rodriguez.net/
a32e267f77e8470d86f3aea0,66129473addf941b98f24c48,Navarro Group,Wrong quite five environmental more. School bit pattern station either send. Wide effort evidence close music author.,2023-08-16T12:42:48.315012Z,2023-09-05T12:42:48.315012Z,https://www.moreno.info/
cedbb225e85541d3bd735fac,66129473addf941b98f24c48,Welch PLC,So stock stand meeting pretty city generation machine. Treat cover ok them marriage this. Summer fire stage serious.,2023-12-22T12:42:48.315012Z,2024-04-07T12:42:48.315012Z,http://www.miller.net/
40579ecddfde4a459f4bb844,66129473addf941b98f24c49,Jackson-Kline,"Education require south order old. Rather ready mind simply leave particular. Unit travel sense view.
Agency music kitchen media hope trial audience. Activity minute yard western hot tend.",2023-10-28T12:42:48.315012Z,2024-09-23T12:42:48.315012Z,http://sanchez-hamilton.net/
1f05236e89484064884a8534,66129473addf941b98f24c49,Carroll-Smith,"Attention generation north theory skill fast. Fear listen floor Mr how likely these. Right election physical.
However up indicate old reduce. Yes charge exist where interest what.",2023-07-23T12:42:48.315908Z,2024-05-03T12:42:48.315908Z,https://www.smith.com/
df4fad84148741ce86df6216,66129473addf941b98f24c4b,Valdez-Wilcox,Their forward compare fish lawyer him. Little several its relate even.,2023-06-05T12:42:48.315908Z,2023-11-11T12:42:48.315908Z,https://www.reed.org/
991519f4a21846a5888abadc,66129473addf941b98f24c4b,Williams-Greene,"Above step town close none. Structure support finally dinner reality.
Theory might face environment section before. Behind yet firm head. Everyone those game even. Job soon wear under if.",2023-11-10T12:42:48.315908Z,2024-08-29T12:42:48.315908Z,https://hernandez.com/
9b50515891e8462a91599382,66129473addf941b98f24c4c,Hicks Ltd,"Institution save mouth imagine. Indeed charge data onto hot stop form.
Describe debate reduce before bill second hard. Decision really form after interesting officer series simply.",2023-07-30T12:42:48.316987Z,2024-01-16T12:42:48.316987Z,http://www.juarez-sanchez.biz/
224c9b2c20714c2bb5e0e417,66129473addf941b98f24c4c,Miller PLC,"World concern company. Experience though level Congress military director culture.
His structure of wall. Like remain test rock have. Court stage cost else. Improve represent mind.",2024-01-08T12:42:48.316987Z,2024-04-14T12:42:48.316987Z,http://www.avery.com/
704bbc17694b4b57b7376f86,66129473addf941b98f24c4d,"Ferguson, Hernandez and Rodriguez","Various small almost industry some. Voice finish probably fly suddenly event role.
Price financial federal table. Prove then determine physical city.",2024-03-09T12:42:48.316987Z,2024-06-17T12:42:48.316987Z,https://www.owen.net/
d09f523c04f44a2789aa0c59,66129473addf941b98f24c4e,Murray-Hernandez,Commercial consumer also fish instead always inside clearly. Upon yes you animal and voice. Bad experience city politics goal fact.,2024-01-11T12:42:48.316987Z,2024-09-26T12:42:48.316987Z,http://frye.info/
1145130f37344c949ab12f37,66129473addf941b98f24c4f,Brown-Humphrey,"Home computer animal. Season idea PM coach.
Together how stop from. Choice do chair off picture pretty. Stage suggest stand become foot return.",2023-12-28T12:42:48.316987Z,2024-06-23T12:42:48.316987Z,http://becker.info/
ad80266a51aa46cca1beef4f,66129473addf941b98f24c4f,"Krueger, Hurley and Nichols","Generation debate back individual especially little. Daughter best billion scene population all. Walk pass development rule simply.
Available seven picture represent office every.",2023-12-13T12:42:48.317996Z,2024-04-28T12:42:48.317996Z,http://www.calderon-bartlett.org/
064c7ed52e93409abea6ce7c,66129473addf941b98f24c4f,Johnston-Jennings,Maybe experience day though themselves here color create. Better alone trouble specific range. Human federal smile send behind position a.,2023-07-11T12:42:48.317996Z,2024-01-02T12:42:48.317996Z,http://www.edwards.com/
2590440554b04633bab69267,66129473addf941b98f24c50,Vincent-Garrett,Good store similar age participant meeting. Enough system production apply leader newspaper skin modern. Travel window think PM that.,2023-08-29T12:42:48.317996Z,2024-08-09T12:42:48.317996Z,https://www.campbell-cox.net/
5ed41e707db94bf78c077768,66129473addf941b98f24c50,"Vargas, Simmons and Thomas","Somebody next thousand serious. Pressure forward should tree run.
Moment instead born house third have. Science cell eight same kitchen. Stuff yet nice a tough. Tonight hand difficult process.",2023-11-06T12:42:48.318998Z,2024-03-11T12:42:48.318998Z,http://www.duncan.com/
6ca1f0de74b9471a8c42b884,66129473addf941b98f24c50,"Lynch, Reid and Daniels","Play political bag bill per above skin. Factor black since cold garden most. Simple wife include.
Everyone wall forward your finally near. For glass change meet. Central mother machine.",2024-03-26T12:42:48.318998Z,2024-09-18T12:42:48.318998Z,https://hicks.org/
22396eeacb1c4d4ea0753159,66129473addf941b98f24c54,"Davis, Wagner and Petty",Son tend nature administration society director free. Deal including do difficult law. Within about maybe.,2024-03-13T12:42:48.318998Z,2024-10-27T12:42:48.318998Z,https://johnson.info/
6aa7a22611ec466d83716f39,66129473addf941b98f24c54,Little-Edwards,"Movie state manager a close so participant. Tax once play far.
Adult heavy first relate baby want skin. Perhaps half health receive level put improve.",2024-03-26T12:42:48.319999Z,2024-04-13T12:42:48.319999Z,http://dixon-luna.biz/
284476221d854079a9ce0f2b,66129474addf941b98f24c56,Woods Ltd,"Fly task social.
Seek lawyer feel smile cut artist success. Tv bring certainly grow whom family hear step. Always some fish wall challenge few. Above ever authority three not.",2023-04-28T12:42:48.319999Z,2023-12-07T12:42:48.319999Z,http://www.schultz-harris.net/
827bbb111e984dcb9281bd33,66129474addf941b98f24c57,Dawson-Elliott,"Cost even hand put. Already nation evening onto term.
Nor figure fear capital bag you brother. Society affect life may maybe return sell. Price include body discussion beautiful run light increase.",2023-05-15T12:42:48.319999Z,2024-02-03T12:42:48.319999Z,http://gardner.com/
ba36055568eb45049376a704,66129474addf941b98f24c5a,Ferguson Inc,"Be theory live work. Eat house dinner move future never eye debate.
Just generation system feeling determine. Free tell likely.",2023-08-09T12:42:48.319999Z,2024-07-05T12:42:48.319999Z,http://www.watson.com/
88719e1e8aee498c996526ad,66129474addf941b98f24c5a,Murphy Group,Anyone ten certain should high even sing. Central heavy center choose. Deal they low follow able.,2023-12-11T12:42:48.320995Z,2024-06-27T12:42:48.320995Z,http://www.cox-hunt.com/
bab707b9dc474af38d8a0eb8,66129474addf941b98f24c5a,"Fields, Scott and Allen",Treatment financial a head resource. Shoulder Mrs before listen offer win alone. Election message talk move similar inside. Leg day door include much.,2023-12-18T12:42:48.320995Z,2024-10-18T12:42:48.320995Z,http://www.moore-henry.net/
9e4b0b808edd4cb59df56ec4,66129474addf941b98f24c5b,Douglas-Lee,Small week note range authority we street. Figure east look once early police star range. Family cause ahead must night. Instead evening whole million soldier strong manage.,2024-01-30T12:42:48.320995Z,2025-01-19T12:42:48.320995Z,https://krueger.com/
d0ffed62279748b4accca5d6,66129474addf941b98f24c5b,"Newman, Brown and Pierce","Sell score store evening four. Necessary fight they call.
Attack along understand matter. Identify majority nearly rate third trouble.",2024-02-07T12:42:48.320995Z,2024-07-13T12:42:48.320995Z,http://bryant.net/
3133b08bf50e49e39bb84788,66129474addf941b98f24c5c,Li PLC,"Well several speech baby trip. Each big six onto generation chance long. Home second rate piece data simply.
Reduce message force box pull. Hotel bad like media.",2023-11-01T12:42:48.321996Z,2024-08-20T12:42:48.321996Z,http://www.hardy-stevens.com/
780f082cde214638b90c6f58,66129474addf941b98f24c5c,Walker-Short,"Require break wall next type see. Particularly pass believe plan.
Couple hotel subject hand success difficult.",2023-12-03T12:42:48.321996Z,2024-10-16T12:42:48.321996Z,http://www.osborn.info/
0f142a572f2a48bba6fb78a1,66129474addf941b98f24c5c,Kelley-Ferrell,Short feeling energy research happen under. Attention drug level what street.,2023-11-19T12:42:48.321996Z,2024-01-03T12:42:48.321996Z,https://www.hall.com/
1999ab29909d4b09867ed3e2,66129474addf941b98f24c5d,Orozco-Rogers,"Improve focus resource lawyer small tough box cause. Hundred behind use sign bring bring young thank.
Thank water movement. Method interest change on community.",2023-05-23T12:42:48.322996Z,2024-05-17T12:42:48.322996Z,http://wong.biz/
85152448e8434d1a99b614f0,66129474addf941b98f24c5d,"Merritt, Gonzales and Chen","Mr product our year.
Yet scientist major either much kitchen alone. Attorney really wait.
Speech do report size. Ability table before. Individual investment care quickly price effort leader as.",2024-02-11T12:42:48.323183Z,2024-04-19T12:42:48.323183Z,https://www.holloway.com/
594433e932dc42329a7b3233,66129474addf941b98f24c5e,Smith Inc,"Seem information prove inside state picture. Computer pattern effort figure what southern. Wonder produce past popular little its.
Vote trade PM during experience indeed. Gun keep way film poor risk.",2023-04-17T12:42:48.323183Z,2023-07-29T12:42:48.323183Z,https://www.collins.com/
f57c4874ac634c9793972e05,66129474addf941b98f24c5f,Stone-Robbins,"Rich interest consider customer certainly use. Enough explain dream least board computer whatever.
Value avoid after food floor hot. Within Democrat PM central. Eat head situation.",2023-11-01T12:42:48.323183Z,2024-09-12T12:42:48.323183Z,http://thompson.com/
ec13d5c8d4f64a42b928c91a,66129474addf941b98f24c5f,"Maxwell, Warner and Graham","Feel smile school free financial continue rate. Such night dream stand also type picture.
Manage old nothing something. Our around away soon vote west door. Base throughout seat international.",2023-08-17T12:42:48.323183Z,2023-12-29T12:42:48.323183Z,http://www.reed.com/
268a4f1410a748d58f1aa037,66129474addf941b98f24c5f,"Martin, Logan and Hernandez","Image build economy federal.
Quite across together Mrs free inside figure. Congress structure when.",2023-05-09T12:42:48.323183Z,2023-06-16T12:42:48.323183Z,http://nash-perez.org/
22fdc4aec96247d386cb3d9d,66129474addf941b98f24c60,"Blair, Dyer and Horton","Rate first role group fish. Wear must fire still simply only.
Forward develop condition drop western. Believe two young.",2024-02-13T12:42:48.323183Z,2024-07-14T12:42:48.323183Z,https://thomas-good.com/
c476ea5aa758483c8f534c6c,66129474addf941b98f24c60,Turner-Michael,"Age analysis civil down interesting ok. Statement describe skill wall use wait this.
Support public according here ahead suddenly size.
Father health myself sell human. Live although improve rather.",2024-04-05T12:42:48.323183Z,2024-04-18T12:42:48.323183Z,http://www.jones.org/
ce98f52c75e247409d2d62a5,66129474addf941b98f24c61,"Lester, Phillips and Wallace",Same PM player determine some mother affect. Pass fast seem community at also me without. Sign get dinner mind husband.,2024-04-01T12:42:48.323183Z,2024-05-03T12:42:48.323183Z,http://lopez.biz/
14065f92796846b3bfcb60df,66129474addf941b98f24c61,Kane Group,Page poor never film. Type leader writer Congress whose cell. Action event song mind table head.,2023-08-10T12:42:48.323183Z,2024-06-07T12:42:48.323183Z,https://sharp-cohen.org/
01ee694933f54afc90e5bbc8,66129474addf941b98f24c61,Jones-Lopez,"Pull during build around give put offer.
But price here high. Hair cold such environment your. Quite number far civil stuff indeed should Congress.",2023-06-27T12:42:48.323183Z,2023-11-27T12:42:48.323183Z,http://www.green.com/
7b203217a8db49cb885bae36,66129474addf941b98f24c62,Pacheco-Austin,"Rise late attorney together music live.
Increase mind concern listen than clear little back. Per easy baby job raise know get. Thought whatever simple detail get.",2024-01-26T12:42:48.323183Z,2024-11-13T12:42:48.323183Z,http://www.day.com/
d9bd7bc199ca4b848760e03a,66129474addf941b98f24c62,Thomas Group,"Food ago after.
Attack culture throughout weight either environmental take. Next nature office network than nor. Option employee bring music.",2023-10-31T12:42:48.323183Z,2024-08-09T12:42:48.323183Z,https://www.ray.net/
e3c5d85bbbf9472db9837658,66129474addf941b98f24c62,Mosley Group,She explain pressure. Page reality tonight something person responsibility defense. Foreign message miss his win power.,2023-04-19T12:42:48.323183Z,2024-01-11T12:42:48.323183Z,https://tucker.com/
612fd5d547c145c9a0daf63e,66129474addf941b98f24c63,Rodriguez-Turner,Society walk leg whatever capital face. Tax stuff our education soon single loss.,2023-05-28T12:42:48.323183Z,2023-11-21T12:42:48.323183Z,http://anderson.biz/
0913d5ee0ab947f287ab18f3,66129474addf941b98f24c63,Phillips-Clark,"Where quite some key of your training. Dream professional begin star.
Involve not score animal game friend community. Know exist truth control look if rest. Especially especially have name despite.",2024-02-24T12:42:48.323183Z,2024-07-11T12:42:48.323183Z,http://jones.com/
daa1f9e746784552a4eecbbc,66129474addf941b98f24c63,"Spencer, Mcclain and Mitchell","Up soldier positive again worker by rich employee. Test size like born figure later father.
Though campaign development industry moment budget song.",2023-09-12T12:42:48.323183Z,2023-12-27T12:42:48.323183Z,https://www.alvarez.org/
a94c1bbbb64f47e6bc7c6b26,66129475addf941b98f24c65,Arias-Atkinson,Many thousand this executive hit no. Try simple computer development yes. Large big word wind line else.,2024-01-27T12:42:48.323183Z,2024-12-03T12:42:48.323183Z,http://www.robinson-banks.com/
5ce43ce4b88845349ec02426,66129475addf941b98f24c65,"Smith, Ochoa and Moore",Use large sit argue medical again. Learn individual since manager put.,2023-11-12T12:42:48.323183Z,2024-08-29T12:42:48.323183Z,http://www.martinez.biz/
5b2988f5ac064cbc80ec9bae,66129475addf941b98f24c65,Oliver-Ramos,Hospital suddenly view news institution run. Story dinner throw standard test far short significant.,2023-08-23T12:42:48.323183Z,2024-07-30T12:42:48.323183Z,https://walker-yang.info/
4bea01c788784789b2595b86,66129475addf941b98f24c66,"Harris, Anderson and Thomas",Again middle rather part place speech rate western. Have boy summer organization official really wife situation. Science citizen structure head job.,2023-11-25T12:42:48.323183Z,2024-07-06T12:42:48.323183Z,https://www.clark.biz/
88c0abe79ec2443baf9db412,66129475addf941b98f24c67,"Clayton, Phillips and Miller",Toward behind responsibility difference second store. For let receive thus. Financial thus enough city term world.,2024-03-25T12:42:48.323183Z,2024-05-02T12:42:48.323183Z,https://long.com/
927162ece9dc4a929a5597dd,66129475addf941b98f24c67,Duffy-Baker,"Necessary attention method staff blood during. Trip kitchen economic teacher head campaign summer. Treat foot like throw.
Suffer TV bad without grow.",2023-05-02T12:42:48.323183Z,2023-07-19T12:42:48.323183Z,http://www.bullock.com/
0263fda4a05e44ac985d02a7,66129475addf941b98f24c69,Koch LLC,Light down husband. Board amount door money always society identify.,2023-04-22T12:42:48.323183Z,2024-03-14T12:42:48.323183Z,http://www.leon.com/
d027c8f8bbdf4bd1b4fad7f7,66129475addf941b98f24c69,Chase-Johnson,Administration black perform top. Rather beyond hear enough. Political soldier opportunity human real difference.,2024-04-06T12:42:48.323183Z,2024-12-20T12:42:48.323183Z,https://kelly-garcia.net/
a41e100931254eb488e0eb73,66129475addf941b98f24c69,Lopez PLC,Though surface fire policy. Often civil voice special. Like lead less key language game.,2023-07-10T12:42:48.323183Z,2023-11-21T12:42:48.323183Z,https://www.moore.com/
ed185121bf934c4b9a11944c,66129475addf941b98f24c6a,"Armstrong, Mueller and Roberts","There southern we goal fill. Region writer increase there source.
Player person painting perhaps win financial. Economic investment have everybody.",2023-04-18T12:42:48.323183Z,2023-10-09T12:42:48.323183Z,http://turner.biz/
22e18ef539ac45ceba559697,66129475addf941b98f24c6a,"Wilson, Garcia and Martinez","Weight civil condition country along art. Benefit newspaper material town toward they model.
Investment short ball record government. Customer within bar score say really.",2024-03-15T12:42:48.323183Z,2024-08-27T12:42:48.323183Z,http://king.com/
623b2e8da65f43af83311e4e,66129475addf941b98f24c6a,Dunn-Barber,"Bank pull increase far people glass dinner. Real now respond choice political Democrat.
Identify card day. Cup author tend leg trip capital.
Like participant machine attorney direction last.",2024-01-27T12:42:48.323183Z,2024-03-23T12:42:48.323183Z,https://sherman.com/
059e5263c293401190e2b0b9,66129475addf941b98f24c6c,Mendez Group,"President answer myself sing minute. Nice cut meeting alone ability. Specific former water history difference sell.
Practice already thus reduce federal type. Into buy purpose act more case.",2024-01-21T12:42:48.323183Z,2024-07-18T12:42:48.323183Z,http://www.golden.com/
453fd104ed094ddaa1fb422d,66129475addf941b98f24c6c,Rogers Group,Successful off reveal many. Statement prevent skill prove design protect financial. Star image consumer. Wall feel since ability development necessary sell.,2024-02-21T12:42:48.323183Z,2024-03-19T12:42:48.323183Z,https://www.burns-jones.com/
f13a0bc546e44d6983a75bd0,66129475addf941b98f24c6e,"Phelps, Woodard and Lynn","Learn response physical hour off safe yourself.
Role around just give sense far kid. Report music particularly. Heart share simply key teach.",2024-03-07T12:42:48.323183Z,2025-02-24T12:42:48.323183Z,http://norris.com/
e7ac25015ee44e858656bf09,66129475addf941b98f24c6e,"Roach, Martin and Nichols","Forward believe any Mr total research piece. Material receive hard development agency fish notice south. Art southern something.
Tell weight mission short protect important right.",2023-09-28T12:42:48.323183Z,2024-04-10T12:42:48.323183Z,http://edwards-brown.biz/
e3367ab5e2e94dcfbb262a6b,66129475addf941b98f24c6f,"Wolfe, Moore and Allen",Dream key mission trial agent play. Next however above result candidate because. Go network organization certainly above evening computer.,2024-02-15T12:42:48.323183Z,2024-08-11T12:42:48.323183Z,http://coleman-booker.biz/
cfc784d6ed81428299484d2b,66129475addf941b98f24c6f,Fox PLC,"When business floor side fall human. Forward make rock artist door author. Budget like manage hundred.
Five recent drop choice. Again situation these fund product unit ask.",2024-03-28T12:42:48.323183Z,2024-03-30T12:42:48.323183Z,https://www.rodgers.biz/
36c06a78a821496f977d1c67,66129475addf941b98f24c71,Dalton-Torres,"Its same wait apply smile. Soldier risk interest apply although whose goal.
Safe point which under. High citizen employee race none whether. Fight hold successful sing law college.",2023-11-29T12:42:48.323183Z,2024-06-11T12:42:48.323183Z,http://campbell.biz/
16b1491c84df44c9b1058e7b,66129475addf941b98f24c71,Harmon-Moore,Throw study model writer well both they. Include trade safe fine between during civil. Already painting power local much mind ball. Small arrive grow model state never.,2023-07-28T12:42:48.323183Z,2023-12-21T12:42:48.323183Z,https://www.miller-freeman.com/
bc209203c1634fbd8415293a,66129475addf941b98f24c71,Chavez and Sons,"Discuss argue him process relationship question specific. Interview indeed work data.
Without cup half before clear little stage. Republican certain miss technology recent.",2023-12-25T12:42:48.323183Z,2024-01-31T12:42:48.323183Z,https://baker.info/
9eb2d22f07224281a5d75969,66129475addf941b98f24c74,Gutierrez Ltd,"Sometimes black former whom. Include free go up sing. Officer begin letter foreign event foot. Big project line shake.
Catch language current.",2023-12-06T12:42:48.323183Z,2024-06-29T12:42:48.323183Z,http://clark-mora.com/
88e5d4de8e5b42e595168776,66129475addf941b98f24c74,"Jimenez, Jacobs and Rodriguez","Process some much tough be image.
College quite relationship. Sort say six soldier build join.
Rich whom clear southern again positive particular. About front thought speech politics help.",2023-08-03T12:42:48.323183Z,2024-06-04T12:42:48.323183Z,http://www.pena.biz/
5c4c2a0021a740908816b64c,66129476addf941b98f24c75,"Frazier, Wright and Marks",Picture animal that those space. Ahead consider already wind turn exactly. Plant feeling drug ever eye. Also become get.,2023-09-08T12:42:48.334292Z,2024-07-04T12:42:48.334292Z,http://www.wright.com/
b3b921ce7fa1425da72c9122,66129476addf941b98f24c75,Whitney Group,"Reason but college also. Smile involve wide recent effort social.
Rock record various. Per doctor season get. Air mouth last each thousand dream into.",2023-12-16T12:42:48.334292Z,2024-11-07T12:42:48.334292Z,https://www.wright.com/
6d0110981ba843389f9b113d,66129476addf941b98f24c76,Waters-Lopez,"Professional than year well few plan. Better news dark per these lot mention.
National watch argue wide article that color.
Indeed market better debate free. Focus bad black.",2023-04-15T12:42:48.334292Z,2024-01-19T12:42:48.334292Z,http://young.com/
8832adf75f494ae1bc30fa90,66129476addf941b98f24c76,Garcia Ltd,"Second music lead almost.
One American difference production read lead find. Bit send there. Onto single good surface term soldier.
High fight remain social. As read care politics interest four.",2023-08-26T12:42:48.334292Z,2024-04-22T12:42:48.334292Z,https://www.mahoney.com/
